[INFO] Scanning for projects...
[WARNING] 
[WARNING] Some problems were encountered while building the effective model for de.ahus1.keycloak.dropwizard:domain:jar:1.2.1-SNAPSHOT
[WARNING] 'build.plugins.plugin.version' for org.apache.maven.plugins:maven-source-plugin is missing. @ de.ahus1.keycloak.dropwizard:keycloak-dropwizard-parent:1.2.1-SNAPSHOT, /home/gabsko/breaking-updates/pom.xml, line 142, column 21
[WARNING] 
[WARNING] Some problems were encountered while building the effective model for de.ahus1.keycloak.dropwizard:simple-war:war:1.2.1-SNAPSHOT
[WARNING] 'build.plugins.plugin.version' for org.apache.maven.plugins:maven-source-plugin is missing. @ de.ahus1.keycloak.dropwizard:keycloak-dropwizard-parent:1.2.1-SNAPSHOT, /home/gabsko/breaking-updates/pom.xml, line 142, column 21
[WARNING] 
[WARNING] Some problems were encountered while building the effective model for de.ahus1.keycloak.dropwizard:keycloak-war:war:1.2.1-SNAPSHOT
[WARNING] 'build.plugins.plugin.version' for org.apache.maven.plugins:maven-source-plugin is missing. @ de.ahus1.keycloak.dropwizard:keycloak-dropwizard-parent:1.2.1-SNAPSHOT, /home/gabsko/breaking-updates/pom.xml, line 142, column 21
[WARNING] 
[WARNING] Some problems were encountered while building the effective model for de.ahus1.keycloak.dropwizard:keycloak-dropwizard:jar:1.2.1-SNAPSHOT
[WARNING] 'build.plugins.plugin.version' for org.apache.maven.plugins:maven-source-plugin is missing. @ de.ahus1.keycloak.dropwizard:keycloak-dropwizard-parent:1.2.1-SNAPSHOT, /home/gabsko/breaking-updates/pom.xml, line 142, column 21
[WARNING] 
[WARNING] Some problems were encountered while building the effective model for de.ahus1.keycloak.dropwizard:keycloak-dropwizard-parent:pom:1.2.1-SNAPSHOT
[WARNING] 'build.plugins.plugin.version' for org.apache.maven.plugins:maven-source-plugin is missing. @ line 142, column 21
[WARNING] 
[WARNING] It is highly recommended to fix these problems because they threaten the stability of your build.
[WARNING] 
[WARNING] For this reason, future Maven versions might no longer support building such malformed projects.
[WARNING] 
[INFO] ------------------------------------------------------------------------
[INFO] Reactor Build Order:
[INFO] 
[INFO] Parent POM for Dropwizard and JBoss Keycloak integration           [pom]
[INFO] domain                                                             [jar]
[INFO] simple-war                                                         [war]
[INFO] keycloak-war                                                       [war]
[INFO] keycloak-dropwizard-jetty                                          [jar]
[INFO] Dropwizard Module for JBoss Keycloak                               [jar]
[INFO] keycloak-dropwizard-jaxrs-example                                  [jar]
[INFO] keycloak-dropwizard-bearer                                         [jar]
[INFO] keycloak-dropwizard-bearermodule                                   [jar]
[INFO] 
[INFO] ------< de.ahus1.keycloak.dropwizard:keycloak-dropwizard-parent >-------
[INFO] Building Parent POM for Dropwizard and JBoss Keycloak integration 1.2.1-SNAPSHOT [1/9]
[INFO] --------------------------------[ pom ]---------------------------------
[INFO] 
[INFO] --- maven-clean-plugin:2.5:clean (default-clean) @ keycloak-dropwizard-parent ---
[INFO] 
[INFO] --- forbiddenapis:3.4:check (compile) @ keycloak-dropwizard-parent ---
[INFO] Skipping execution for packaging "pom"
[INFO] 
[INFO] --- forbiddenapis:3.4:testCheck (test-compile) @ keycloak-dropwizard-parent ---
[INFO] Skipping execution for packaging "pom"
[INFO] 
[INFO] --- maven-checkstyle-plugin:3.2.0:check (test-compile) @ keycloak-dropwizard-parent ---
[INFO] Starting audit...
Audit done.
[INFO] You have 0 Checkstyle violations.
[INFO] 
[INFO] ----------------< de.ahus1.keycloak.dropwizard:domain >-----------------
[INFO] Building domain 1.2.1-SNAPSHOT                                     [2/9]
[INFO] --------------------------------[ jar ]---------------------------------
[INFO] 
[INFO] --- maven-clean-plugin:2.5:clean (default-clean) @ domain ---
[INFO] Deleting /home/gabsko/breaking-updates/domain/target
[INFO] 
[INFO] --- maven-resources-plugin:2.6:resources (default-resources) @ domain ---
[INFO] Using 'UTF-8' encoding to copy filtered resources.
[INFO] skip non existing resourceDirectory /home/gabsko/breaking-updates/domain/src/main/resources
[INFO] 
[INFO] --- maven-compiler-plugin:3.10.1:compile (default-compile) @ domain ---
[INFO] Changes detected - recompiling the module!
[INFO] Compiling 2 source files to /home/gabsko/breaking-updates/domain/target/classes
[INFO] 
[INFO] --- forbiddenapis:3.4:check (compile) @ domain ---
[INFO] Scanning for classes to check...
[INFO] Reading bundled API signatures: jdk-non-portable
[INFO] Reading bundled API signatures: jdk-unsafe-1.8
[INFO] Reading bundled API signatures: jdk-deprecated-1.8
[INFO] Reading bundled API signatures: jdk-system-out
[INFO] Reading bundled API signatures: jdk-internal-1.8
[INFO] Reading API signatures: /home/gabsko/breaking-updates/conf/signatures.txt
[INFO] Loading classes to check...
[INFO] Scanning classes for violations...
[INFO] Scanned 4 class file(s) for forbidden API invocations (in 0.06s), 0 error(s).
[INFO] 
[INFO] --- maven-resources-plugin:2.6:testResources (default-testResources) @ domain ---
[INFO] Using 'UTF-8' encoding to copy filtered resources.
[INFO] skip non existing resourceDirectory /home/gabsko/breaking-updates/domain/src/test/resources
[INFO] 
[INFO] --- maven-compiler-plugin:3.10.1:testCompile (default-testCompile) @ domain ---
[INFO] Changes detected - recompiling the module!
[INFO] Compiling 1 source file to /home/gabsko/breaking-updates/domain/target/test-classes
[INFO] 
[INFO] --- forbiddenapis:3.4:testCheck (test-compile) @ domain ---
[INFO] Scanning for classes to check...
[INFO] Reading bundled API signatures: jdk-non-portable
[INFO] Reading bundled API signatures: jdk-unsafe-1.8
[INFO] Reading bundled API signatures: jdk-deprecated-1.8
[INFO] Reading bundled API signatures: jdk-system-out
[INFO] Reading bundled API signatures: jdk-internal-1.8
[INFO] Reading API signatures: /home/gabsko/breaking-updates/conf/signatures.txt
[INFO] Loading classes to check...
[INFO] Scanning classes for violations...
[INFO] Scanned 1 class file(s) for forbidden API invocations (in 0.03s), 0 error(s).
[INFO] 
[INFO] --- maven-checkstyle-plugin:3.2.0:check (test-compile) @ domain ---
[INFO] Starting audit...
Audit done.
[INFO] You have 0 Checkstyle violations.
[INFO] 
[INFO] --- maven-surefire-plugin:3.0.0-M7:test (default-test) @ domain ---
[INFO] Using auto detected provider org.apache.maven.surefire.junit4.JUnit4Provider
[INFO] 
[INFO] -------------------------------------------------------
[INFO]  T E S T S
[INFO] -------------------------------------------------------
[INFO] Running de.ahus1.lottery.domain.DrawingServiceTest
[INFO] Tests run: 4, Failures: 0, Errors: 0, Skipped: 0, Time elapsed: 0.092 s - in de.ahus1.lottery.domain.DrawingServiceTest
[INFO] 
[INFO] Results:
[INFO] 
[INFO] Tests run: 4, Failures: 0, Errors: 0, Skipped: 0
[INFO] 
[INFO] 
[INFO] --------------< de.ahus1.keycloak.dropwizard:simple-war >---------------
[INFO] Building simple-war 1.2.1-SNAPSHOT                                 [3/9]
[INFO] --------------------------------[ war ]---------------------------------
[INFO] 
[INFO] --- maven-clean-plugin:2.5:clean (default-clean) @ simple-war ---
[INFO] Deleting /home/gabsko/breaking-updates/simple-war/target
[INFO] 
[INFO] --- maven-resources-plugin:2.6:resources (default-resources) @ simple-war ---
[INFO] Using 'UTF-8' encoding to copy filtered resources.
[INFO] skip non existing resourceDirectory /home/gabsko/breaking-updates/simple-war/src/main/resources
[INFO] 
[INFO] --- maven-compiler-plugin:3.10.1:compile (default-compile) @ simple-war ---
[INFO] Changes detected - recompiling the module!
[INFO] Compiling 1 source file to /home/gabsko/breaking-updates/simple-war/target/classes
[INFO] 
[INFO] --- forbiddenapis:3.4:check (compile) @ simple-war ---
[INFO] Scanning for classes to check...
[INFO] Reading bundled API signatures: jdk-non-portable
[INFO] Reading bundled API signatures: jdk-unsafe-1.8
[INFO] Reading bundled API signatures: jdk-deprecated-1.8
[INFO] Reading bundled API signatures: jdk-system-out
[INFO] Reading bundled API signatures: jdk-internal-1.8
[INFO] Reading API signatures: /home/gabsko/breaking-updates/conf/signatures.txt
[INFO] Loading classes to check...
[INFO] Scanning classes for violations...
[INFO] Scanned 1 class file(s) for forbidden API invocations (in 0.02s), 0 error(s).
[INFO] 
[INFO] --- maven-resources-plugin:2.6:testResources (default-testResources) @ simple-war ---
[INFO] Using 'UTF-8' encoding to copy filtered resources.
[INFO] skip non existing resourceDirectory /home/gabsko/breaking-updates/simple-war/src/test/resources
[INFO] 
[INFO] --- maven-compiler-plugin:3.10.1:testCompile (default-testCompile) @ simple-war ---
[INFO] No sources to compile
[INFO] 
[INFO] --- forbiddenapis:3.4:testCheck (test-compile) @ simple-war ---
[INFO] Scanning for classes to check...
[INFO] Classes directory does not exist, forbiddenapis check skipped: /home/gabsko/breaking-updates/simple-war/target/test-classes
[INFO] 
[INFO] --- maven-checkstyle-plugin:3.2.0:check (test-compile) @ simple-war ---
[INFO] Starting audit...
Audit done.
[INFO] You have 0 Checkstyle violations.
[INFO] 
[INFO] --- maven-surefire-plugin:3.0.0-M7:test (default-test) @ simple-war ---
[INFO] No tests to run.
[INFO] 
[INFO] -------------< de.ahus1.keycloak.dropwizard:keycloak-war >--------------
[INFO] Building keycloak-war 1.2.1-SNAPSHOT                               [4/9]
[INFO] --------------------------------[ war ]---------------------------------
[INFO] 
[INFO] --- maven-clean-plugin:2.5:clean (default-clean) @ keycloak-war ---
[INFO] Deleting /home/gabsko/breaking-updates/keycloak-war/target
[INFO] 
[INFO] --- maven-resources-plugin:2.6:resources (default-resources) @ keycloak-war ---
[INFO] Using 'UTF-8' encoding to copy filtered resources.
[INFO] skip non existing resourceDirectory /home/gabsko/breaking-updates/keycloak-war/src/main/resources
[INFO] 
[INFO] --- maven-compiler-plugin:3.10.1:compile (default-compile) @ keycloak-war ---
[INFO] Changes detected - recompiling the module!
[INFO] Compiling 2 source files to /home/gabsko/breaking-updates/keycloak-war/target/classes
[INFO] 
[INFO] --- forbiddenapis:3.4:check (compile) @ keycloak-war ---
[INFO] Scanning for classes to check...
[INFO] Reading bundled API signatures: jdk-non-portable
[INFO] Reading bundled API signatures: jdk-unsafe-1.8
[INFO] Reading bundled API signatures: jdk-deprecated-1.8
[INFO] Reading bundled API signatures: jdk-system-out
[INFO] Reading bundled API signatures: jdk-internal-1.8
[INFO] Reading API signatures: /home/gabsko/breaking-updates/conf/signatures.txt
[INFO] Loading classes to check...
[INFO] Scanning classes for violations...
[INFO] Scanned 2 class file(s) for forbidden API invocations (in 0.03s), 0 error(s).
[INFO] 
[INFO] --- maven-resources-plugin:2.6:testResources (default-testResources) @ keycloak-war ---
[INFO] Using 'UTF-8' encoding to copy filtered resources.
[INFO] skip non existing resourceDirectory /home/gabsko/breaking-updates/keycloak-war/src/test/resources
[INFO] 
[INFO] --- maven-compiler-plugin:3.10.1:testCompile (default-testCompile) @ keycloak-war ---
[INFO] No sources to compile
[INFO] 
[INFO] --- forbiddenapis:3.4:testCheck (test-compile) @ keycloak-war ---
[INFO] Scanning for classes to check...
[INFO] Classes directory does not exist, forbiddenapis check skipped: /home/gabsko/breaking-updates/keycloak-war/target/test-classes
[INFO] 
[INFO] --- maven-checkstyle-plugin:3.2.0:check (test-compile) @ keycloak-war ---
[INFO] Starting audit...
Audit done.
[INFO] You have 0 Checkstyle violations.
[INFO] 
[INFO] --- maven-surefire-plugin:3.0.0-M7:test (default-test) @ keycloak-war ---
[INFO] No tests to run.
[INFO] 
[INFO] -------< de.ahus1.keycloak.dropwizard:keycloak-dropwizard-jetty >-------
[INFO] Building keycloak-dropwizard-jetty 1.2.1-SNAPSHOT                  [5/9]
[INFO] --------------------------------[ jar ]---------------------------------
[INFO] 
[INFO] --- maven-clean-plugin:2.5:clean (default-clean) @ keycloak-dropwizard-jetty ---
[INFO] Deleting /home/gabsko/breaking-updates/keycloak-dropwizard-jetty/target
[INFO] 
[INFO] --- maven-resources-plugin:2.6:resources (default-resources) @ keycloak-dropwizard-jetty ---
[INFO] Using 'UTF-8' encoding to copy filtered resources.
[INFO] Copying 2 resources
[INFO] 
[INFO] --- maven-compiler-plugin:3.10.1:compile (default-compile) @ keycloak-dropwizard-jetty ---
[INFO] Changes detected - recompiling the module!
[INFO] Compiling 6 source files to /home/gabsko/breaking-updates/keycloak-dropwizard-jetty/target/classes
[INFO] /home/gabsko/breaking-updates/keycloak-dropwizard-jetty/src/main/java/de/ahus1/lottery/adapter/dropwizard/LotteryApplication.java: /home/gabsko/breaking-updates/keycloak-dropwizard-jetty/src/main/java/de/ahus1/lottery/adapter/dropwizard/LotteryApplication.java uses unchecked or unsafe operations.
[INFO] /home/gabsko/breaking-updates/keycloak-dropwizard-jetty/src/main/java/de/ahus1/lottery/adapter/dropwizard/LotteryApplication.java: Recompile with -Xlint:unchecked for details.
[INFO] 
[INFO] --- forbiddenapis:3.4:check (compile) @ keycloak-dropwizard-jetty ---
[INFO] Scanning for classes to check...
[INFO] Reading bundled API signatures: jdk-non-portable
[INFO] Reading bundled API signatures: jdk-unsafe-1.8
[INFO] Reading bundled API signatures: jdk-deprecated-1.8
[INFO] Reading bundled API signatures: jdk-system-out
[INFO] Reading bundled API signatures: jdk-internal-1.8
[INFO] Reading API signatures: /home/gabsko/breaking-updates/conf/signatures.txt
[INFO] Loading classes to check...
[INFO] Scanning classes for violations...
[INFO] Scanned 6 class file(s) for forbidden API invocations (in 0.04s), 0 error(s).
[INFO] 
[INFO] --- maven-resources-plugin:2.6:testResources (default-testResources) @ keycloak-dropwizard-jetty ---
[INFO] Using 'UTF-8' encoding to copy filtered resources.
[INFO] skip non existing resourceDirectory /home/gabsko/breaking-updates/keycloak-dropwizard-jetty/src/test/resources
[INFO] 
[INFO] --- maven-compiler-plugin:3.10.1:testCompile (default-testCompile) @ keycloak-dropwizard-jetty ---
[INFO] Changes detected - recompiling the module!
[INFO] Compiling 5 source files to /home/gabsko/breaking-updates/keycloak-dropwizard-jetty/target/test-classes
[INFO] /home/gabsko/breaking-updates/keycloak-dropwizard-jetty/src/test/java/de/ahus1/lottery/adapter/dropwizard/LotteryApplicationTest.java: /home/gabsko/breaking-updates/keycloak-dropwizard-jetty/src/test/java/de/ahus1/lottery/adapter/dropwizard/LotteryApplicationTest.java uses or overrides a deprecated API.
[INFO] /home/gabsko/breaking-updates/keycloak-dropwizard-jetty/src/test/java/de/ahus1/lottery/adapter/dropwizard/LotteryApplicationTest.java: Recompile with -Xlint:deprecation for details.
[INFO] 
[INFO] --- forbiddenapis:3.4:testCheck (test-compile) @ keycloak-dropwizard-jetty ---
[INFO] Scanning for classes to check...
[INFO] Reading bundled API signatures: jdk-non-portable
[INFO] Reading bundled API signatures: jdk-unsafe-1.8
[INFO] Reading bundled API signatures: jdk-deprecated-1.8
[INFO] Reading bundled API signatures: jdk-system-out
[INFO] Reading bundled API signatures: jdk-internal-1.8
[INFO] Reading API signatures: /home/gabsko/breaking-updates/conf/signatures.txt
[INFO] Loading classes to check...
[INFO] Scanning classes for violations...
[INFO] Scanned 5 class file(s) for forbidden API invocations (in 0.06s), 0 error(s).
[INFO] 
[INFO] --- maven-checkstyle-plugin:3.2.0:check (test-compile) @ keycloak-dropwizard-jetty ---
[INFO] Starting audit...
Audit done.
[INFO] You have 0 Checkstyle violations.
[INFO] 
[INFO] --- maven-surefire-plugin:3.0.0-M7:test (default-test) @ keycloak-dropwizard-jetty ---
[INFO] Using auto detected provider org.apache.maven.surefire.junit4.JUnit4Provider
[INFO] 
[INFO] -------------------------------------------------------
[INFO]  T E S T S
[INFO] -------------------------------------------------------
[INFO] Running de.ahus1.lottery.adapter.dropwizard.LotteryApplicationTest
INFO  [2023-01-06 19:00:34,080] org.eclipse.jetty.util.log: Logging initialized @1424ms to org.eclipse.jetty.util.log.Slf4jLog
INFO  [2023-01-06 19:00:34,144] io.dropwizard.server.DefaultServerFactory: Registering jersey handler with root path prefix: /
INFO  [2023-01-06 19:00:34,146] io.dropwizard.server.DefaultServerFactory: Registering admin handler with root path prefix: /
INFO  [2023-01-06 19:00:34,148] io.dropwizard.assets.AssetsBundle: Registering AssetBundle with name: css for path /css/*
INFO  [2023-01-06 19:00:34,150] io.dropwizard.assets.AssetsBundle: Registering AssetBundle with name: js for path /js/*
INFO  [2023-01-06 19:00:34,150] io.dropwizard.assets.AssetsBundle: Registering AssetBundle with name: fonts for path /fonts/*
INFO  [2023-01-06 19:00:34,150] io.dropwizard.assets.AssetsBundle: Registering AssetBundle with name: html for path /html/*
INFO  [2023-01-06 19:00:34,169] io.dropwizard.server.ServerFactory: Starting lottery
ERROR [2023-01-06 19:00:34,253] io.dropwizard.cli.ServerCommand: Unable to start server, shutting down
! java.net.BindException: Address already in use
! at java.base/sun.nio.ch.Net.bind0(Native Method)
! at java.base/sun.nio.ch.Net.bind(Net.java:459)
! at java.base/sun.nio.ch.Net.bind(Net.java:448)
! at java.base/sun.nio.ch.ServerSocketChannelImpl.bind(ServerSocketChannelImpl.java:227)
! at java.base/sun.nio.ch.ServerSocketAdaptor.bind(ServerSocketAdaptor.java:80)
! at org.eclipse.jetty.server.ServerConnector.openAcceptChannel(ServerConnector.java:344)
! ... 22 common frames omitted
! Causing: java.io.IOException: Failed to bind to 0.0.0.0/0.0.0.0:9090
! at org.eclipse.jetty.server.ServerConnector.openAcceptChannel(ServerConnector.java:349)
! at org.eclipse.jetty.server.ServerConnector.open(ServerConnector.java:310)
! at org.eclipse.jetty.setuid.SetUIDListener.lifeCycleStarting(SetUIDListener.java:216)
! ... 20 common frames omitted
! Causing: java.lang.RuntimeException: java.io.IOException: Failed to bind to 0.0.0.0/0.0.0.0:9090
! at org.eclipse.jetty.setuid.SetUIDListener.lifeCycleStarting(SetUIDListener.java:229)
! at org.eclipse.jetty.util.component.AbstractLifeCycle.setStarting(AbstractLifeCycle.java:205)
! at org.eclipse.jetty.util.component.AbstractLifeCycle.start(AbstractLifeCycle.java:72)
! at io.dropwizard.cli.ServerCommand.run(ServerCommand.java:52)
! at io.dropwizard.cli.EnvironmentCommand.run(EnvironmentCommand.java:68)
! at io.dropwizard.cli.ConfiguredCommand.run(ConfiguredCommand.java:98)
! at io.dropwizard.testing.DropwizardTestSupport.startIfRequired(DropwizardTestSupport.java:326)
! at io.dropwizard.testing.DropwizardTestSupport.before(DropwizardTestSupport.java:226)
! at io.dropwizard.testing.junit.DropwizardAppRule.before(DropwizardAppRule.java:228)
! at org.junit.rules.ExternalResource$1.evaluate(ExternalResource.java:50)
! at org.junit.rules.RunRules.evaluate(RunRules.java:20)
! at org.junit.runners.ParentRunner$3.evaluate(ParentRunner.java:306)
! at org.junit.runners.ParentRunner.run(ParentRunner.java:413)
! at org.apache.maven.surefire.junit4.JUnit4Provider.execute(JUnit4Provider.java:377)
! at org.apache.maven.surefire.junit4.JUnit4Provider.executeWithRerun(JUnit4Provider.java:284)
! at org.apache.maven.surefire.junit4.JUnit4Provider.executeTestSet(JUnit4Provider.java:248)
! at org.apache.maven.surefire.junit4.JUnit4Provider.invoke(JUnit4Provider.java:167)
! at org.apache.maven.surefire.booter.ForkedBooter.runSuitesInProcess(ForkedBooter.java:456)
! at org.apache.maven.surefire.booter.ForkedBooter.execute(ForkedBooter.java:169)
! at org.apache.maven.surefire.booter.ForkedBooter.run(ForkedBooter.java:595)
! at org.apache.maven.surefire.booter.ForkedBooter.main(ForkedBooter.java:581)
[ERROR] Tests run: 1, Failures: 0, Errors: 1, Skipped: 0, Time elapsed: 1.319 s <<< FAILURE! - in de.ahus1.lottery.adapter.dropwizard.LotteryApplicationTest
[ERROR] de.ahus1.lottery.adapter.dropwizard.LotteryApplicationTest  Time elapsed: 1.313 s  <<< ERROR!
java.lang.RuntimeException: java.io.IOException: Failed to bind to 0.0.0.0/0.0.0.0:9090
	at org.eclipse.jetty.setuid.SetUIDListener.lifeCycleStarting(SetUIDListener.java:229)
	at org.eclipse.jetty.util.component.AbstractLifeCycle.setStarting(AbstractLifeCycle.java:205)
	at org.eclipse.jetty.util.component.AbstractLifeCycle.start(AbstractLifeCycle.java:72)
	at io.dropwizard.cli.ServerCommand.run(ServerCommand.java:52)
	at io.dropwizard.cli.EnvironmentCommand.run(EnvironmentCommand.java:68)
	at io.dropwizard.cli.ConfiguredCommand.run(ConfiguredCommand.java:98)
	at io.dropwizard.testing.DropwizardTestSupport.startIfRequired(DropwizardTestSupport.java:326)
	at io.dropwizard.testing.DropwizardTestSupport.before(DropwizardTestSupport.java:226)
	at io.dropwizard.testing.junit.DropwizardAppRule.before(DropwizardAppRule.java:228)
	at org.junit.rules.ExternalResource$1.evaluate(ExternalResource.java:50)
	at org.junit.rules.RunRules.evaluate(RunRules.java:20)
	at org.junit.runners.ParentRunner$3.evaluate(ParentRunner.java:306)
	at org.junit.runners.ParentRunner.run(ParentRunner.java:413)
	at org.apache.maven.surefire.junit4.JUnit4Provider.execute(JUnit4Provider.java:377)
	at org.apache.maven.surefire.junit4.JUnit4Provider.executeWithRerun(JUnit4Provider.java:284)
	at org.apache.maven.surefire.junit4.JUnit4Provider.executeTestSet(JUnit4Provider.java:248)
	at org.apache.maven.surefire.junit4.JUnit4Provider.invoke(JUnit4Provider.java:167)
	at org.apache.maven.surefire.booter.ForkedBooter.runSuitesInProcess(ForkedBooter.java:456)
	at org.apache.maven.surefire.booter.ForkedBooter.execute(ForkedBooter.java:169)
	at org.apache.maven.surefire.booter.ForkedBooter.run(ForkedBooter.java:595)
	at org.apache.maven.surefire.booter.ForkedBooter.main(ForkedBooter.java:581)
Caused by: java.io.IOException: Failed to bind to 0.0.0.0/0.0.0.0:9090
	at org.eclipse.jetty.server.ServerConnector.openAcceptChannel(ServerConnector.java:349)
	at org.eclipse.jetty.server.ServerConnector.open(ServerConnector.java:310)
	at org.eclipse.jetty.setuid.SetUIDListener.lifeCycleStarting(SetUIDListener.java:216)
	... 20 more
Caused by: java.net.BindException: Address already in use
	at java.base/sun.nio.ch.Net.bind0(Native Method)
	at java.base/sun.nio.ch.Net.bind(Net.java:459)
	at java.base/sun.nio.ch.Net.bind(Net.java:448)
	at java.base/sun.nio.ch.ServerSocketChannelImpl.bind(ServerSocketChannelImpl.java:227)
	at java.base/sun.nio.ch.ServerSocketAdaptor.bind(ServerSocketAdaptor.java:80)
	at org.eclipse.jetty.server.ServerConnector.openAcceptChannel(ServerConnector.java:344)
	... 22 more

[INFO] 
[INFO] Results:
[INFO] 
[ERROR] Errors: 
[ERROR]   LotteryApplicationTest » Runtime java.io.IOException: Failed to bind to 0.0.0.0/0.0.0.0:9090
[INFO] 
[ERROR] Tests run: 1, Failures: 0, Errors: 1, Skipped: 0
[INFO] 
[INFO] ------------------------------------------------------------------------
[INFO] Reactor Summary for Parent POM for Dropwizard and JBoss Keycloak integration 1.2.1-SNAPSHOT:
[INFO] 
[INFO] Parent POM for Dropwizard and JBoss Keycloak integration SUCCESS [  1.003 s]
[INFO] domain ............................................. SUCCESS [  2.708 s]
[INFO] simple-war ......................................... SUCCESS [  0.528 s]
[INFO] keycloak-war ....................................... SUCCESS [  0.607 s]
[INFO] keycloak-dropwizard-jetty .......................... FAILURE [  3.618 s]
[INFO] Dropwizard Module for JBoss Keycloak ............... SKIPPED
[INFO] keycloak-dropwizard-jaxrs-example .................. SKIPPED
[INFO] keycloak-dropwizard-bearer ......................... SKIPPED
[INFO] keycloak-dropwizard-bearermodule ................... SKIPPED
[INFO] ------------------------------------------------------------------------
[INFO] BUILD FAILURE
[INFO] ------------------------------------------------------------------------
[INFO] Total time:  8.594 s
[INFO] Finished at: 2023-01-06T19:00:34Z
[INFO] ------------------------------------------------------------------------
[ERROR] Failed to execute goal org.apache.maven.plugins:maven-surefire-plugin:3.0.0-M7:test (default-test) on project keycloak-dropwizard-jetty: 
[ERROR] 
[ERROR] Please refer to /home/gabsko/breaking-updates/keycloak-dropwizard-jetty/target/surefire-reports for the individual test results.
[ERROR] Please refer to dump files (if any exist) [date].dump, [date]-jvmRun[N].dump and [date].dumpstream.
[ERROR] -> [Help 1]
[ERROR] 
[ERROR] To see the full stack trace of the errors, re-run Maven with the -e switch.
[ERROR] Re-run Maven using the -X switch to enable full debug logging.
[ERROR] 
[ERROR] For more information about the errors and possible solutions, please read the following articles:
[ERROR] [Help 1] http://cwiki.apache.org/confluence/display/MAVEN/MojoFailureException
[ERROR] 
[ERROR] After correcting the problems, you can resume the build with the command
[ERROR]   mvn <args> -rf :keycloak-dropwizard-jetty
