[INFO] Scanning for projects...
[WARNING] The project com.github.frameworkium:frameworkium-examples:jar:3 uses prerequisites which is only intended for maven-plugin projects but not for non maven-plugin projects. For such purposes you should use the maven-enforcer-plugin. See https://maven.apache.org/enforcer/enforcer-rules/requireMavenVersion.html
[INFO] 
[INFO] -----------< com.github.frameworkium:frameworkium-examples >------------
[INFO] Building Frameworkium Examples 3
[INFO] --------------------------------[ jar ]---------------------------------
[INFO] 
[INFO] --- maven-clean-plugin:2.5:clean (default-clean) @ frameworkium-examples ---
[INFO] 
[INFO] --- maven-resources-plugin:2.6:resources (default-resources) @ frameworkium-examples ---
[INFO] Using 'UTF-8' encoding to copy filtered resources.
[INFO] skip non existing resourceDirectory /home/gabsko/breaking-updates/src/main/resources
[INFO] 
[INFO] --- maven-compiler-plugin:3.8.1:compile (default-compile) @ frameworkium-examples ---
[INFO] No sources to compile
[INFO] 
[INFO] --- maven-resources-plugin:2.6:testResources (default-testResources) @ frameworkium-examples ---
[INFO] Using 'UTF-8' encoding to copy filtered resources.
[INFO] Copying 3 resources
[INFO] 
[INFO] --- maven-compiler-plugin:3.8.1:testCompile (default-testCompile) @ frameworkium-examples ---
[INFO] Changes detected - recompiling the module!
[INFO] Compiling 90 source files to /home/gabsko/breaking-updates/target/test-classes
[INFO] 
[INFO] --- maven-surefire-plugin:3.0.0-M3:test (default-test) @ frameworkium-examples ---
[INFO] 
[INFO] -------------------------------------------------------
[INFO]  T E S T S
[INFO] -------------------------------------------------------
[INFO] Running TestSuite
15:16:18.149 [TestNG-test=Surefire test-1] INFO  - START tfl.api.test.BikePointsTest.given_lat_long_of_point_point_appears_in_lat_long_search
15:16:18.581 [TestNG-test=Surefire test-1] INFO  - PASS  tfl.api.test.BikePointsTest.given_lat_long_of_point_point_appears_in_lat_long_search
15:16:18.585 [TestNG-test=Surefire test-1] INFO  - START tfl.api.test.BikePointsTest.known_name_exists_in_all_bike_points
15:16:18.587 [TestNG-test=Surefire test-1] INFO  - PASS  tfl.api.test.BikePointsTest.known_name_exists_in_all_bike_points
15:16:18.588 [TestNG-test=Surefire test-1] INFO  - START tfl.api.test.BikePointsTest.there_are_a_lot_of_bike_points
15:16:18.589 [TestNG-test=Surefire test-1] INFO  - PASS  tfl.api.test.BikePointsTest.there_are_a_lot_of_bike_points
15:16:19.310 [TestNG-test=Surefire test-1] INFO  - START restfulbooker.api.tests.BookerTest.auth_token_matches_expected_pattern
15:16:20.575 [TestNG-test=Surefire test-1] INFO  - PASS  restfulbooker.api.tests.BookerTest.auth_token_matches_expected_pattern
15:16:20.576 [TestNG-test=Surefire test-1] INFO  - START restfulbooker.api.tests.BookerTest.create_new_booking
15:16:21.825 [TestNG-test=Surefire test-1] INFO  - PASS  restfulbooker.api.tests.BookerTest.create_new_booking
15:16:21.827 [TestNG-test=Surefire test-1] INFO  - START restfulbooker.api.tests.BookerTest.delete_newly_created_booking
15:16:26.065 [TestNG-test=Surefire test-1] INFO  - PASS  restfulbooker.api.tests.BookerTest.delete_newly_created_booking
15:16:26.166 [TestNG-test=Surefire test-1] INFO  - START angularjs.tests.DocumentationTest.documentationTest
15:16:26.168 [TestNG-test=Surefire test-1] WARN  - SKIP  angularjs.tests.DocumentationTest.documentationTest
15:16:26.168 [TestNG-test=Surefire test-1] ERROR - FAIL  angularjs.tests.DocumentationTest.documentationTest
15:16:26.168 [TestNG-test=Surefire test-1] ERROR - null
java.lang.NullPointerException: null
	at com.frameworkium.core.ui.driver.lifecycle.SingleUseDriverLifecycle.getWebDriver(SingleUseDriverLifecycle.java:35) ~[frameworkium-core-3.0.1.jar:?]
	at com.frameworkium.core.ui.UITestLifecycle.getWebDriver(UITestLifecycle.java:138) ~[frameworkium-core-3.0.1.jar:?]
	at com.frameworkium.core.ui.listeners.ScreenshotListener.takeScreenshotAndSaveLocally(ScreenshotListener.java:42) ~[frameworkium-core-3.0.1.jar:?]
	at com.frameworkium.core.ui.listeners.ScreenshotListener.onTestSkipped(ScreenshotListener.java:36) ~[frameworkium-core-3.0.1.jar:?]
	at org.testng.internal.TestListenerHelper.runTestListeners(TestListenerHelper.java:87) [testng-7.3.0.jar:?]
	at org.testng.internal.TestInvoker.runTestResultListener(TestInvoker.java:220) ~[testng-7.3.0.jar:?]
	at org.testng.internal.TestInvoker.invokeListenersForSkippedTestResult(TestInvoker.java:447) ~[testng-7.3.0.jar:?]
	at org.testng.internal.TestInvoker.invokeMethod(TestInvoker.java:547) ~[testng-7.3.0.jar:?]
	at org.testng.internal.TestInvoker.invokeTestMethod(TestInvoker.java:174) [testng-7.3.0.jar:?]
	at org.testng.internal.MethodRunner.runInSequence(MethodRunner.java:46) ~[testng-7.3.0.jar:?]
	at org.testng.internal.TestInvoker$MethodInvocationAgent.invoke(TestInvoker.java:822) [testng-7.3.0.jar:?]
	at org.testng.internal.TestInvoker.invokeTestMethods(TestInvoker.java:147) [testng-7.3.0.jar:?]
	at org.testng.internal.TestMethodWorker.invokeTestMethods(TestMethodWorker.java:146) [testng-7.3.0.jar:?]
	at org.testng.internal.TestMethodWorker.run(TestMethodWorker.java:128) [testng-7.3.0.jar:?]
	at java.util.concurrent.ThreadPoolExecutor.runWorker(ThreadPoolExecutor.java:1128) [?:?]
	at java.util.concurrent.ThreadPoolExecutor$Worker.run(ThreadPoolExecutor.java:628) [?:?]
	at java.lang.Thread.run(Thread.java:829) [?:?]
Exception in thread "TestNG-test=Surefire test-1" java.lang.NullPointerException
	at com.frameworkium.core.ui.driver.lifecycle.SingleUseDriverLifecycle.getWebDriver(SingleUseDriverLifecycle.java:35)
	at com.frameworkium.core.ui.UITestLifecycle.getWebDriver(UITestLifecycle.java:138)
	at com.frameworkium.core.ui.listeners.ScreenshotListener.takeScreenshotAndSaveLocally(ScreenshotListener.java:42)
	at com.frameworkium.core.ui.listeners.ScreenshotListener.onTestFailure(ScreenshotListener.java:29)
	at org.testng.internal.TestListenerHelper.runTestListeners(TestListenerHelper.java:96)
	at org.testng.internal.TestInvoker.runTestResultListener(TestInvoker.java:220)
	at org.testng.internal.TestInvoker$MethodInvocationAgent.invoke(TestInvoker.java:832)
	at org.testng.internal.TestInvoker.invokeTestMethods(TestInvoker.java:147)
	at org.testng.internal.TestMethodWorker.invokeTestMethods(TestMethodWorker.java:146)
	at org.testng.internal.TestMethodWorker.run(TestMethodWorker.java:128)
	at java.base/java.util.concurrent.ThreadPoolExecutor.runWorker(ThreadPoolExecutor.java:1128)
	at java.base/java.util.concurrent.ThreadPoolExecutor$Worker.run(ThreadPoolExecutor.java:628)
	at java.base/java.lang.Thread.run(Thread.java:829)
15:16:26.184 [TestNG-test=Surefire test-2] INFO  - START tables.wikipedia.tests.EnglishCountiesTest.exploring_english_counties_data
15:16:26.190 [TestNG-test=Surefire test-2] WARN  - SKIP  tables.wikipedia.tests.EnglishCountiesTest.exploring_english_counties_data
15:16:26.191 [TestNG-test=Surefire test-2] ERROR - FAIL  tables.wikipedia.tests.EnglishCountiesTest.exploring_english_counties_data
15:16:26.191 [TestNG-test=Surefire test-2] ERROR - null
java.lang.NullPointerException: null
	at com.frameworkium.core.ui.driver.lifecycle.SingleUseDriverLifecycle.getWebDriver(SingleUseDriverLifecycle.java:35) ~[frameworkium-core-3.0.1.jar:?]
	at com.frameworkium.core.ui.UITestLifecycle.getWebDriver(UITestLifecycle.java:138) ~[frameworkium-core-3.0.1.jar:?]
	at com.frameworkium.core.ui.listeners.ScreenshotListener.takeScreenshotAndSaveLocally(ScreenshotListener.java:42) ~[frameworkium-core-3.0.1.jar:?]
	at com.frameworkium.core.ui.listeners.ScreenshotListener.onTestSkipped(ScreenshotListener.java:36) ~[frameworkium-core-3.0.1.jar:?]
	at org.testng.internal.TestListenerHelper.runTestListeners(TestListenerHelper.java:87) [testng-7.3.0.jar:?]
	at org.testng.internal.TestInvoker.runTestResultListener(TestInvoker.java:220) ~[testng-7.3.0.jar:?]
	at org.testng.internal.TestInvoker.invokeListenersForSkippedTestResult(TestInvoker.java:447) ~[testng-7.3.0.jar:?]
	at org.testng.internal.TestInvoker.invokeMethod(TestInvoker.java:547) ~[testng-7.3.0.jar:?]
	at org.testng.internal.TestInvoker.invokeTestMethod(TestInvoker.java:174) [testng-7.3.0.jar:?]
	at org.testng.internal.MethodRunner.runInSequence(MethodRunner.java:46) ~[testng-7.3.0.jar:?]
	at org.testng.internal.TestInvoker$MethodInvocationAgent.invoke(TestInvoker.java:822) [testng-7.3.0.jar:?]
	at org.testng.internal.TestInvoker.invokeTestMethods(TestInvoker.java:147) [testng-7.3.0.jar:?]
	at org.testng.internal.TestMethodWorker.invokeTestMethods(TestMethodWorker.java:146) [testng-7.3.0.jar:?]
	at org.testng.internal.TestMethodWorker.run(TestMethodWorker.java:128) [testng-7.3.0.jar:?]
	at java.util.concurrent.ThreadPoolExecutor.runWorker(ThreadPoolExecutor.java:1128) [?:?]
	at java.util.concurrent.ThreadPoolExecutor$Worker.run(ThreadPoolExecutor.java:628) [?:?]
	at java.lang.Thread.run(Thread.java:829) [?:?]
Exception in thread "TestNG-test=Surefire test-2" java.lang.NullPointerException
	at com.frameworkium.core.ui.driver.lifecycle.SingleUseDriverLifecycle.getWebDriver(SingleUseDriverLifecycle.java:35)
	at com.frameworkium.core.ui.UITestLifecycle.getWebDriver(UITestLifecycle.java:138)
	at com.frameworkium.core.ui.listeners.ScreenshotListener.takeScreenshotAndSaveLocally(ScreenshotListener.java:42)
	at com.frameworkium.core.ui.listeners.ScreenshotListener.onTestFailure(ScreenshotListener.java:29)
	at org.testng.internal.TestListenerHelper.runTestListeners(TestListenerHelper.java:96)
	at org.testng.internal.TestInvoker.runTestResultListener(TestInvoker.java:220)
	at org.testng.internal.TestInvoker$MethodInvocationAgent.invoke(TestInvoker.java:832)
	at org.testng.internal.TestInvoker.invokeTestMethods(TestInvoker.java:147)
	at org.testng.internal.TestMethodWorker.invokeTestMethods(TestMethodWorker.java:146)
	at org.testng.internal.TestMethodWorker.run(TestMethodWorker.java:128)
	at java.base/java.util.concurrent.ThreadPoolExecutor.runWorker(ThreadPoolExecutor.java:1128)
	at java.base/java.util.concurrent.ThreadPoolExecutor$Worker.run(ThreadPoolExecutor.java:628)
	at java.base/java.lang.Thread.run(Thread.java:829)
15:16:26.193 [TestNG-test=Surefire test-3] INFO  - START tfl.api.test.JourneyPlannerTest.journey_planner_london_search_journey_duration
15:16:27.913 [TestNG-test=Surefire test-3] INFO  - PASS  tfl.api.test.JourneyPlannerTest.journey_planner_london_search_journey_duration
15:16:27.921 [TestNG-test=Surefire test-3] INFO  - START tables.wikipedia.tests.LargestMountainTest.exploring_the_highest_mountain_table
15:16:27.923 [TestNG-test=Surefire test-3] WARN  - SKIP  tables.wikipedia.tests.LargestMountainTest.exploring_the_highest_mountain_table
15:16:27.923 [TestNG-test=Surefire test-3] ERROR - FAIL  tables.wikipedia.tests.LargestMountainTest.exploring_the_highest_mountain_table
15:16:27.923 [TestNG-test=Surefire test-3] ERROR - null
java.lang.NullPointerException: null
	at com.frameworkium.core.ui.driver.lifecycle.SingleUseDriverLifecycle.getWebDriver(SingleUseDriverLifecycle.java:35) ~[frameworkium-core-3.0.1.jar:?]
	at com.frameworkium.core.ui.UITestLifecycle.getWebDriver(UITestLifecycle.java:138) ~[frameworkium-core-3.0.1.jar:?]
	at com.frameworkium.core.ui.listeners.ScreenshotListener.takeScreenshotAndSaveLocally(ScreenshotListener.java:42) ~[frameworkium-core-3.0.1.jar:?]
	at com.frameworkium.core.ui.listeners.ScreenshotListener.onTestSkipped(ScreenshotListener.java:36) ~[frameworkium-core-3.0.1.jar:?]
	at org.testng.internal.TestListenerHelper.runTestListeners(TestListenerHelper.java:87) [testng-7.3.0.jar:?]
	at org.testng.internal.TestInvoker.runTestResultListener(TestInvoker.java:220) ~[testng-7.3.0.jar:?]
	at org.testng.internal.TestInvoker.invokeListenersForSkippedTestResult(TestInvoker.java:447) ~[testng-7.3.0.jar:?]
	at org.testng.internal.TestInvoker.invokeMethod(TestInvoker.java:547) ~[testng-7.3.0.jar:?]
	at org.testng.internal.TestInvoker.invokeTestMethod(TestInvoker.java:174) [testng-7.3.0.jar:?]
	at org.testng.internal.MethodRunner.runInSequence(MethodRunner.java:46) ~[testng-7.3.0.jar:?]
	at org.testng.internal.TestInvoker$MethodInvocationAgent.invoke(TestInvoker.java:822) [testng-7.3.0.jar:?]
	at org.testng.internal.TestInvoker.invokeTestMethods(TestInvoker.java:147) [testng-7.3.0.jar:?]
	at org.testng.internal.TestMethodWorker.invokeTestMethods(TestMethodWorker.java:146) [testng-7.3.0.jar:?]
	at org.testng.internal.TestMethodWorker.run(TestMethodWorker.java:128) [testng-7.3.0.jar:?]
	at java.util.concurrent.ThreadPoolExecutor.runWorker(ThreadPoolExecutor.java:1128) [?:?]
	at java.util.concurrent.ThreadPoolExecutor$Worker.run(ThreadPoolExecutor.java:628) [?:?]
	at java.lang.Thread.run(Thread.java:829) [?:?]
Exception in thread "TestNG-test=Surefire test-3" java.lang.NullPointerException
	at com.frameworkium.core.ui.driver.lifecycle.SingleUseDriverLifecycle.getWebDriver(SingleUseDriverLifecycle.java:35)
	at com.frameworkium.core.ui.UITestLifecycle.getWebDriver(UITestLifecycle.java:138)
	at com.frameworkium.core.ui.listeners.ScreenshotListener.takeScreenshotAndSaveLocally(ScreenshotListener.java:42)
	at com.frameworkium.core.ui.listeners.ScreenshotListener.onTestFailure(ScreenshotListener.java:29)
	at org.testng.internal.TestListenerHelper.runTestListeners(TestListenerHelper.java:96)
	at org.testng.internal.TestInvoker.runTestResultListener(TestInvoker.java:220)
	at org.testng.internal.TestInvoker$MethodInvocationAgent.invoke(TestInvoker.java:832)
	at org.testng.internal.TestInvoker.invokeTestMethods(TestInvoker.java:147)
	at org.testng.internal.TestMethodWorker.invokeTestMethods(TestMethodWorker.java:146)
	at org.testng.internal.TestMethodWorker.run(TestMethodWorker.java:128)
	at java.base/java.util.concurrent.ThreadPoolExecutor.runWorker(ThreadPoolExecutor.java:1128)
	at java.base/java.util.concurrent.ThreadPoolExecutor$Worker.run(ThreadPoolExecutor.java:628)
	at java.base/java.lang.Thread.run(Thread.java:829)
15:16:27.925 [TestNG-test=Surefire test-4] INFO  - START restfulbooker.api.tests.SearchBookerTest.search_for_existing_records_by_date
15:16:30.609 [TestNG-test=Surefire test-4] WARN  - SKIP  restfulbooker.api.tests.SearchBookerTest.search_for_existing_records_by_date
15:16:30.609 [TestNG-test=Surefire test-4] WARN  - Known bug in service, dates not inclusive
15:16:30.612 [TestNG-test=Surefire test-4] INFO  - START restfulbooker.api.tests.SearchBookerTest.search_for_existing_records_by_name
15:16:33.291 [TestNG-test=Surefire test-4] INFO  - PASS  restfulbooker.api.tests.SearchBookerTest.search_for_existing_records_by_name
15:16:33.296 [TestNG-test=Surefire test-4] INFO  - START seleniumhq.tests.SeleniumHQTest.component_example_test
15:16:33.297 [TestNG-test=Surefire test-4] WARN  - SKIP  seleniumhq.tests.SeleniumHQTest.component_example_test
15:16:33.297 [TestNG-test=Surefire test-4] ERROR - FAIL  seleniumhq.tests.SeleniumHQTest.component_example_test
15:16:33.297 [TestNG-test=Surefire test-4] ERROR - null
java.lang.NullPointerException: null
	at com.frameworkium.core.ui.driver.lifecycle.SingleUseDriverLifecycle.getWebDriver(SingleUseDriverLifecycle.java:35) ~[frameworkium-core-3.0.1.jar:?]
	at com.frameworkium.core.ui.UITestLifecycle.getWebDriver(UITestLifecycle.java:138) ~[frameworkium-core-3.0.1.jar:?]
	at com.frameworkium.core.ui.listeners.ScreenshotListener.takeScreenshotAndSaveLocally(ScreenshotListener.java:42) ~[frameworkium-core-3.0.1.jar:?]
	at com.frameworkium.core.ui.listeners.ScreenshotListener.onTestSkipped(ScreenshotListener.java:36) ~[frameworkium-core-3.0.1.jar:?]
	at org.testng.internal.TestListenerHelper.runTestListeners(TestListenerHelper.java:87) [testng-7.3.0.jar:?]
	at org.testng.internal.TestInvoker.runTestResultListener(TestInvoker.java:220) ~[testng-7.3.0.jar:?]
	at org.testng.internal.TestInvoker.invokeListenersForSkippedTestResult(TestInvoker.java:447) ~[testng-7.3.0.jar:?]
	at org.testng.internal.TestInvoker.invokeMethod(TestInvoker.java:547) ~[testng-7.3.0.jar:?]
	at org.testng.internal.TestInvoker.invokeTestMethod(TestInvoker.java:174) [testng-7.3.0.jar:?]
	at org.testng.internal.MethodRunner.runInSequence(MethodRunner.java:46) ~[testng-7.3.0.jar:?]
	at org.testng.internal.TestInvoker$MethodInvocationAgent.invoke(TestInvoker.java:822) [testng-7.3.0.jar:?]
	at org.testng.internal.TestInvoker.invokeTestMethods(TestInvoker.java:147) [testng-7.3.0.jar:?]
	at org.testng.internal.TestMethodWorker.invokeTestMethods(TestMethodWorker.java:146) [testng-7.3.0.jar:?]
	at org.testng.internal.TestMethodWorker.run(TestMethodWorker.java:128) [testng-7.3.0.jar:?]
	at java.util.concurrent.ThreadPoolExecutor.runWorker(ThreadPoolExecutor.java:1128) [?:?]
	at java.util.concurrent.ThreadPoolExecutor$Worker.run(ThreadPoolExecutor.java:628) [?:?]
	at java.lang.Thread.run(Thread.java:829) [?:?]
Exception in thread "TestNG-test=Surefire test-4" java.lang.NullPointerException
	at com.frameworkium.core.ui.driver.lifecycle.SingleUseDriverLifecycle.getWebDriver(SingleUseDriverLifecycle.java:35)
	at com.frameworkium.core.ui.UITestLifecycle.getWebDriver(UITestLifecycle.java:138)
	at com.frameworkium.core.ui.listeners.ScreenshotListener.takeScreenshotAndSaveLocally(ScreenshotListener.java:42)
	at com.frameworkium.core.ui.listeners.ScreenshotListener.onTestFailure(ScreenshotListener.java:29)
	at org.testng.internal.TestListenerHelper.runTestListeners(TestListenerHelper.java:96)
	at org.testng.internal.TestInvoker.runTestResultListener(TestInvoker.java:220)
	at org.testng.internal.TestInvoker$MethodInvocationAgent.invoke(TestInvoker.java:832)
	at org.testng.internal.TestInvoker.invokeTestMethods(TestInvoker.java:147)
	at org.testng.internal.TestMethodWorker.invokeTestMethods(TestMethodWorker.java:146)
	at org.testng.internal.TestMethodWorker.run(TestMethodWorker.java:128)
	at java.base/java.util.concurrent.ThreadPoolExecutor.runWorker(ThreadPoolExecutor.java:1128)
	at java.base/java.util.concurrent.ThreadPoolExecutor$Worker.run(ThreadPoolExecutor.java:628)
	at java.base/java.lang.Thread.run(Thread.java:829)
15:16:33.309 [TestNG-test=Surefire test-5] INFO  - START theinternet.tests.TheInternetExampleTests.basic_auth
15:16:33.312 [TestNG-test=Surefire test-5] WARN  - SKIP  theinternet.tests.TheInternetExampleTests.basic_auth
15:16:33.312 [TestNG-test=Surefire test-5] ERROR - FAIL  theinternet.tests.TheInternetExampleTests.basic_auth
15:16:33.312 [TestNG-test=Surefire test-5] ERROR - null
java.lang.NullPointerException: null
	at com.frameworkium.core.ui.driver.lifecycle.SingleUseDriverLifecycle.getWebDriver(SingleUseDriverLifecycle.java:35) ~[frameworkium-core-3.0.1.jar:?]
	at com.frameworkium.core.ui.UITestLifecycle.getWebDriver(UITestLifecycle.java:138) ~[frameworkium-core-3.0.1.jar:?]
	at com.frameworkium.core.ui.listeners.ScreenshotListener.takeScreenshotAndSaveLocally(ScreenshotListener.java:42) ~[frameworkium-core-3.0.1.jar:?]
	at com.frameworkium.core.ui.listeners.ScreenshotListener.onTestSkipped(ScreenshotListener.java:36) ~[frameworkium-core-3.0.1.jar:?]
	at org.testng.internal.TestListenerHelper.runTestListeners(TestListenerHelper.java:87) [testng-7.3.0.jar:?]
	at org.testng.internal.TestInvoker.runTestResultListener(TestInvoker.java:220) ~[testng-7.3.0.jar:?]
	at org.testng.internal.TestInvoker.invokeListenersForSkippedTestResult(TestInvoker.java:447) ~[testng-7.3.0.jar:?]
	at org.testng.internal.TestInvoker.invokeMethod(TestInvoker.java:547) ~[testng-7.3.0.jar:?]
	at org.testng.internal.TestInvoker.invokeTestMethod(TestInvoker.java:174) [testng-7.3.0.jar:?]
	at org.testng.internal.MethodRunner.runInSequence(MethodRunner.java:46) ~[testng-7.3.0.jar:?]
	at org.testng.internal.TestInvoker$MethodInvocationAgent.invoke(TestInvoker.java:822) [testng-7.3.0.jar:?]
	at org.testng.internal.TestInvoker.invokeTestMethods(TestInvoker.java:147) [testng-7.3.0.jar:?]
	at org.testng.internal.TestMethodWorker.invokeTestMethods(TestMethodWorker.java:146) [testng-7.3.0.jar:?]
	at org.testng.internal.TestMethodWorker.run(TestMethodWorker.java:128) [testng-7.3.0.jar:?]
	at java.util.concurrent.ThreadPoolExecutor.runWorker(ThreadPoolExecutor.java:1128) [?:?]
	at java.util.concurrent.ThreadPoolExecutor$Worker.run(ThreadPoolExecutor.java:628) [?:?]
	at java.lang.Thread.run(Thread.java:829) [?:?]
Exception in thread "TestNG-test=Surefire test-5" java.lang.NullPointerException
	at com.frameworkium.core.ui.driver.lifecycle.SingleUseDriverLifecycle.getWebDriver(SingleUseDriverLifecycle.java:35)
	at com.frameworkium.core.ui.UITestLifecycle.getWebDriver(UITestLifecycle.java:138)
	at com.frameworkium.core.ui.listeners.ScreenshotListener.takeScreenshotAndSaveLocally(ScreenshotListener.java:42)
	at com.frameworkium.core.ui.listeners.ScreenshotListener.onTestFailure(ScreenshotListener.java:29)
	at org.testng.internal.TestListenerHelper.runTestListeners(TestListenerHelper.java:96)
	at org.testng.internal.TestInvoker.runTestResultListener(TestInvoker.java:220)
	at org.testng.internal.TestInvoker$MethodInvocationAgent.invoke(TestInvoker.java:832)
	at org.testng.internal.TestInvoker.invokeTestMethods(TestInvoker.java:147)
	at org.testng.internal.TestMethodWorker.invokeTestMethods(TestMethodWorker.java:146)
	at org.testng.internal.TestMethodWorker.run(TestMethodWorker.java:128)
	at java.base/java.util.concurrent.ThreadPoolExecutor.runWorker(ThreadPoolExecutor.java:1128)
	at java.base/java.util.concurrent.ThreadPoolExecutor$Worker.run(ThreadPoolExecutor.java:628)
	at java.base/java.lang.Thread.run(Thread.java:829)
15:16:33.320 [TestNG-test=Surefire test-6] INFO  - START theinternet.tests.TheInternetExampleTests.check_boxes
15:16:33.323 [TestNG-test=Surefire test-6] WARN  - SKIP  theinternet.tests.TheInternetExampleTests.check_boxes
15:16:33.324 [TestNG-test=Surefire test-6] ERROR - FAIL  theinternet.tests.TheInternetExampleTests.check_boxes
15:16:33.324 [TestNG-test=Surefire test-6] ERROR - null
java.lang.NullPointerException: null
	at com.frameworkium.core.ui.driver.lifecycle.SingleUseDriverLifecycle.getWebDriver(SingleUseDriverLifecycle.java:35) ~[frameworkium-core-3.0.1.jar:?]
	at com.frameworkium.core.ui.UITestLifecycle.getWebDriver(UITestLifecycle.java:138) ~[frameworkium-core-3.0.1.jar:?]
	at com.frameworkium.core.ui.listeners.ScreenshotListener.takeScreenshotAndSaveLocally(ScreenshotListener.java:42) ~[frameworkium-core-3.0.1.jar:?]
	at com.frameworkium.core.ui.listeners.ScreenshotListener.onTestSkipped(ScreenshotListener.java:36) ~[frameworkium-core-3.0.1.jar:?]
	at org.testng.internal.TestListenerHelper.runTestListeners(TestListenerHelper.java:87) [testng-7.3.0.jar:?]
	at org.testng.internal.TestInvoker.runTestResultListener(TestInvoker.java:220) ~[testng-7.3.0.jar:?]
	at org.testng.internal.TestInvoker.invokeListenersForSkippedTestResult(TestInvoker.java:447) ~[testng-7.3.0.jar:?]
	at org.testng.internal.TestInvoker.invokeMethod(TestInvoker.java:547) ~[testng-7.3.0.jar:?]
	at org.testng.internal.TestInvoker.invokeTestMethod(TestInvoker.java:174) [testng-7.3.0.jar:?]
	at org.testng.internal.MethodRunner.runInSequence(MethodRunner.java:46) ~[testng-7.3.0.jar:?]
	at org.testng.internal.TestInvoker$MethodInvocationAgent.invoke(TestInvoker.java:822) [testng-7.3.0.jar:?]
	at org.testng.internal.TestInvoker.invokeTestMethods(TestInvoker.java:147) [testng-7.3.0.jar:?]
	at org.testng.internal.TestMethodWorker.invokeTestMethods(TestMethodWorker.java:146) [testng-7.3.0.jar:?]
	at org.testng.internal.TestMethodWorker.run(TestMethodWorker.java:128) [testng-7.3.0.jar:?]
	at java.util.concurrent.ThreadPoolExecutor.runWorker(ThreadPoolExecutor.java:1128) [?:?]
	at java.util.concurrent.ThreadPoolExecutor$Worker.run(ThreadPoolExecutor.java:628) [?:?]
	at java.lang.Thread.run(Thread.java:829) [?:?]
Exception in thread "TestNG-test=Surefire test-6" java.lang.NullPointerException
	at com.frameworkium.core.ui.driver.lifecycle.SingleUseDriverLifecycle.getWebDriver(SingleUseDriverLifecycle.java:35)
	at com.frameworkium.core.ui.UITestLifecycle.getWebDriver(UITestLifecycle.java:138)
	at com.frameworkium.core.ui.listeners.ScreenshotListener.takeScreenshotAndSaveLocally(ScreenshotListener.java:42)
	at com.frameworkium.core.ui.listeners.ScreenshotListener.onTestFailure(ScreenshotListener.java:29)
	at org.testng.internal.TestListenerHelper.runTestListeners(TestListenerHelper.java:96)
	at org.testng.internal.TestInvoker.runTestResultListener(TestInvoker.java:220)
	at org.testng.internal.TestInvoker$MethodInvocationAgent.invoke(TestInvoker.java:832)
	at org.testng.internal.TestInvoker.invokeTestMethods(TestInvoker.java:147)
	at org.testng.internal.TestMethodWorker.invokeTestMethods(TestMethodWorker.java:146)
	at org.testng.internal.TestMethodWorker.run(TestMethodWorker.java:128)
	at java.base/java.util.concurrent.ThreadPoolExecutor.runWorker(ThreadPoolExecutor.java:1128)
	at java.base/java.util.concurrent.ThreadPoolExecutor$Worker.run(ThreadPoolExecutor.java:628)
	at java.base/java.lang.Thread.run(Thread.java:829)
15:16:33.331 [TestNG-test=Surefire test-7] INFO  - START theinternet.tests.TheInternetExampleTests.drag_and_drop
15:16:33.333 [TestNG-test=Surefire test-7] WARN  - SKIP  theinternet.tests.TheInternetExampleTests.drag_and_drop
15:16:33.334 [TestNG-test=Surefire test-7] ERROR - FAIL  theinternet.tests.TheInternetExampleTests.drag_and_drop
15:16:33.334 [TestNG-test=Surefire test-7] ERROR - null
java.lang.NullPointerException: null
	at com.frameworkium.core.ui.driver.lifecycle.SingleUseDriverLifecycle.getWebDriver(SingleUseDriverLifecycle.java:35) ~[frameworkium-core-3.0.1.jar:?]
	at com.frameworkium.core.ui.UITestLifecycle.getWebDriver(UITestLifecycle.java:138) ~[frameworkium-core-3.0.1.jar:?]
	at com.frameworkium.core.ui.listeners.ScreenshotListener.takeScreenshotAndSaveLocally(ScreenshotListener.java:42) ~[frameworkium-core-3.0.1.jar:?]
	at com.frameworkium.core.ui.listeners.ScreenshotListener.onTestSkipped(ScreenshotListener.java:36) ~[frameworkium-core-3.0.1.jar:?]
	at org.testng.internal.TestListenerHelper.runTestListeners(TestListenerHelper.java:87) [testng-7.3.0.jar:?]
	at org.testng.internal.TestInvoker.runTestResultListener(TestInvoker.java:220) ~[testng-7.3.0.jar:?]
	at org.testng.internal.TestInvoker.invokeListenersForSkippedTestResult(TestInvoker.java:447) ~[testng-7.3.0.jar:?]
	at org.testng.internal.TestInvoker.invokeMethod(TestInvoker.java:547) ~[testng-7.3.0.jar:?]
	at org.testng.internal.TestInvoker.invokeTestMethod(TestInvoker.java:174) [testng-7.3.0.jar:?]
	at org.testng.internal.MethodRunner.runInSequence(MethodRunner.java:46) ~[testng-7.3.0.jar:?]
	at org.testng.internal.TestInvoker$MethodInvocationAgent.invoke(TestInvoker.java:822) [testng-7.3.0.jar:?]
	at org.testng.internal.TestInvoker.invokeTestMethods(TestInvoker.java:147) [testng-7.3.0.jar:?]
	at org.testng.internal.TestMethodWorker.invokeTestMethods(TestMethodWorker.java:146) [testng-7.3.0.jar:?]
	at org.testng.internal.TestMethodWorker.run(TestMethodWorker.java:128) [testng-7.3.0.jar:?]
	at java.util.concurrent.ThreadPoolExecutor.runWorker(ThreadPoolExecutor.java:1128) [?:?]
	at java.util.concurrent.ThreadPoolExecutor$Worker.run(ThreadPoolExecutor.java:628) [?:?]
	at java.lang.Thread.run(Thread.java:829) [?:?]
Exception in thread "TestNG-test=Surefire test-7" java.lang.NullPointerException
	at com.frameworkium.core.ui.driver.lifecycle.SingleUseDriverLifecycle.getWebDriver(SingleUseDriverLifecycle.java:35)
	at com.frameworkium.core.ui.UITestLifecycle.getWebDriver(UITestLifecycle.java:138)
	at com.frameworkium.core.ui.listeners.ScreenshotListener.takeScreenshotAndSaveLocally(ScreenshotListener.java:42)
	at com.frameworkium.core.ui.listeners.ScreenshotListener.onTestFailure(ScreenshotListener.java:29)
	at org.testng.internal.TestListenerHelper.runTestListeners(TestListenerHelper.java:96)
	at org.testng.internal.TestInvoker.runTestResultListener(TestInvoker.java:220)
	at org.testng.internal.TestInvoker$MethodInvocationAgent.invoke(TestInvoker.java:832)
	at org.testng.internal.TestInvoker.invokeTestMethods(TestInvoker.java:147)
	at org.testng.internal.TestMethodWorker.invokeTestMethods(TestMethodWorker.java:146)
	at org.testng.internal.TestMethodWorker.run(TestMethodWorker.java:128)
	at java.base/java.util.concurrent.ThreadPoolExecutor.runWorker(ThreadPoolExecutor.java:1128)
	at java.base/java.util.concurrent.ThreadPoolExecutor$Worker.run(ThreadPoolExecutor.java:628)
	at java.base/java.lang.Thread.run(Thread.java:829)
15:16:33.340 [TestNG-test=Surefire test-8] INFO  - START theinternet.tests.TheInternetExampleTests.dropdown
15:16:33.342 [TestNG-test=Surefire test-8] WARN  - SKIP  theinternet.tests.TheInternetExampleTests.dropdown
15:16:33.343 [TestNG-test=Surefire test-8] ERROR - FAIL  theinternet.tests.TheInternetExampleTests.dropdown
15:16:33.343 [TestNG-test=Surefire test-8] ERROR - null
java.lang.NullPointerException: null
	at com.frameworkium.core.ui.driver.lifecycle.SingleUseDriverLifecycle.getWebDriver(SingleUseDriverLifecycle.java:35) ~[frameworkium-core-3.0.1.jar:?]
	at com.frameworkium.core.ui.UITestLifecycle.getWebDriver(UITestLifecycle.java:138) ~[frameworkium-core-3.0.1.jar:?]
	at com.frameworkium.core.ui.listeners.ScreenshotListener.takeScreenshotAndSaveLocally(ScreenshotListener.java:42) ~[frameworkium-core-3.0.1.jar:?]
	at com.frameworkium.core.ui.listeners.ScreenshotListener.onTestSkipped(ScreenshotListener.java:36) ~[frameworkium-core-3.0.1.jar:?]
	at org.testng.internal.TestListenerHelper.runTestListeners(TestListenerHelper.java:87) [testng-7.3.0.jar:?]
	at org.testng.internal.TestInvoker.runTestResultListener(TestInvoker.java:220) ~[testng-7.3.0.jar:?]
	at org.testng.internal.TestInvoker.invokeListenersForSkippedTestResult(TestInvoker.java:447) ~[testng-7.3.0.jar:?]
	at org.testng.internal.TestInvoker.invokeMethod(TestInvoker.java:547) ~[testng-7.3.0.jar:?]
	at org.testng.internal.TestInvoker.invokeTestMethod(TestInvoker.java:174) [testng-7.3.0.jar:?]
	at org.testng.internal.MethodRunner.runInSequence(MethodRunner.java:46) ~[testng-7.3.0.jar:?]
	at org.testng.internal.TestInvoker$MethodInvocationAgent.invoke(TestInvoker.java:822) [testng-7.3.0.jar:?]
	at org.testng.internal.TestInvoker.invokeTestMethods(TestInvoker.java:147) [testng-7.3.0.jar:?]
	at org.testng.internal.TestMethodWorker.invokeTestMethods(TestMethodWorker.java:146) [testng-7.3.0.jar:?]
	at org.testng.internal.TestMethodWorker.run(TestMethodWorker.java:128) [testng-7.3.0.jar:?]
	at java.util.concurrent.ThreadPoolExecutor.runWorker(ThreadPoolExecutor.java:1128) [?:?]
	at java.util.concurrent.ThreadPoolExecutor$Worker.run(ThreadPoolExecutor.java:628) [?:?]
	at java.lang.Thread.run(Thread.java:829) [?:?]
Exception in thread "TestNG-test=Surefire test-8" java.lang.NullPointerException
	at com.frameworkium.core.ui.driver.lifecycle.SingleUseDriverLifecycle.getWebDriver(SingleUseDriverLifecycle.java:35)
	at com.frameworkium.core.ui.UITestLifecycle.getWebDriver(UITestLifecycle.java:138)
	at com.frameworkium.core.ui.listeners.ScreenshotListener.takeScreenshotAndSaveLocally(ScreenshotListener.java:42)
	at com.frameworkium.core.ui.listeners.ScreenshotListener.onTestFailure(ScreenshotListener.java:29)
	at org.testng.internal.TestListenerHelper.runTestListeners(TestListenerHelper.java:96)
	at org.testng.internal.TestInvoker.runTestResultListener(TestInvoker.java:220)
	at org.testng.internal.TestInvoker$MethodInvocationAgent.invoke(TestInvoker.java:832)
	at org.testng.internal.TestInvoker.invokeTestMethods(TestInvoker.java:147)
	at org.testng.internal.TestMethodWorker.invokeTestMethods(TestMethodWorker.java:146)
	at org.testng.internal.TestMethodWorker.run(TestMethodWorker.java:128)
	at java.base/java.util.concurrent.ThreadPoolExecutor.runWorker(ThreadPoolExecutor.java:1128)
	at java.base/java.util.concurrent.ThreadPoolExecutor$Worker.run(ThreadPoolExecutor.java:628)
	at java.base/java.lang.Thread.run(Thread.java:829)
15:16:33.347 [TestNG-test=Surefire test-9] INFO  - START theinternet.tests.TheInternetExampleTests.dynamic_loading
15:16:33.348 [TestNG-test=Surefire test-9] WARN  - SKIP  theinternet.tests.TheInternetExampleTests.dynamic_loading
15:16:33.348 [TestNG-test=Surefire test-9] ERROR - FAIL  theinternet.tests.TheInternetExampleTests.dynamic_loading
15:16:33.348 [TestNG-test=Surefire test-9] ERROR - null
java.lang.NullPointerException: null
	at com.frameworkium.core.ui.driver.lifecycle.SingleUseDriverLifecycle.getWebDriver(SingleUseDriverLifecycle.java:35) ~[frameworkium-core-3.0.1.jar:?]
	at com.frameworkium.core.ui.UITestLifecycle.getWebDriver(UITestLifecycle.java:138) ~[frameworkium-core-3.0.1.jar:?]
	at com.frameworkium.core.ui.listeners.ScreenshotListener.takeScreenshotAndSaveLocally(ScreenshotListener.java:42) ~[frameworkium-core-3.0.1.jar:?]
	at com.frameworkium.core.ui.listeners.ScreenshotListener.onTestSkipped(ScreenshotListener.java:36) ~[frameworkium-core-3.0.1.jar:?]
	at org.testng.internal.TestListenerHelper.runTestListeners(TestListenerHelper.java:87) [testng-7.3.0.jar:?]
	at org.testng.internal.TestInvoker.runTestResultListener(TestInvoker.java:220) ~[testng-7.3.0.jar:?]
	at org.testng.internal.TestInvoker.invokeListenersForSkippedTestResult(TestInvoker.java:447) ~[testng-7.3.0.jar:?]
	at org.testng.internal.TestInvoker.invokeMethod(TestInvoker.java:547) ~[testng-7.3.0.jar:?]
	at org.testng.internal.TestInvoker.invokeTestMethod(TestInvoker.java:174) [testng-7.3.0.jar:?]
	at org.testng.internal.MethodRunner.runInSequence(MethodRunner.java:46) ~[testng-7.3.0.jar:?]
	at org.testng.internal.TestInvoker$MethodInvocationAgent.invoke(TestInvoker.java:822) [testng-7.3.0.jar:?]
	at org.testng.internal.TestInvoker.invokeTestMethods(TestInvoker.java:147) [testng-7.3.0.jar:?]
	at org.testng.internal.TestMethodWorker.invokeTestMethods(TestMethodWorker.java:146) [testng-7.3.0.jar:?]
	at org.testng.internal.TestMethodWorker.run(TestMethodWorker.java:128) [testng-7.3.0.jar:?]
	at java.util.concurrent.ThreadPoolExecutor.runWorker(ThreadPoolExecutor.java:1128) [?:?]
	at java.util.concurrent.ThreadPoolExecutor$Worker.run(ThreadPoolExecutor.java:628) [?:?]
	at java.lang.Thread.run(Thread.java:829) [?:?]
Exception in thread "TestNG-test=Surefire test-9" java.lang.NullPointerException
	at com.frameworkium.core.ui.driver.lifecycle.SingleUseDriverLifecycle.getWebDriver(SingleUseDriverLifecycle.java:35)
	at com.frameworkium.core.ui.UITestLifecycle.getWebDriver(UITestLifecycle.java:138)
	at com.frameworkium.core.ui.listeners.ScreenshotListener.takeScreenshotAndSaveLocally(ScreenshotListener.java:42)
	at com.frameworkium.core.ui.listeners.ScreenshotListener.onTestFailure(ScreenshotListener.java:29)
	at org.testng.internal.TestListenerHelper.runTestListeners(TestListenerHelper.java:96)
	at org.testng.internal.TestInvoker.runTestResultListener(TestInvoker.java:220)
	at org.testng.internal.TestInvoker$MethodInvocationAgent.invoke(TestInvoker.java:832)
	at org.testng.internal.TestInvoker.invokeTestMethods(TestInvoker.java:147)
	at org.testng.internal.TestMethodWorker.invokeTestMethods(TestMethodWorker.java:146)
	at org.testng.internal.TestMethodWorker.run(TestMethodWorker.java:128)
	at java.base/java.util.concurrent.ThreadPoolExecutor.runWorker(ThreadPoolExecutor.java:1128)
	at java.base/java.util.concurrent.ThreadPoolExecutor$Worker.run(ThreadPoolExecutor.java:628)
	at java.base/java.lang.Thread.run(Thread.java:829)
15:16:33.352 [TestNG-test=Surefire test-10] INFO  - START theinternet.tests.TheInternetExampleTests.file_download
15:16:33.353 [TestNG-test=Surefire test-10] WARN  - SKIP  theinternet.tests.TheInternetExampleTests.file_download
15:16:33.353 [TestNG-test=Surefire test-10] ERROR - FAIL  theinternet.tests.TheInternetExampleTests.file_download
15:16:33.353 [TestNG-test=Surefire test-10] ERROR - null
java.lang.NullPointerException: null
	at com.frameworkium.core.ui.driver.lifecycle.SingleUseDriverLifecycle.getWebDriver(SingleUseDriverLifecycle.java:35) ~[frameworkium-core-3.0.1.jar:?]
	at com.frameworkium.core.ui.UITestLifecycle.getWebDriver(UITestLifecycle.java:138) ~[frameworkium-core-3.0.1.jar:?]
	at com.frameworkium.core.ui.listeners.ScreenshotListener.takeScreenshotAndSaveLocally(ScreenshotListener.java:42) ~[frameworkium-core-3.0.1.jar:?]
	at com.frameworkium.core.ui.listeners.ScreenshotListener.onTestSkipped(ScreenshotListener.java:36) ~[frameworkium-core-3.0.1.jar:?]
	at org.testng.internal.TestListenerHelper.runTestListeners(TestListenerHelper.java:87) [testng-7.3.0.jar:?]
	at org.testng.internal.TestInvoker.runTestResultListener(TestInvoker.java:220) ~[testng-7.3.0.jar:?]
	at org.testng.internal.TestInvoker.invokeListenersForSkippedTestResult(TestInvoker.java:447) ~[testng-7.3.0.jar:?]
	at org.testng.internal.TestInvoker.invokeMethod(TestInvoker.java:547) ~[testng-7.3.0.jar:?]
	at org.testng.internal.TestInvoker.invokeTestMethod(TestInvoker.java:174) [testng-7.3.0.jar:?]
	at org.testng.internal.MethodRunner.runInSequence(MethodRunner.java:46) ~[testng-7.3.0.jar:?]
	at org.testng.internal.TestInvoker$MethodInvocationAgent.invoke(TestInvoker.java:822) [testng-7.3.0.jar:?]
	at org.testng.internal.TestInvoker.invokeTestMethods(TestInvoker.java:147) [testng-7.3.0.jar:?]
	at org.testng.internal.TestMethodWorker.invokeTestMethods(TestMethodWorker.java:146) [testng-7.3.0.jar:?]
	at org.testng.internal.TestMethodWorker.run(TestMethodWorker.java:128) [testng-7.3.0.jar:?]
	at java.util.concurrent.ThreadPoolExecutor.runWorker(ThreadPoolExecutor.java:1128) [?:?]
	at java.util.concurrent.ThreadPoolExecutor$Worker.run(ThreadPoolExecutor.java:628) [?:?]
	at java.lang.Thread.run(Thread.java:829) [?:?]
Exception in thread "TestNG-test=Surefire test-10" java.lang.NullPointerException
	at com.frameworkium.core.ui.driver.lifecycle.SingleUseDriverLifecycle.getWebDriver(SingleUseDriverLifecycle.java:35)
	at com.frameworkium.core.ui.UITestLifecycle.getWebDriver(UITestLifecycle.java:138)
	at com.frameworkium.core.ui.listeners.ScreenshotListener.takeScreenshotAndSaveLocally(ScreenshotListener.java:42)
	at com.frameworkium.core.ui.listeners.ScreenshotListener.onTestFailure(ScreenshotListener.java:29)
	at org.testng.internal.TestListenerHelper.runTestListeners(TestListenerHelper.java:96)
	at org.testng.internal.TestInvoker.runTestResultListener(TestInvoker.java:220)
	at org.testng.internal.TestInvoker$MethodInvocationAgent.invoke(TestInvoker.java:832)
	at org.testng.internal.TestInvoker.invokeTestMethods(TestInvoker.java:147)
	at org.testng.internal.TestMethodWorker.invokeTestMethods(TestMethodWorker.java:146)
	at org.testng.internal.TestMethodWorker.run(TestMethodWorker.java:128)
	at java.base/java.util.concurrent.ThreadPoolExecutor.runWorker(ThreadPoolExecutor.java:1128)
	at java.base/java.util.concurrent.ThreadPoolExecutor$Worker.run(ThreadPoolExecutor.java:628)
	at java.base/java.lang.Thread.run(Thread.java:829)
15:16:33.360 [TestNG-test=Surefire test-11] INFO  - START theinternet.tests.TheInternetExampleTests.file_upload
15:16:33.362 [TestNG-test=Surefire test-11] WARN  - SKIP  theinternet.tests.TheInternetExampleTests.file_upload
15:16:33.363 [TestNG-test=Surefire test-11] ERROR - FAIL  theinternet.tests.TheInternetExampleTests.file_upload
15:16:33.363 [TestNG-test=Surefire test-11] ERROR - null
java.lang.NullPointerException: null
	at com.frameworkium.core.ui.driver.lifecycle.SingleUseDriverLifecycle.getWebDriver(SingleUseDriverLifecycle.java:35) ~[frameworkium-core-3.0.1.jar:?]
	at com.frameworkium.core.ui.UITestLifecycle.getWebDriver(UITestLifecycle.java:138) ~[frameworkium-core-3.0.1.jar:?]
	at com.frameworkium.core.ui.listeners.ScreenshotListener.takeScreenshotAndSaveLocally(ScreenshotListener.java:42) ~[frameworkium-core-3.0.1.jar:?]
	at com.frameworkium.core.ui.listeners.ScreenshotListener.onTestSkipped(ScreenshotListener.java:36) ~[frameworkium-core-3.0.1.jar:?]
	at org.testng.internal.TestListenerHelper.runTestListeners(TestListenerHelper.java:87) [testng-7.3.0.jar:?]
	at org.testng.internal.TestInvoker.runTestResultListener(TestInvoker.java:220) ~[testng-7.3.0.jar:?]
	at org.testng.internal.TestInvoker.invokeListenersForSkippedTestResult(TestInvoker.java:447) ~[testng-7.3.0.jar:?]
	at org.testng.internal.TestInvoker.invokeMethod(TestInvoker.java:547) ~[testng-7.3.0.jar:?]
	at org.testng.internal.TestInvoker.invokeTestMethod(TestInvoker.java:174) [testng-7.3.0.jar:?]
	at org.testng.internal.MethodRunner.runInSequence(MethodRunner.java:46) ~[testng-7.3.0.jar:?]
	at org.testng.internal.TestInvoker$MethodInvocationAgent.invoke(TestInvoker.java:822) [testng-7.3.0.jar:?]
	at org.testng.internal.TestInvoker.invokeTestMethods(TestInvoker.java:147) [testng-7.3.0.jar:?]
	at org.testng.internal.TestMethodWorker.invokeTestMethods(TestMethodWorker.java:146) [testng-7.3.0.jar:?]
	at org.testng.internal.TestMethodWorker.run(TestMethodWorker.java:128) [testng-7.3.0.jar:?]
	at java.util.concurrent.ThreadPoolExecutor.runWorker(ThreadPoolExecutor.java:1128) [?:?]
	at java.util.concurrent.ThreadPoolExecutor$Worker.run(ThreadPoolExecutor.java:628) [?:?]
	at java.lang.Thread.run(Thread.java:829) [?:?]
Exception in thread "TestNG-test=Surefire test-11" java.lang.NullPointerException
	at com.frameworkium.core.ui.driver.lifecycle.SingleUseDriverLifecycle.getWebDriver(SingleUseDriverLifecycle.java:35)
	at com.frameworkium.core.ui.UITestLifecycle.getWebDriver(UITestLifecycle.java:138)
	at com.frameworkium.core.ui.listeners.ScreenshotListener.takeScreenshotAndSaveLocally(ScreenshotListener.java:42)
	at com.frameworkium.core.ui.listeners.ScreenshotListener.onTestFailure(ScreenshotListener.java:29)
	at org.testng.internal.TestListenerHelper.runTestListeners(TestListenerHelper.java:96)
	at org.testng.internal.TestInvoker.runTestResultListener(TestInvoker.java:220)
	at org.testng.internal.TestInvoker$MethodInvocationAgent.invoke(TestInvoker.java:832)
	at org.testng.internal.TestInvoker.invokeTestMethods(TestInvoker.java:147)
	at org.testng.internal.TestMethodWorker.invokeTestMethods(TestMethodWorker.java:146)
	at org.testng.internal.TestMethodWorker.run(TestMethodWorker.java:128)
	at java.base/java.util.concurrent.ThreadPoolExecutor.runWorker(ThreadPoolExecutor.java:1128)
	at java.base/java.util.concurrent.ThreadPoolExecutor$Worker.run(ThreadPoolExecutor.java:628)
	at java.base/java.lang.Thread.run(Thread.java:829)
15:16:33.369 [TestNG-test=Surefire test-12] INFO  - START theinternet.tests.TheInternetExampleTests.form_authentication
15:16:33.372 [TestNG-test=Surefire test-12] WARN  - SKIP  theinternet.tests.TheInternetExampleTests.form_authentication
15:16:33.372 [TestNG-test=Surefire test-12] ERROR - FAIL  theinternet.tests.TheInternetExampleTests.form_authentication
15:16:33.372 [TestNG-test=Surefire test-12] ERROR - null
java.lang.NullPointerException: null
	at com.frameworkium.core.ui.driver.lifecycle.SingleUseDriverLifecycle.getWebDriver(SingleUseDriverLifecycle.java:35) ~[frameworkium-core-3.0.1.jar:?]
	at com.frameworkium.core.ui.UITestLifecycle.getWebDriver(UITestLifecycle.java:138) ~[frameworkium-core-3.0.1.jar:?]
	at com.frameworkium.core.ui.listeners.ScreenshotListener.takeScreenshotAndSaveLocally(ScreenshotListener.java:42) ~[frameworkium-core-3.0.1.jar:?]
	at com.frameworkium.core.ui.listeners.ScreenshotListener.onTestSkipped(ScreenshotListener.java:36) ~[frameworkium-core-3.0.1.jar:?]
	at org.testng.internal.TestListenerHelper.runTestListeners(TestListenerHelper.java:87) [testng-7.3.0.jar:?]
	at org.testng.internal.TestInvoker.runTestResultListener(TestInvoker.java:220) ~[testng-7.3.0.jar:?]
	at org.testng.internal.TestInvoker.invokeListenersForSkippedTestResult(TestInvoker.java:447) ~[testng-7.3.0.jar:?]
	at org.testng.internal.TestInvoker.invokeMethod(TestInvoker.java:547) ~[testng-7.3.0.jar:?]
	at org.testng.internal.TestInvoker.invokeTestMethod(TestInvoker.java:174) [testng-7.3.0.jar:?]
	at org.testng.internal.MethodRunner.runInSequence(MethodRunner.java:46) ~[testng-7.3.0.jar:?]
	at org.testng.internal.TestInvoker$MethodInvocationAgent.invoke(TestInvoker.java:822) [testng-7.3.0.jar:?]
	at org.testng.internal.TestInvoker.invokeTestMethods(TestInvoker.java:147) [testng-7.3.0.jar:?]
	at org.testng.internal.TestMethodWorker.invokeTestMethods(TestMethodWorker.java:146) [testng-7.3.0.jar:?]
	at org.testng.internal.TestMethodWorker.run(TestMethodWorker.java:128) [testng-7.3.0.jar:?]
	at java.util.concurrent.ThreadPoolExecutor.runWorker(ThreadPoolExecutor.java:1128) [?:?]
	at java.util.concurrent.ThreadPoolExecutor$Worker.run(ThreadPoolExecutor.java:628) [?:?]
	at java.lang.Thread.run(Thread.java:829) [?:?]
Exception in thread "TestNG-test=Surefire test-12" java.lang.NullPointerException
	at com.frameworkium.core.ui.driver.lifecycle.SingleUseDriverLifecycle.getWebDriver(SingleUseDriverLifecycle.java:35)
	at com.frameworkium.core.ui.UITestLifecycle.getWebDriver(UITestLifecycle.java:138)
	at com.frameworkium.core.ui.listeners.ScreenshotListener.takeScreenshotAndSaveLocally(ScreenshotListener.java:42)
	at com.frameworkium.core.ui.listeners.ScreenshotListener.onTestFailure(ScreenshotListener.java:29)
	at org.testng.internal.TestListenerHelper.runTestListeners(TestListenerHelper.java:96)
	at org.testng.internal.TestInvoker.runTestResultListener(TestInvoker.java:220)
	at org.testng.internal.TestInvoker$MethodInvocationAgent.invoke(TestInvoker.java:832)
	at org.testng.internal.TestInvoker.invokeTestMethods(TestInvoker.java:147)
	at org.testng.internal.TestMethodWorker.invokeTestMethods(TestMethodWorker.java:146)
	at org.testng.internal.TestMethodWorker.run(TestMethodWorker.java:128)
	at java.base/java.util.concurrent.ThreadPoolExecutor.runWorker(ThreadPoolExecutor.java:1128)
	at java.base/java.util.concurrent.ThreadPoolExecutor$Worker.run(ThreadPoolExecutor.java:628)
	at java.base/java.lang.Thread.run(Thread.java:829)
15:16:33.376 [TestNG-test=Surefire test-13] INFO  - START theinternet.tests.TheInternetExampleTests.hovers
15:16:33.377 [TestNG-test=Surefire test-13] WARN  - SKIP  theinternet.tests.TheInternetExampleTests.hovers
15:16:33.377 [TestNG-test=Surefire test-13] ERROR - FAIL  theinternet.tests.TheInternetExampleTests.hovers
15:16:33.377 [TestNG-test=Surefire test-13] ERROR - null
java.lang.NullPointerException: null
	at com.frameworkium.core.ui.driver.lifecycle.SingleUseDriverLifecycle.getWebDriver(SingleUseDriverLifecycle.java:35) ~[frameworkium-core-3.0.1.jar:?]
	at com.frameworkium.core.ui.UITestLifecycle.getWebDriver(UITestLifecycle.java:138) ~[frameworkium-core-3.0.1.jar:?]
	at com.frameworkium.core.ui.listeners.ScreenshotListener.takeScreenshotAndSaveLocally(ScreenshotListener.java:42) ~[frameworkium-core-3.0.1.jar:?]
	at com.frameworkium.core.ui.listeners.ScreenshotListener.onTestSkipped(ScreenshotListener.java:36) ~[frameworkium-core-3.0.1.jar:?]
	at org.testng.internal.TestListenerHelper.runTestListeners(TestListenerHelper.java:87) [testng-7.3.0.jar:?]
	at org.testng.internal.TestInvoker.runTestResultListener(TestInvoker.java:220) ~[testng-7.3.0.jar:?]
	at org.testng.internal.TestInvoker.invokeListenersForSkippedTestResult(TestInvoker.java:447) ~[testng-7.3.0.jar:?]
	at org.testng.internal.TestInvoker.invokeMethod(TestInvoker.java:547) ~[testng-7.3.0.jar:?]
	at org.testng.internal.TestInvoker.invokeTestMethod(TestInvoker.java:174) [testng-7.3.0.jar:?]
	at org.testng.internal.MethodRunner.runInSequence(MethodRunner.java:46) ~[testng-7.3.0.jar:?]
	at org.testng.internal.TestInvoker$MethodInvocationAgent.invoke(TestInvoker.java:822) [testng-7.3.0.jar:?]
	at org.testng.internal.TestInvoker.invokeTestMethods(TestInvoker.java:147) [testng-7.3.0.jar:?]
	at org.testng.internal.TestMethodWorker.invokeTestMethods(TestMethodWorker.java:146) [testng-7.3.0.jar:?]
	at org.testng.internal.TestMethodWorker.run(TestMethodWorker.java:128) [testng-7.3.0.jar:?]
	at java.util.concurrent.ThreadPoolExecutor.runWorker(ThreadPoolExecutor.java:1128) [?:?]
	at java.util.concurrent.ThreadPoolExecutor$Worker.run(ThreadPoolExecutor.java:628) [?:?]
	at java.lang.Thread.run(Thread.java:829) [?:?]
Exception in thread "TestNG-test=Surefire test-13" java.lang.NullPointerException
	at com.frameworkium.core.ui.driver.lifecycle.SingleUseDriverLifecycle.getWebDriver(SingleUseDriverLifecycle.java:35)
	at com.frameworkium.core.ui.UITestLifecycle.getWebDriver(UITestLifecycle.java:138)
	at com.frameworkium.core.ui.listeners.ScreenshotListener.takeScreenshotAndSaveLocally(ScreenshotListener.java:42)
	at com.frameworkium.core.ui.listeners.ScreenshotListener.onTestFailure(ScreenshotListener.java:29)
	at org.testng.internal.TestListenerHelper.runTestListeners(TestListenerHelper.java:96)
	at org.testng.internal.TestInvoker.runTestResultListener(TestInvoker.java:220)
	at org.testng.internal.TestInvoker$MethodInvocationAgent.invoke(TestInvoker.java:832)
	at org.testng.internal.TestInvoker.invokeTestMethods(TestInvoker.java:147)
	at org.testng.internal.TestMethodWorker.invokeTestMethods(TestMethodWorker.java:146)
	at org.testng.internal.TestMethodWorker.run(TestMethodWorker.java:128)
	at java.base/java.util.concurrent.ThreadPoolExecutor.runWorker(ThreadPoolExecutor.java:1128)
	at java.base/java.util.concurrent.ThreadPoolExecutor$Worker.run(ThreadPoolExecutor.java:628)
	at java.base/java.lang.Thread.run(Thread.java:829)
15:16:33.382 [TestNG-test=Surefire test-14] INFO  - START theinternet.tests.TheInternetExampleTests.iframe_test
15:16:33.384 [TestNG-test=Surefire test-14] WARN  - SKIP  theinternet.tests.TheInternetExampleTests.iframe_test
15:16:33.384 [TestNG-test=Surefire test-14] ERROR - FAIL  theinternet.tests.TheInternetExampleTests.iframe_test
15:16:33.384 [TestNG-test=Surefire test-14] ERROR - null
java.lang.NullPointerException: null
	at com.frameworkium.core.ui.driver.lifecycle.SingleUseDriverLifecycle.getWebDriver(SingleUseDriverLifecycle.java:35) ~[frameworkium-core-3.0.1.jar:?]
	at com.frameworkium.core.ui.UITestLifecycle.getWebDriver(UITestLifecycle.java:138) ~[frameworkium-core-3.0.1.jar:?]
	at com.frameworkium.core.ui.listeners.ScreenshotListener.takeScreenshotAndSaveLocally(ScreenshotListener.java:42) ~[frameworkium-core-3.0.1.jar:?]
	at com.frameworkium.core.ui.listeners.ScreenshotListener.onTestSkipped(ScreenshotListener.java:36) ~[frameworkium-core-3.0.1.jar:?]
	at org.testng.internal.TestListenerHelper.runTestListeners(TestListenerHelper.java:87) [testng-7.3.0.jar:?]
	at org.testng.internal.TestInvoker.runTestResultListener(TestInvoker.java:220) ~[testng-7.3.0.jar:?]
	at org.testng.internal.TestInvoker.invokeListenersForSkippedTestResult(TestInvoker.java:447) ~[testng-7.3.0.jar:?]
	at org.testng.internal.TestInvoker.invokeMethod(TestInvoker.java:547) ~[testng-7.3.0.jar:?]
	at org.testng.internal.TestInvoker.invokeTestMethod(TestInvoker.java:174) [testng-7.3.0.jar:?]
	at org.testng.internal.MethodRunner.runInSequence(MethodRunner.java:46) ~[testng-7.3.0.jar:?]
	at org.testng.internal.TestInvoker$MethodInvocationAgent.invoke(TestInvoker.java:822) [testng-7.3.0.jar:?]
	at org.testng.internal.TestInvoker.invokeTestMethods(TestInvoker.java:147) [testng-7.3.0.jar:?]
	at org.testng.internal.TestMethodWorker.invokeTestMethods(TestMethodWorker.java:146) [testng-7.3.0.jar:?]
	at org.testng.internal.TestMethodWorker.run(TestMethodWorker.java:128) [testng-7.3.0.jar:?]
	at java.util.concurrent.ThreadPoolExecutor.runWorker(ThreadPoolExecutor.java:1128) [?:?]
	at java.util.concurrent.ThreadPoolExecutor$Worker.run(ThreadPoolExecutor.java:628) [?:?]
	at java.lang.Thread.run(Thread.java:829) [?:?]
Exception in thread "TestNG-test=Surefire test-14" java.lang.NullPointerException
	at com.frameworkium.core.ui.driver.lifecycle.SingleUseDriverLifecycle.getWebDriver(SingleUseDriverLifecycle.java:35)
	at com.frameworkium.core.ui.UITestLifecycle.getWebDriver(UITestLifecycle.java:138)
	at com.frameworkium.core.ui.listeners.ScreenshotListener.takeScreenshotAndSaveLocally(ScreenshotListener.java:42)
	at com.frameworkium.core.ui.listeners.ScreenshotListener.onTestFailure(ScreenshotListener.java:29)
	at org.testng.internal.TestListenerHelper.runTestListeners(TestListenerHelper.java:96)
	at org.testng.internal.TestInvoker.runTestResultListener(TestInvoker.java:220)
	at org.testng.internal.TestInvoker$MethodInvocationAgent.invoke(TestInvoker.java:832)
	at org.testng.internal.TestInvoker.invokeTestMethods(TestInvoker.java:147)
	at org.testng.internal.TestMethodWorker.invokeTestMethods(TestMethodWorker.java:146)
	at org.testng.internal.TestMethodWorker.run(TestMethodWorker.java:128)
	at java.base/java.util.concurrent.ThreadPoolExecutor.runWorker(ThreadPoolExecutor.java:1128)
	at java.base/java.util.concurrent.ThreadPoolExecutor$Worker.run(ThreadPoolExecutor.java:628)
	at java.base/java.lang.Thread.run(Thread.java:829)
15:16:33.391 [TestNG-test=Surefire test-15] INFO  - START theinternet.tests.TheInternetExampleTests.javascript_alerts
15:16:33.393 [TestNG-test=Surefire test-15] WARN  - SKIP  theinternet.tests.TheInternetExampleTests.javascript_alerts
15:16:33.394 [TestNG-test=Surefire test-15] ERROR - FAIL  theinternet.tests.TheInternetExampleTests.javascript_alerts
15:16:33.394 [TestNG-test=Surefire test-15] ERROR - null
java.lang.NullPointerException: null
	at com.frameworkium.core.ui.driver.lifecycle.SingleUseDriverLifecycle.getWebDriver(SingleUseDriverLifecycle.java:35) ~[frameworkium-core-3.0.1.jar:?]
	at com.frameworkium.core.ui.UITestLifecycle.getWebDriver(UITestLifecycle.java:138) ~[frameworkium-core-3.0.1.jar:?]
	at com.frameworkium.core.ui.listeners.ScreenshotListener.takeScreenshotAndSaveLocally(ScreenshotListener.java:42) ~[frameworkium-core-3.0.1.jar:?]
	at com.frameworkium.core.ui.listeners.ScreenshotListener.onTestSkipped(ScreenshotListener.java:36) ~[frameworkium-core-3.0.1.jar:?]
	at org.testng.internal.TestListenerHelper.runTestListeners(TestListenerHelper.java:87) [testng-7.3.0.jar:?]
	at org.testng.internal.TestInvoker.runTestResultListener(TestInvoker.java:220) ~[testng-7.3.0.jar:?]
	at org.testng.internal.TestInvoker.invokeListenersForSkippedTestResult(TestInvoker.java:447) ~[testng-7.3.0.jar:?]
	at org.testng.internal.TestInvoker.invokeMethod(TestInvoker.java:547) ~[testng-7.3.0.jar:?]
	at org.testng.internal.TestInvoker.invokeTestMethod(TestInvoker.java:174) [testng-7.3.0.jar:?]
	at org.testng.internal.MethodRunner.runInSequence(MethodRunner.java:46) ~[testng-7.3.0.jar:?]
	at org.testng.internal.TestInvoker$MethodInvocationAgent.invoke(TestInvoker.java:822) [testng-7.3.0.jar:?]
	at org.testng.internal.TestInvoker.invokeTestMethods(TestInvoker.java:147) [testng-7.3.0.jar:?]
	at org.testng.internal.TestMethodWorker.invokeTestMethods(TestMethodWorker.java:146) [testng-7.3.0.jar:?]
	at org.testng.internal.TestMethodWorker.run(TestMethodWorker.java:128) [testng-7.3.0.jar:?]
	at java.util.concurrent.ThreadPoolExecutor.runWorker(ThreadPoolExecutor.java:1128) [?:?]
	at java.util.concurrent.ThreadPoolExecutor$Worker.run(ThreadPoolExecutor.java:628) [?:?]
	at java.lang.Thread.run(Thread.java:829) [?:?]
Exception in thread "TestNG-test=Surefire test-15" java.lang.NullPointerException
	at com.frameworkium.core.ui.driver.lifecycle.SingleUseDriverLifecycle.getWebDriver(SingleUseDriverLifecycle.java:35)
	at com.frameworkium.core.ui.UITestLifecycle.getWebDriver(UITestLifecycle.java:138)
	at com.frameworkium.core.ui.listeners.ScreenshotListener.takeScreenshotAndSaveLocally(ScreenshotListener.java:42)
	at com.frameworkium.core.ui.listeners.ScreenshotListener.onTestFailure(ScreenshotListener.java:29)
	at org.testng.internal.TestListenerHelper.runTestListeners(TestListenerHelper.java:96)
	at org.testng.internal.TestInvoker.runTestResultListener(TestInvoker.java:220)
	at org.testng.internal.TestInvoker$MethodInvocationAgent.invoke(TestInvoker.java:832)
	at org.testng.internal.TestInvoker.invokeTestMethods(TestInvoker.java:147)
	at org.testng.internal.TestMethodWorker.invokeTestMethods(TestMethodWorker.java:146)
	at org.testng.internal.TestMethodWorker.run(TestMethodWorker.java:128)
	at java.base/java.util.concurrent.ThreadPoolExecutor.runWorker(ThreadPoolExecutor.java:1128)
	at java.base/java.util.concurrent.ThreadPoolExecutor$Worker.run(ThreadPoolExecutor.java:628)
	at java.base/java.lang.Thread.run(Thread.java:829)
15:16:33.399 [TestNG-test=Surefire test-16] INFO  - START theinternet.tests.TheInternetExampleTests.key_presses
15:16:33.400 [TestNG-test=Surefire test-16] WARN  - SKIP  theinternet.tests.TheInternetExampleTests.key_presses
15:16:33.400 [TestNG-test=Surefire test-16] ERROR - FAIL  theinternet.tests.TheInternetExampleTests.key_presses
15:16:33.401 [TestNG-test=Surefire test-16] ERROR - null
java.lang.NullPointerException: null
	at com.frameworkium.core.ui.driver.lifecycle.SingleUseDriverLifecycle.getWebDriver(SingleUseDriverLifecycle.java:35) ~[frameworkium-core-3.0.1.jar:?]
	at com.frameworkium.core.ui.UITestLifecycle.getWebDriver(UITestLifecycle.java:138) ~[frameworkium-core-3.0.1.jar:?]
	at com.frameworkium.core.ui.listeners.ScreenshotListener.takeScreenshotAndSaveLocally(ScreenshotListener.java:42) ~[frameworkium-core-3.0.1.jar:?]
	at com.frameworkium.core.ui.listeners.ScreenshotListener.onTestSkipped(ScreenshotListener.java:36) ~[frameworkium-core-3.0.1.jar:?]
	at org.testng.internal.TestListenerHelper.runTestListeners(TestListenerHelper.java:87) [testng-7.3.0.jar:?]
	at org.testng.internal.TestInvoker.runTestResultListener(TestInvoker.java:220) ~[testng-7.3.0.jar:?]
	at org.testng.internal.TestInvoker.invokeListenersForSkippedTestResult(TestInvoker.java:447) ~[testng-7.3.0.jar:?]
	at org.testng.internal.TestInvoker.invokeMethod(TestInvoker.java:547) ~[testng-7.3.0.jar:?]
	at org.testng.internal.TestInvoker.invokeTestMethod(TestInvoker.java:174) [testng-7.3.0.jar:?]
	at org.testng.internal.MethodRunner.runInSequence(MethodRunner.java:46) ~[testng-7.3.0.jar:?]
	at org.testng.internal.TestInvoker$MethodInvocationAgent.invoke(TestInvoker.java:822) [testng-7.3.0.jar:?]
	at org.testng.internal.TestInvoker.invokeTestMethods(TestInvoker.java:147) [testng-7.3.0.jar:?]
	at org.testng.internal.TestMethodWorker.invokeTestMethods(TestMethodWorker.java:146) [testng-7.3.0.jar:?]
	at org.testng.internal.TestMethodWorker.run(TestMethodWorker.java:128) [testng-7.3.0.jar:?]
	at java.util.concurrent.ThreadPoolExecutor.runWorker(ThreadPoolExecutor.java:1128) [?:?]
	at java.util.concurrent.ThreadPoolExecutor$Worker.run(ThreadPoolExecutor.java:628) [?:?]
	at java.lang.Thread.run(Thread.java:829) [?:?]
Exception in thread "TestNG-test=Surefire test-16" java.lang.NullPointerException
	at com.frameworkium.core.ui.driver.lifecycle.SingleUseDriverLifecycle.getWebDriver(SingleUseDriverLifecycle.java:35)
	at com.frameworkium.core.ui.UITestLifecycle.getWebDriver(UITestLifecycle.java:138)
	at com.frameworkium.core.ui.listeners.ScreenshotListener.takeScreenshotAndSaveLocally(ScreenshotListener.java:42)
	at com.frameworkium.core.ui.listeners.ScreenshotListener.onTestFailure(ScreenshotListener.java:29)
	at org.testng.internal.TestListenerHelper.runTestListeners(TestListenerHelper.java:96)
	at org.testng.internal.TestInvoker.runTestResultListener(TestInvoker.java:220)
	at org.testng.internal.TestInvoker$MethodInvocationAgent.invoke(TestInvoker.java:832)
	at org.testng.internal.TestInvoker.invokeTestMethods(TestInvoker.java:147)
	at org.testng.internal.TestMethodWorker.invokeTestMethods(TestMethodWorker.java:146)
	at org.testng.internal.TestMethodWorker.run(TestMethodWorker.java:128)
	at java.base/java.util.concurrent.ThreadPoolExecutor.runWorker(ThreadPoolExecutor.java:1128)
	at java.base/java.util.concurrent.ThreadPoolExecutor$Worker.run(ThreadPoolExecutor.java:628)
	at java.base/java.lang.Thread.run(Thread.java:829)
15:16:33.407 [TestNG-test=Surefire test-17] INFO  - START theinternet.tests.TheInternetExampleTests.sort_data_table
15:16:33.410 [TestNG-test=Surefire test-17] WARN  - SKIP  theinternet.tests.TheInternetExampleTests.sort_data_table
15:16:33.410 [TestNG-test=Surefire test-17] ERROR - FAIL  theinternet.tests.TheInternetExampleTests.sort_data_table
15:16:33.410 [TestNG-test=Surefire test-17] ERROR - null
java.lang.NullPointerException: null
	at com.frameworkium.core.ui.driver.lifecycle.SingleUseDriverLifecycle.getWebDriver(SingleUseDriverLifecycle.java:35) ~[frameworkium-core-3.0.1.jar:?]
	at com.frameworkium.core.ui.UITestLifecycle.getWebDriver(UITestLifecycle.java:138) ~[frameworkium-core-3.0.1.jar:?]
	at com.frameworkium.core.ui.listeners.ScreenshotListener.takeScreenshotAndSaveLocally(ScreenshotListener.java:42) ~[frameworkium-core-3.0.1.jar:?]
	at com.frameworkium.core.ui.listeners.ScreenshotListener.onTestSkipped(ScreenshotListener.java:36) ~[frameworkium-core-3.0.1.jar:?]
	at org.testng.internal.TestListenerHelper.runTestListeners(TestListenerHelper.java:87) [testng-7.3.0.jar:?]
	at org.testng.internal.TestInvoker.runTestResultListener(TestInvoker.java:220) ~[testng-7.3.0.jar:?]
	at org.testng.internal.TestInvoker.invokeListenersForSkippedTestResult(TestInvoker.java:447) ~[testng-7.3.0.jar:?]
	at org.testng.internal.TestInvoker.invokeMethod(TestInvoker.java:547) ~[testng-7.3.0.jar:?]
	at org.testng.internal.TestInvoker.invokeTestMethod(TestInvoker.java:174) [testng-7.3.0.jar:?]
	at org.testng.internal.MethodRunner.runInSequence(MethodRunner.java:46) ~[testng-7.3.0.jar:?]
	at org.testng.internal.TestInvoker$MethodInvocationAgent.invoke(TestInvoker.java:822) [testng-7.3.0.jar:?]
	at org.testng.internal.TestInvoker.invokeTestMethods(TestInvoker.java:147) [testng-7.3.0.jar:?]
	at org.testng.internal.TestMethodWorker.invokeTestMethods(TestMethodWorker.java:146) [testng-7.3.0.jar:?]
	at org.testng.internal.TestMethodWorker.run(TestMethodWorker.java:128) [testng-7.3.0.jar:?]
	at java.util.concurrent.ThreadPoolExecutor.runWorker(ThreadPoolExecutor.java:1128) [?:?]
	at java.util.concurrent.ThreadPoolExecutor$Worker.run(ThreadPoolExecutor.java:628) [?:?]
	at java.lang.Thread.run(Thread.java:829) [?:?]
Exception in thread "TestNG-test=Surefire test-17" java.lang.NullPointerException
	at com.frameworkium.core.ui.driver.lifecycle.SingleUseDriverLifecycle.getWebDriver(SingleUseDriverLifecycle.java:35)
	at com.frameworkium.core.ui.UITestLifecycle.getWebDriver(UITestLifecycle.java:138)
	at com.frameworkium.core.ui.listeners.ScreenshotListener.takeScreenshotAndSaveLocally(ScreenshotListener.java:42)
	at com.frameworkium.core.ui.listeners.ScreenshotListener.onTestFailure(ScreenshotListener.java:29)
	at org.testng.internal.TestListenerHelper.runTestListeners(TestListenerHelper.java:96)
	at org.testng.internal.TestInvoker.runTestResultListener(TestInvoker.java:220)
	at org.testng.internal.TestInvoker$MethodInvocationAgent.invoke(TestInvoker.java:832)
	at org.testng.internal.TestInvoker.invokeTestMethods(TestInvoker.java:147)
	at org.testng.internal.TestMethodWorker.invokeTestMethods(TestMethodWorker.java:146)
	at org.testng.internal.TestMethodWorker.run(TestMethodWorker.java:128)
	at java.base/java.util.concurrent.ThreadPoolExecutor.runWorker(ThreadPoolExecutor.java:1128)
	at java.base/java.util.concurrent.ThreadPoolExecutor$Worker.run(ThreadPoolExecutor.java:628)
	at java.base/java.lang.Thread.run(Thread.java:829)
[ERROR] Tests run: 26, Failures: 17, Errors: 0, Skipped: 1, Time elapsed: 19.37 s <<< FAILURE! - in TestSuite
[ERROR] configureBrowserBeforeTest(angularjs.tests.DocumentationTest)  Time elapsed: 4.338 s  <<< FAILURE!
java.lang.IllegalStateException: The path to the driver executable must be set by the webdriver.gecko.driver system property; for more information, see https://github.com/mozilla/geckodriver. The latest version can be downloaded from https://github.com/mozilla/geckodriver/releases

[ERROR] configureBrowserBeforeTest(tables.wikipedia.tests.EnglishCountiesTest)  Time elapsed: 0.016 s  <<< FAILURE!
java.lang.IllegalStateException: The path to the driver executable must be set by the webdriver.gecko.driver system property; for more information, see https://github.com/mozilla/geckodriver. The latest version can be downloaded from https://github.com/mozilla/geckodriver/releases

[ERROR] configureBrowserBeforeTest(tables.wikipedia.tests.LargestMountainTest)  Time elapsed: 1.727 s  <<< FAILURE!
java.lang.IllegalStateException: The path to the driver executable must be set by the webdriver.gecko.driver system property; for more information, see https://github.com/mozilla/geckodriver. The latest version can be downloaded from https://github.com/mozilla/geckodriver/releases

[ERROR] configureBrowserBeforeTest(seleniumhq.tests.SeleniumHQTest)  Time elapsed: 2.684 s  <<< FAILURE!
java.lang.IllegalStateException: The path to the driver executable must be set by the webdriver.gecko.driver system property; for more information, see https://github.com/mozilla/geckodriver. The latest version can be downloaded from https://github.com/mozilla/geckodriver/releases

[ERROR] configureBrowserBeforeTest(theinternet.tests.TheInternetExampleTests)  Time elapsed: 0.014 s  <<< FAILURE!
java.lang.IllegalStateException: The path to the driver executable must be set by the webdriver.gecko.driver system property; for more information, see https://github.com/mozilla/geckodriver. The latest version can be downloaded from https://github.com/mozilla/geckodriver/releases

[ERROR] configureBrowserBeforeTest(theinternet.tests.TheInternetExampleTests)  Time elapsed: 0.01 s  <<< FAILURE!
java.lang.IllegalStateException: The path to the driver executable must be set by the webdriver.gecko.driver system property; for more information, see https://github.com/mozilla/geckodriver. The latest version can be downloaded from https://github.com/mozilla/geckodriver/releases

[ERROR] configureBrowserBeforeTest(theinternet.tests.TheInternetExampleTests)  Time elapsed: 0.012 s  <<< FAILURE!
java.lang.IllegalStateException: The path to the driver executable must be set by the webdriver.gecko.driver system property; for more information, see https://github.com/mozilla/geckodriver. The latest version can be downloaded from https://github.com/mozilla/geckodriver/releases

[ERROR] configureBrowserBeforeTest(theinternet.tests.TheInternetExampleTests)  Time elapsed: 0.008 s  <<< FAILURE!
java.lang.IllegalStateException: The path to the driver executable must be set by the webdriver.gecko.driver system property; for more information, see https://github.com/mozilla/geckodriver. The latest version can be downloaded from https://github.com/mozilla/geckodriver/releases

[ERROR] configureBrowserBeforeTest(theinternet.tests.TheInternetExampleTests)  Time elapsed: 0.006 s  <<< FAILURE!
java.lang.IllegalStateException: The path to the driver executable must be set by the webdriver.gecko.driver system property; for more information, see https://github.com/mozilla/geckodriver. The latest version can be downloaded from https://github.com/mozilla/geckodriver/releases

[ERROR] configureBrowserBeforeTest(theinternet.tests.TheInternetExampleTests)  Time elapsed: 0.004 s  <<< FAILURE!
java.lang.IllegalStateException: The path to the driver executable must be set by the webdriver.gecko.driver system property; for more information, see https://github.com/mozilla/geckodriver. The latest version can be downloaded from https://github.com/mozilla/geckodriver/releases

[ERROR] configureBrowserBeforeTest(theinternet.tests.TheInternetExampleTests)  Time elapsed: 0.008 s  <<< FAILURE!
java.lang.IllegalStateException: The path to the driver executable must be set by the webdriver.gecko.driver system property; for more information, see https://github.com/mozilla/geckodriver. The latest version can be downloaded from https://github.com/mozilla/geckodriver/releases

[ERROR] configureBrowserBeforeTest(theinternet.tests.TheInternetExampleTests)  Time elapsed: 0.008 s  <<< FAILURE!
java.lang.IllegalStateException: The path to the driver executable must be set by the webdriver.gecko.driver system property; for more information, see https://github.com/mozilla/geckodriver. The latest version can be downloaded from https://github.com/mozilla/geckodriver/releases

[ERROR] configureBrowserBeforeTest(theinternet.tests.TheInternetExampleTests)  Time elapsed: 0.007 s  <<< FAILURE!
java.lang.IllegalStateException: The path to the driver executable must be set by the webdriver.gecko.driver system property; for more information, see https://github.com/mozilla/geckodriver. The latest version can be downloaded from https://github.com/mozilla/geckodriver/releases

[ERROR] configureBrowserBeforeTest(theinternet.tests.TheInternetExampleTests)  Time elapsed: 0.006 s  <<< FAILURE!
java.lang.IllegalStateException: The path to the driver executable must be set by the webdriver.gecko.driver system property; for more information, see https://github.com/mozilla/geckodriver. The latest version can be downloaded from https://github.com/mozilla/geckodriver/releases

[ERROR] configureBrowserBeforeTest(theinternet.tests.TheInternetExampleTests)  Time elapsed: 0.009 s  <<< FAILURE!
java.lang.IllegalStateException: The path to the driver executable must be set by the webdriver.gecko.driver system property; for more information, see https://github.com/mozilla/geckodriver. The latest version can be downloaded from https://github.com/mozilla/geckodriver/releases

[ERROR] configureBrowserBeforeTest(theinternet.tests.TheInternetExampleTests)  Time elapsed: 0.008 s  <<< FAILURE!
java.lang.IllegalStateException: The path to the driver executable must be set by the webdriver.gecko.driver system property; for more information, see https://github.com/mozilla/geckodriver. The latest version can be downloaded from https://github.com/mozilla/geckodriver/releases

[ERROR] configureBrowserBeforeTest(theinternet.tests.TheInternetExampleTests)  Time elapsed: 0.008 s  <<< FAILURE!
java.lang.IllegalStateException: The path to the driver executable must be set by the webdriver.gecko.driver system property; for more information, see https://github.com/mozilla/geckodriver. The latest version can be downloaded from https://github.com/mozilla/geckodriver/releases

[INFO] 
[INFO] Results:
[INFO] 
[ERROR] Failures: 
[ERROR]   DocumentationTest>BaseUITest.configureBrowserBeforeTest:51  IllegalState The ...
[ERROR]   SeleniumHQTest>BaseUITest.configureBrowserBeforeTest:51  IllegalState The pat...
[ERROR]   EnglishCountiesTest>BaseUITest.configureBrowserBeforeTest:51  IllegalState Th...
[ERROR]   LargestMountainTest>BaseUITest.configureBrowserBeforeTest:51  IllegalState Th...
[ERROR] theinternet.tests.TheInternetExampleTests.configureBrowserBeforeTest(theinternet.tests.TheInternetExampleTests)
[ERROR]   Run 1: TheInternetExampleTests>BaseUITest.configureBrowserBeforeTest:51  IllegalState
[ERROR]   Run 2: TheInternetExampleTests>BaseUITest.configureBrowserBeforeTest:51  IllegalState
[ERROR]   Run 3: TheInternetExampleTests>BaseUITest.configureBrowserBeforeTest:51  IllegalState
[ERROR]   Run 4: TheInternetExampleTests>BaseUITest.configureBrowserBeforeTest:51  IllegalState
[ERROR]   Run 5: TheInternetExampleTests>BaseUITest.configureBrowserBeforeTest:51  IllegalState
[ERROR]   Run 6: TheInternetExampleTests>BaseUITest.configureBrowserBeforeTest:51  IllegalState
[ERROR]   Run 7: TheInternetExampleTests>BaseUITest.configureBrowserBeforeTest:51  IllegalState
[ERROR]   Run 8: TheInternetExampleTests>BaseUITest.configureBrowserBeforeTest:51  IllegalState
[ERROR]   Run 9: TheInternetExampleTests>BaseUITest.configureBrowserBeforeTest:51  IllegalState
[ERROR]   Run 10: TheInternetExampleTests>BaseUITest.configureBrowserBeforeTest:51  IllegalState
[ERROR]   Run 11: TheInternetExampleTests>BaseUITest.configureBrowserBeforeTest:51  IllegalState
[ERROR]   Run 12: TheInternetExampleTests>BaseUITest.configureBrowserBeforeTest:51  IllegalState
[ERROR]   Run 13: TheInternetExampleTests>BaseUITest.configureBrowserBeforeTest:51  IllegalState
[INFO] 
[INFO] 
[ERROR] Tests run: 14, Failures: 5, Errors: 0, Skipped: 1
[INFO] 
[INFO] ------------------------------------------------------------------------
[INFO] BUILD FAILURE
[INFO] ------------------------------------------------------------------------
[INFO] Total time:  24.091 s
[INFO] Finished at: 2023-01-16T15:16:34Z
[INFO] ------------------------------------------------------------------------
[ERROR] Failed to execute goal org.apache.maven.plugins:maven-surefire-plugin:3.0.0-M3:test (default-test) on project frameworkium-examples: There are test failures.
[ERROR] 
[ERROR] Please refer to /home/gabsko/breaking-updates/target/surefire-reports for the individual test results.
[ERROR] Please refer to dump files (if any exist) [date].dump, [date]-jvmRun[N].dump and [date].dumpstream.
[ERROR] -> [Help 1]
[ERROR] 
[ERROR] To see the full stack trace of the errors, re-run Maven with the -e switch.
[ERROR] Re-run Maven using the -X switch to enable full debug logging.
[ERROR] 
[ERROR] For more information about the errors and possible solutions, please read the following articles:
[ERROR] [Help 1] http://cwiki.apache.org/confluence/display/MAVEN/MojoFailureException
