[INFO] Scanning for projects...
[INFO] ------------------------------------------------------------------------
[INFO] Reactor Build Order:
[INFO] 
[INFO] trino-cloud                                                        [pom]
[INFO] trino-cloud-aws                                           [trino-plugin]
[INFO] 
[INFO] -----------------------< pl.net.was:trino-cloud >-----------------------
[INFO] Building trino-cloud 0.9-SNAPSHOT                                  [1/2]
[INFO] --------------------------------[ pom ]---------------------------------
[INFO] 
[INFO] --- maven-clean-plugin:3.0.0:clean (default-clean) @ trino-cloud ---
[INFO] Deleting /home/gabsko/breaking-updates/target
[INFO] 
[INFO] --- maven-enforcer-plugin:3.0.0-M3:enforce (default) @ trino-cloud ---
[INFO] 
[INFO] --- dependency-scope-maven-plugin:0.10:check (default) @ trino-cloud ---
[INFO] No test dependency scope issues found
[INFO] 
[INFO] --- license-maven-plugin:3.0:check (default) @ trino-cloud ---
[INFO] Checking licenses...
[INFO] 
[INFO] --- maven-checkstyle-plugin:3.1.2:check (checkstyle) @ trino-cloud ---
[INFO] You have 0 Checkstyle violations.
[INFO] 
[INFO] --- jacoco-maven-plugin:0.8.6:prepare-agent (default) @ trino-cloud ---
[INFO] Skipping JaCoCo execution because property jacoco.skip is set.
[INFO] argLine set to empty
[INFO] 
[INFO] --- git-commit-id-plugin:4.0.3:revision (default) @ trino-cloud ---
[INFO] 
[INFO] --- maven-dependency-plugin:3.1.2:analyze-only (default) @ trino-cloud ---
[INFO] Skipping pom project
[INFO] 
[INFO] --- maven-dependency-plugin:3.1.2:analyze-duplicate (default) @ trino-cloud ---
[INFO] No duplicate dependencies found in <dependencies/> or in <dependencyManagement/>
[INFO] 
[INFO] --- duplicate-finder-maven-plugin:1.5.0:check (default) @ trino-cloud ---
[INFO] Ignoring POM project!
[INFO] 
[INFO] --- modernizer-maven-plugin:2.2.0:modernizer (modernizer) @ trino-cloud ---
[INFO] Skipping modernizer execution!
[INFO] 
[INFO] ---------------------< pl.net.was:trino-cloud-aws >---------------------
[INFO] Building trino-cloud-aws 0.9-SNAPSHOT                              [2/2]
[INFO] ----------------------------[ trino-plugin ]----------------------------
[INFO] 
[INFO] --- maven-clean-plugin:3.0.0:clean (default-clean) @ trino-cloud-aws ---
[INFO] Deleting /home/gabsko/breaking-updates/trino-cloud-aws/target
[INFO] 
[INFO] --- trino-maven-plugin:11:check-spi-dependencies (default-check-spi-dependencies) @ trino-cloud-aws ---
[INFO] 
[INFO] --- maven-enforcer-plugin:3.0.0-M3:enforce (default) @ trino-cloud-aws ---
[INFO] 
[INFO] --- dependency-scope-maven-plugin:0.10:check (default) @ trino-cloud-aws ---
[INFO] No test dependency scope issues found
[INFO] 
[INFO] --- license-maven-plugin:3.0:check (default) @ trino-cloud-aws ---
[INFO] Checking licenses...
[INFO] 
[INFO] --- maven-checkstyle-plugin:3.1.2:check (checkstyle) @ trino-cloud-aws ---
[INFO] You have 0 Checkstyle violations.
[INFO] 
[INFO] --- jacoco-maven-plugin:0.8.6:prepare-agent (default) @ trino-cloud-aws ---
[INFO] Skipping JaCoCo execution because property jacoco.skip is set.
[INFO] argLine set to empty
[INFO] 
[INFO] --- git-commit-id-plugin:4.0.3:revision (default) @ trino-cloud-aws ---
[INFO] 
[INFO] --- maven-resources-plugin:3.2.0:resources (default-resources) @ trino-cloud-aws ---
[INFO] Using 'UTF-8' encoding to copy filtered resources.
[INFO] Using 'UTF-8' encoding to copy filtered properties files.
[INFO] skip non existing resourceDirectory /home/gabsko/breaking-updates/trino-cloud-aws/src/main/resources
[INFO] 
[INFO] --- maven-compiler-plugin:3.8.1:compile (default-compile) @ trino-cloud-aws ---
[INFO] Changes detected - recompiling the module!
[INFO] Compiling 24 source files to /home/gabsko/breaking-updates/trino-cloud-aws/target/classes
[INFO] /home/gabsko/breaking-updates/trino-cloud-aws/src/main/java/pl/net/was/cloud/aws/AwsRecordSetProvider.java: /home/gabsko/breaking-updates/trino-cloud-aws/src/main/java/pl/net/was/cloud/aws/AwsRecordSetProvider.java uses unchecked or unsafe operations.
[INFO] /home/gabsko/breaking-updates/trino-cloud-aws/src/main/java/pl/net/was/cloud/aws/AwsRecordSetProvider.java: Recompile with -Xlint:unchecked for details.
[INFO] 
[INFO] --- trino-maven-plugin:11:generate-service-descriptor (default-generate-service-descriptor) @ trino-cloud-aws ---
[INFO] Wrote pl.net.was.cloud.aws.AwsPlugin to /home/gabsko/breaking-updates/trino-cloud-aws/target/trino-cloud-aws-0.9-SNAPSHOT-services.jar
[INFO] 
[INFO] --- maven-resources-plugin:3.2.0:testResources (default-testResources) @ trino-cloud-aws ---
[INFO] Using 'UTF-8' encoding to copy filtered resources.
[INFO] Using 'UTF-8' encoding to copy filtered properties files.
[INFO] skip non existing resourceDirectory /home/gabsko/breaking-updates/trino-cloud-aws/src/test/resources
[INFO] 
[INFO] --- maven-compiler-plugin:3.8.1:testCompile (default-testCompile) @ trino-cloud-aws ---
[INFO] Changes detected - recompiling the module!
[INFO] Compiling 2 source files to /home/gabsko/breaking-updates/trino-cloud-aws/target/test-classes
[INFO] 
[INFO] --- maven-dependency-plugin:3.1.2:analyze-only (default) @ trino-cloud-aws ---
[INFO] No dependency problems found
[INFO] 
[INFO] --- maven-dependency-plugin:3.1.2:analyze-duplicate (default) @ trino-cloud-aws ---
[INFO] No duplicate dependencies found in <dependencies/> or in <dependencyManagement/>
[INFO] 
[INFO] --- duplicate-finder-maven-plugin:1.5.0:check (default) @ trino-cloud-aws ---
[INFO] Checking compile classpath
[INFO] Checking runtime classpath
[INFO] Checking test classpath
[INFO] 
[INFO] --- modernizer-maven-plugin:2.2.0:modernizer (modernizer) @ trino-cloud-aws ---
[INFO] Skipping modernizer execution!
[INFO] 
[INFO] --- maven-surefire-plugin:3.0.0-M5:test (default-test) @ trino-cloud-aws ---
[INFO] 
[INFO] -------------------------------------------------------
[INFO]  T E S T S
[INFO] -------------------------------------------------------
[INFO] 
[INFO] Results:
[INFO] 
[INFO] Tests run: 0, Failures: 0, Errors: 0, Skipped: 0
[INFO] 
[INFO] 
[INFO] -------------------------------------------------------
[INFO]  T E S T S
[INFO] -------------------------------------------------------
[INFO] Running pl.net.was.cloud.aws.TestAwsQueries
2023-01-30T15:57:43.512+0000 INFO LogTestDurationListener enabled: false
2023-01-30T15:57:45.138+0000 INFO jetty-9.4.42.v20210604; built: 2021-06-04T17:33:38.939Z; git: 5cd5e6d2375eeab146813b0de9f19eda6ab6e6cb; jvm 11.0.17+8-post-Ubuntu-1ubuntu218.04
2023-01-30T15:57:45.403+0000 WARNING A provider io.airlift.discovery.store.StoreResource registered in SERVER runtime does not implement any provider interfaces applicable in the SERVER runtime. Due to constraint configuration problems the provider io.airlift.discovery.store.StoreResource will be ignored. 
2023-01-30T15:57:45.403+0000 WARNING A provider io.airlift.discovery.server.ServiceResource registered in SERVER runtime does not implement any provider interfaces applicable in the SERVER runtime. Due to constraint configuration problems the provider io.airlift.discovery.server.ServiceResource will be ignored. 
2023-01-30T15:57:45.403+0000 WARNING A provider io.airlift.discovery.server.DynamicAnnouncementResource registered in SERVER runtime does not implement any provider interfaces applicable in the SERVER runtime. Due to constraint configuration problems the provider io.airlift.discovery.server.DynamicAnnouncementResource will be ignored. 
2023-01-30T15:57:45.552+0000 INFO Started o.e.j.s.ServletContextHandler@269222ae{/,null,AVAILABLE,@http}
2023-01-30T15:57:45.570+0000 INFO Started http@5478ce1e{HTTP/1.1, (http/1.1, h2c)}{127.0.0.1:40697}
2023-01-30T15:57:45.571+0000 INFO Started @2699ms
2023-01-30T15:57:45.676+0000 INFO Life cycle starting...
2023-01-30T15:57:45.676+0000 INFO Life cycle startup complete
2023-01-30T15:57:45.677+0000 INFO Created TestingDiscoveryServer in 1.76s
2023-01-30T15:57:47.845+0000 INFO jetty-9.4.42.v20210604; built: 2021-06-04T17:33:38.939Z; git: 5cd5e6d2375eeab146813b0de9f19eda6ab6e6cb; jvm 11.0.17+8-post-Ubuntu-1ubuntu218.04
2023-01-30T15:57:47.889+0000 WARNING A provider io.trino.server.TaskExecutorResource registered in SERVER runtime does not implement any provider interfaces applicable in the SERVER runtime. Due to constraint configuration problems the provider io.trino.server.TaskExecutorResource will be ignored. 
2023-01-30T15:57:47.889+0000 WARNING A provider io.trino.server.ResourceGroupStateInfoResource registered in SERVER runtime does not implement any provider interfaces applicable in the SERVER runtime. Due to constraint configuration problems the provider io.trino.server.ResourceGroupStateInfoResource will be ignored. 
2023-01-30T15:57:47.889+0000 WARNING A provider io.trino.server.TaskResource registered in SERVER runtime does not implement any provider interfaces applicable in the SERVER runtime. Due to constraint configuration problems the provider io.trino.server.TaskResource will be ignored. 
2023-01-30T15:57:47.890+0000 WARNING A provider io.trino.server.ui.WorkerResource registered in SERVER runtime does not implement any provider interfaces applicable in the SERVER runtime. Due to constraint configuration problems the provider io.trino.server.ui.WorkerResource will be ignored. 
2023-01-30T15:57:47.890+0000 WARNING A provider io.trino.dispatcher.QueuedStatementResource registered in SERVER runtime does not implement any provider interfaces applicable in the SERVER runtime. Due to constraint configuration problems the provider io.trino.dispatcher.QueuedStatementResource will be ignored. 
2023-01-30T15:57:47.890+0000 WARNING A provider io.trino.memory.MemoryResource registered in SERVER runtime does not implement any provider interfaces applicable in the SERVER runtime. Due to constraint configuration problems the provider io.trino.memory.MemoryResource will be ignored. 
2023-01-30T15:57:47.890+0000 WARNING A provider io.trino.server.QueryStateInfoResource registered in SERVER runtime does not implement any provider interfaces applicable in the SERVER runtime. Due to constraint configuration problems the provider io.trino.server.QueryStateInfoResource will be ignored. 
2023-01-30T15:57:47.891+0000 WARNING A provider io.trino.server.ui.ClusterResource registered in SERVER runtime does not implement any provider interfaces applicable in the SERVER runtime. Due to constraint configuration problems the provider io.trino.server.ui.ClusterResource will be ignored. 
2023-01-30T15:57:47.891+0000 WARNING A provider io.trino.server.ServerInfoResource registered in SERVER runtime does not implement any provider interfaces applicable in the SERVER runtime. Due to constraint configuration problems the provider io.trino.server.ServerInfoResource will be ignored. 
2023-01-30T15:57:47.891+0000 WARNING A provider io.trino.server.ui.UiQueryResource registered in SERVER runtime does not implement any provider interfaces applicable in the SERVER runtime. Due to constraint configuration problems the provider io.trino.server.ui.UiQueryResource will be ignored. 
2023-01-30T15:57:47.891+0000 WARNING A provider io.trino.server.ThreadResource registered in SERVER runtime does not implement any provider interfaces applicable in the SERVER runtime. Due to constraint configuration problems the provider io.trino.server.ThreadResource will be ignored. 
2023-01-30T15:57:47.892+0000 WARNING A provider io.trino.server.ui.ClusterStatsResource registered in SERVER runtime does not implement any provider interfaces applicable in the SERVER runtime. Due to constraint configuration problems the provider io.trino.server.ui.ClusterStatsResource will be ignored. 
2023-01-30T15:57:47.892+0000 WARNING A provider io.trino.server.protocol.ExecutingStatementResource registered in SERVER runtime does not implement any provider interfaces applicable in the SERVER runtime. Due to constraint configuration problems the provider io.trino.server.protocol.ExecutingStatementResource will be ignored. 
2023-01-30T15:57:47.892+0000 WARNING A provider io.trino.server.QueryResource registered in SERVER runtime does not implement any provider interfaces applicable in the SERVER runtime. Due to constraint configuration problems the provider io.trino.server.QueryResource will be ignored. 
2023-01-30T15:57:47.892+0000 WARNING A provider io.trino.server.StatusResource registered in SERVER runtime does not implement any provider interfaces applicable in the SERVER runtime. Due to constraint configuration problems the provider io.trino.server.StatusResource will be ignored. 
2023-01-30T15:57:47.892+0000 WARNING A provider io.trino.server.ui.WebUiStaticResource registered in SERVER runtime does not implement any provider interfaces applicable in the SERVER runtime. Due to constraint configuration problems the provider io.trino.server.ui.WebUiStaticResource will be ignored. 
2023-01-30T15:57:47.893+0000 WARNING A provider io.trino.server.NodeResource registered in SERVER runtime does not implement any provider interfaces applicable in the SERVER runtime. Due to constraint configuration problems the provider io.trino.server.NodeResource will be ignored. 
2023-01-30T15:57:47.983+0000 WARNING The following warnings have been detected: WARNING: The (sub)resource method getRoot in io.trino.server.ui.WebUiStaticResource contains empty path annotation.
WARNING: Parameter 2 of type io.trino.execution.resourcegroups.ResourceGroupManager<?> from public io.trino.server.QueryStateInfoResource(io.trino.dispatcher.DispatchManager,io.trino.execution.resourcegroups.ResourceGroupManager<?>,io.trino.security.AccessControl,io.trino.spi.security.GroupProvider,io.trino.server.ProtocolConfig) is not resolvable to a concrete type.
WARNING: Parameter 2 of type io.trino.execution.resourcegroups.ResourceGroupManager<?> from public io.trino.server.QueryStateInfoResource(io.trino.dispatcher.DispatchManager,io.trino.execution.resourcegroups.ResourceGroupManager<?>,io.trino.security.AccessControl,io.trino.spi.security.GroupProvider,io.trino.server.ProtocolConfig) is not resolvable to a concrete type.
WARNING: Parameter 1 of type io.trino.execution.resourcegroups.ResourceGroupManager<?> from public io.trino.server.ResourceGroupStateInfoResource(io.trino.execution.resourcegroups.ResourceGroupManager<?>) is not resolvable to a concrete type.

2023-01-30T15:57:47.984+0000 INFO Started o.e.j.s.ServletContextHandler@13f10967{/,null,AVAILABLE,@http}
2023-01-30T15:57:47.992+0000 INFO Started http@256c6f7a{HTTP/1.1, (http/1.1, h2c)}{127.0.0.1:8082}
2023-01-30T15:57:47.992+0000 INFO Started @5120ms
2023-01-30T15:57:48.229+0000 INFO Life cycle starting...
2023-01-30T15:57:48.230+0000 INFO Life cycle startup complete
2023-01-30T15:57:48.299+0000 INFO Created coordinator TestingTrinoServer in 2.62s: http://127.0.0.1:8082
2023-01-30T15:57:48.346+0000 INFO Announced servers in 5.59ms
2023-01-30T15:57:48.377+0000 INFO Added functions in 31.37ms
2023-01-30T15:57:48.378+0000 INFO Registering connector aws
2023-01-30T15:57:48.380+0000 INFO Installed plugin AwsPlugin in 1.77ms
2023-01-30T15:57:48.404+0000 INFO PROPERTY  DEFAULT  RUNTIME  DESCRIPTION
2023-01-30T15:57:48.404+0000 INFO region    ----
[ERROR] Tests run: 4, Failures: 1, Errors: 0, Skipped: 3, Time elapsed: 5.571 s <<< FAILURE! - in pl.net.was.cloud.aws.TestAwsQueries
[ERROR] pl.net.was.cloud.aws.TestAwsQueries.init  Time elapsed: 5.307 s  <<< FAILURE!
com.google.inject.CreationException: 
Unable to create injector, see the following errors:

1) [Guice/ErrorInCustomProvider]: IllegalArgumentException: region must not be blank or empty.
  while locating AwsModule$Ec2ClientProvider
  at AwsRecordSetProvider.<init>(AwsRecordSetProvider.java:82)
      \_ for 2nd parameter ec2
  at AwsModule.configure(AwsModule.java:53)
  at AwsPageSourceProvider.<init>(AwsPageSourceProvider.java:69)
      \_ for 1st parameter recordSetProvider
  at AwsModule.configure(AwsModule.java:54)
  at AwsConnector.<init>(AwsConnector.java:47)
      \_ for 4th parameter pageSourceProvider
  at AwsModule.configure(AwsModule.java:50)
  while locating AwsConnector

Learn more:
  https://github.com/google/guice/wiki/ERROR_IN_CUSTOM_PROVIDER
Caused by: IllegalArgumentException: region must not be blank or empty.
	at Validate.paramNotBlank(Validate.java:180)
	at Region.of(Region.java:136)
	at Region.of(Region.java:132)
	at AwsModule$Ec2ClientProvider.get(AwsModule.java:78)
	at AwsModule$Ec2ClientProvider.get(AwsModule.java:62)
	at ProviderInternalFactory.provision(ProviderInternalFactory.java:86)
	at BoundProviderFactory.provision(BoundProviderFactory.java:72)
	at ProviderInternalFactory$1.call(ProviderInternalFactory.java:67)
	at ProvisionListenerStackCallback$Provision.provision(ProvisionListenerStackCallback.java:109)
	at LifeCycleModule.provision(LifeCycleModule.java:54)
	at ProvisionListenerStackCallback$Provision.provision(ProvisionListenerStackCallback.java:117)
	at ProvisionListenerStackCallback.provision(ProvisionListenerStackCallback.java:66)
	at ProviderInternalFactory.circularGet(ProviderInternalFactory.java:62)
	at BoundProviderFactory.get(BoundProviderFactory.java:59)
	at SingleParameterInjector.inject(SingleParameterInjector.java:40)
	at SingleParameterInjector.getAll(SingleParameterInjector.java:60)
	at ConstructorInjector.provision(ConstructorInjector.java:113)
	at ConstructorInjector.access$000(ConstructorInjector.java:33)
	at ConstructorInjector$1.call(ConstructorInjector.java:98)
	at ProvisionListenerStackCallback$Provision.provision(ProvisionListenerStackCallback.java:109)
	at LifeCycleModule.provision(LifeCycleModule.java:54)
	at ProvisionListenerStackCallback$Provision.provision(ProvisionListenerStackCallback.java:117)
	at ProvisionListenerStackCallback.provision(ProvisionListenerStackCallback.java:66)
	at ConstructorInjector.construct(ConstructorInjector.java:93)
	at ConstructorBindingImpl$Factory.get(ConstructorBindingImpl.java:296)
	at ProviderToInternalFactoryAdapter.get(ProviderToInternalFactoryAdapter.java:40)
	at SingletonScope$1.get(SingletonScope.java:169)
	at InternalFactoryToProviderAdapter.get(InternalFactoryToProviderAdapter.java:45)
	at SingleParameterInjector.inject(SingleParameterInjector.java:40)
	at SingleParameterInjector.getAll(SingleParameterInjector.java:60)
	at ConstructorInjector.provision(ConstructorInjector.java:113)
	at ConstructorInjector.access$000(ConstructorInjector.java:33)
	at ConstructorInjector$1.call(ConstructorInjector.java:98)
	at ProvisionListenerStackCallback$Provision.provision(ProvisionListenerStackCallback.java:109)
	at LifeCycleModule.provision(LifeCycleModule.java:54)
	at ProvisionListenerStackCallback$Provision.provision(ProvisionListenerStackCallback.java:117)
	at ProvisionListenerStackCallback.provision(ProvisionListenerStackCallback.java:66)
	at ConstructorInjector.construct(ConstructorInjector.java:93)
	at ConstructorBindingImpl$Factory.get(ConstructorBindingImpl.java:296)
	at ProviderToInternalFactoryAdapter.get(ProviderToInternalFactoryAdapter.java:40)
	at SingletonScope$1.get(SingletonScope.java:169)
	at InternalFactoryToProviderAdapter.get(InternalFactoryToProviderAdapter.java:45)
	at SingleParameterInjector.inject(SingleParameterInjector.java:40)
	at SingleParameterInjector.getAll(SingleParameterInjector.java:60)
	at ConstructorInjector.provision(ConstructorInjector.java:113)
	at ConstructorInjector.access$000(ConstructorInjector.java:33)
	at ConstructorInjector$1.call(ConstructorInjector.java:98)
	at ProvisionListenerStackCallback$Provision.provision(ProvisionListenerStackCallback.java:109)
	at LifeCycleModule.provision(LifeCycleModule.java:54)
	at ProvisionListenerStackCallback$Provision.provision(ProvisionListenerStackCallback.java:117)
	at ProvisionListenerStackCallback.provision(ProvisionListenerStackCallback.java:66)
	at ConstructorInjector.construct(ConstructorInjector.java:93)
	at ConstructorBindingImpl$Factory.get(ConstructorBindingImpl.java:296)
	at ProviderToInternalFactoryAdapter.get(ProviderToInternalFactoryAdapter.java:40)
	at SingletonScope$1.get(SingletonScope.java:169)
	at InternalFactoryToProviderAdapter.get(InternalFactoryToProviderAdapter.java:45)
	at InternalInjectorCreator.loadEagerSingletons(InternalInjectorCreator.java:213)
	at InternalInjectorCreator.injectDynamically(InternalInjectorCreator.java:186)
	at InternalInjectorCreator.build(InternalInjectorCreator.java:113)
	at Guice.createInjector(Guice.java:87)
	at Bootstrap.initialize(Bootstrap.java:275)
	at AwsConnectorFactory.create(AwsConnectorFactory.java:64)
	at ConnectorManager.createConnector(ConnectorManager.java:360)
	at ConnectorManager.createCatalog(ConnectorManager.java:215)
	at ConnectorManager.createCatalog(ConnectorManager.java:207)
	at ConnectorManager.createCatalog(ConnectorManager.java:193)
	at TestingTrinoServer.createCatalog(TestingTrinoServer.java:387)
	at DistributedQueryRunner.createCatalog(DistributedQueryRunner.java:403)
	at AwsQueryRunner.createQueryRunner(AwsQueryRunner.java:50)
	at TestAwsQueries.createQueryRunner(TestAwsQueries.java:28)
	at AbstractTestQueryFramework.init(AbstractTestQueryFramework.java:91)
	at java.base/NativeMethodAccessorImpl.invoke0(Native Method)
	at java.base/NativeMethodAccessorImpl.invoke(NativeMethodAccessorImpl.java:62)
	at java.base/DelegatingMethodAccessorImpl.invoke(DelegatingMethodAccessorImpl.java:43)
	at java.base/Method.invoke(Method.java:566)
	at MethodInvocationHelper.invokeMethod(MethodInvocationHelper.java:104)
	at Invoker.invokeConfigurationMethod(Invoker.java:515)
	at Invoker.invokeConfigurations(Invoker.java:217)
	at Invoker.invokeConfigurations(Invoker.java:144)
	at TestMethodWorker.invokeBeforeClassMethods(TestMethodWorker.java:169)
	at TestMethodWorker.run(TestMethodWorker.java:108)
	at TestRunner.privateRun(TestRunner.java:756)
	at TestRunner.run(TestRunner.java:610)
	at SuiteRunner.runTest(SuiteRunner.java:387)
	at SuiteRunner.runSequentially(SuiteRunner.java:382)
	at SuiteRunner.privateRun(SuiteRunner.java:340)
	at SuiteRunner.run(SuiteRunner.java:289)
	at SuiteRunnerWorker.runSuite(SuiteRunnerWorker.java:52)
	at SuiteRunnerWorker.run(SuiteRunnerWorker.java:86)
	at TestNG.runSuitesSequentially(TestNG.java:1293)
	at TestNG.runSuitesLocally(TestNG.java:1218)
	at TestNG.runSuites(TestNG.java:1133)
	at TestNG.run(TestNG.java:1104)
	at TestNGExecutor.run(TestNGExecutor.java:136)
	at TestNGDirectoryTestSuite.executeSingleClass(TestNGDirectoryTestSuite.java:112)
	at TestNGDirectoryTestSuite.execute(TestNGDirectoryTestSuite.java:99)
	at TestNGProvider.invoke(TestNGProvider.java:145)
	at ForkedBooter.runSuitesInProcess(ForkedBooter.java:428)
	at ForkedBooter.execute(ForkedBooter.java:162)
	at ForkedBooter.run(ForkedBooter.java:562)
	at ForkedBooter.main(ForkedBooter.java:548)

2) [Guice/ErrorInCustomProvider]: IllegalArgumentException: region must not be blank or empty.
  while locating AwsModule$Ec2ClientProvider
  at AwsRecordSetProvider.<init>(AwsRecordSetProvider.java:82)
      \_ for 2nd parameter ec2
  at AwsModule.configure(AwsModule.java:53)
  while locating AwsRecordSetProvider

Learn more:
  https://github.com/google/guice/wiki/ERROR_IN_CUSTOM_PROVIDER
Caused by: IllegalArgumentException: region must not be blank or empty.
	at Validate.paramNotBlank(Validate.java:180)
	at Region.of(Region.java:136)
	at Region.of(Region.java:132)
	at AwsModule$Ec2ClientProvider.get(AwsModule.java:78)
	at AwsModule$Ec2ClientProvider.get(AwsModule.java:62)
	at ProviderInternalFactory.provision(ProviderInternalFactory.java:86)
	at BoundProviderFactory.provision(BoundProviderFactory.java:72)
	at ProviderInternalFactory$1.call(ProviderInternalFactory.java:67)
	at ProvisionListenerStackCallback$Provision.provision(ProvisionListenerStackCallback.java:109)
	at LifeCycleModule.provision(LifeCycleModule.java:54)
	at ProvisionListenerStackCallback$Provision.provision(ProvisionListenerStackCallback.java:117)
	at ProvisionListenerStackCallback.provision(ProvisionListenerStackCallback.java:66)
	at ProviderInternalFactory.circularGet(ProviderInternalFactory.java:62)
	at BoundProviderFactory.get(BoundProviderFactory.java:59)
	at SingleParameterInjector.inject(SingleParameterInjector.java:40)
	at SingleParameterInjector.getAll(SingleParameterInjector.java:60)
	at ConstructorInjector.provision(ConstructorInjector.java:113)
	at ConstructorInjector.access$000(ConstructorInjector.java:33)
	at ConstructorInjector$1.call(ConstructorInjector.java:98)
	at ProvisionListenerStackCallback$Provision.provision(ProvisionListenerStackCallback.java:109)
	at LifeCycleModule.provision(LifeCycleModule.java:54)
	at ProvisionListenerStackCallback$Provision.provision(ProvisionListenerStackCallback.java:117)
	at ProvisionListenerStackCallback.provision(ProvisionListenerStackCallback.java:66)
	at ConstructorInjector.construct(ConstructorInjector.java:93)
	at ConstructorBindingImpl$Factory.get(ConstructorBindingImpl.java:296)
	at ProviderToInternalFactoryAdapter.get(ProviderToInternalFactoryAdapter.java:40)
	at SingletonScope$1.get(SingletonScope.java:169)
	at InternalFactoryToProviderAdapter.get(InternalFactoryToProviderAdapter.java:45)
	at InternalInjectorCreator.loadEagerSingletons(InternalInjectorCreator.java:213)
	at InternalInjectorCreator.injectDynamically(InternalInjectorCreator.java:186)
	at InternalInjectorCreator.build(InternalInjectorCreator.java:113)
	at Guice.createInjector(Guice.java:87)
	at Bootstrap.initialize(Bootstrap.java:275)
	at AwsConnectorFactory.create(AwsConnectorFactory.java:64)
	at ConnectorManager.createConnector(ConnectorManager.java:360)
	at ConnectorManager.createCatalog(ConnectorManager.java:215)
	at ConnectorManager.createCatalog(ConnectorManager.java:207)
	at ConnectorManager.createCatalog(ConnectorManager.java:193)
	at TestingTrinoServer.createCatalog(TestingTrinoServer.java:387)
	at DistributedQueryRunner.createCatalog(DistributedQueryRunner.java:403)
	at AwsQueryRunner.createQueryRunner(AwsQueryRunner.java:50)
	at TestAwsQueries.createQueryRunner(TestAwsQueries.java:28)
	at AbstractTestQueryFramework.init(AbstractTestQueryFramework.java:91)
	at java.base/NativeMethodAccessorImpl.invoke0(Native Method)
	at java.base/NativeMethodAccessorImpl.invoke(NativeMethodAccessorImpl.java:62)
	at java.base/DelegatingMethodAccessorImpl.invoke(DelegatingMethodAccessorImpl.java:43)
	at java.base/Method.invoke(Method.java:566)
	at MethodInvocationHelper.invokeMethod(MethodInvocationHelper.java:104)
	at Invoker.invokeConfigurationMethod(Invoker.java:515)
	at Invoker.invokeConfigurations(Invoker.java:217)
	at Invoker.invokeConfigurations(Invoker.java:144)
	at TestMethodWorker.invokeBeforeClassMethods(TestMethodWorker.java:169)
	at TestMethodWorker.run(TestMethodWorker.java:108)
	at TestRunner.privateRun(TestRunner.java:756)
	at TestRunner.run(TestRunner.java:610)
	at SuiteRunner.runTest(SuiteRunner.java:387)
	at SuiteRunner.runSequentially(SuiteRunner.java:382)
	at SuiteRunner.privateRun(SuiteRunner.java:340)
	at SuiteRunner.run(SuiteRunner.java:289)
	at SuiteRunnerWorker.runSuite(SuiteRunnerWorker.java:52)
	at SuiteRunnerWorker.run(SuiteRunnerWorker.java:86)
	at TestNG.runSuitesSequentially(TestNG.java:1293)
	at TestNG.runSuitesLocally(TestNG.java:1218)
	at TestNG.runSuites(TestNG.java:1133)
	at TestNG.run(TestNG.java:1104)
	at TestNGExecutor.run(TestNGExecutor.java:136)
	at TestNGDirectoryTestSuite.executeSingleClass(TestNGDirectoryTestSuite.java:112)
	at TestNGDirectoryTestSuite.execute(TestNGDirectoryTestSuite.java:99)
	at TestNGProvider.invoke(TestNGProvider.java:145)
	at ForkedBooter.runSuitesInProcess(ForkedBooter.java:428)
	at ForkedBooter.execute(ForkedBooter.java:162)
	at ForkedBooter.run(ForkedBooter.java:562)
	at ForkedBooter.main(ForkedBooter.java:548)

3) [Guice/ErrorInCustomProvider]: IllegalArgumentException: region must not be blank or empty.
  while locating AwsModule$Ec2ClientProvider
  at AwsRecordSetProvider.<init>(AwsRecordSetProvider.java:82)
      \_ for 2nd parameter ec2
  at AwsModule.configure(AwsModule.java:53)
  at AwsPageSourceProvider.<init>(AwsPageSourceProvider.java:69)
      \_ for 1st parameter recordSetProvider
  at AwsModule.configure(AwsModule.java:54)
  while locating AwsPageSourceProvider

Learn more:
  https://github.com/google/guice/wiki/ERROR_IN_CUSTOM_PROVIDER
Caused by: IllegalArgumentException: region must not be blank or empty.
	at Validate.paramNotBlank(Validate.java:180)
	at Region.of(Region.java:136)
	at Region.of(Region.java:132)
	at AwsModule$Ec2ClientProvider.get(AwsModule.java:78)
	at AwsModule$Ec2ClientProvider.get(AwsModule.java:62)
	at ProviderInternalFactory.provision(ProviderInternalFactory.java:86)
	at BoundProviderFactory.provision(BoundProviderFactory.java:72)
	at ProviderInternalFactory$1.call(ProviderInternalFactory.java:67)
	at ProvisionListenerStackCallback$Provision.provision(ProvisionListenerStackCallback.java:109)
	at LifeCycleModule.provision(LifeCycleModule.java:54)
	at ProvisionListenerStackCallback$Provision.provision(ProvisionListenerStackCallback.java:117)
	at ProvisionListenerStackCallback.provision(ProvisionListenerStackCallback.java:66)
	at ProviderInternalFactory.circularGet(ProviderInternalFactory.java:62)
	at BoundProviderFactory.get(BoundProviderFactory.java:59)
	at SingleParameterInjector.inject(SingleParameterInjector.java:40)
	at SingleParameterInjector.getAll(SingleParameterInjector.java:60)
	at ConstructorInjector.provision(ConstructorInjector.java:113)
	at ConstructorInjector.access$000(ConstructorInjector.java:33)
	at ConstructorInjector$1.call(ConstructorInjector.java:98)
	at ProvisionListenerStackCallback$Provision.provision(ProvisionListenerStackCallback.java:109)
	at LifeCycleModule.provision(LifeCycleModule.java:54)
	at ProvisionListenerStackCallback$Provision.provision(ProvisionListenerStackCallback.java:117)
	at ProvisionListenerStackCallback.provision(ProvisionListenerStackCallback.java:66)
	at ConstructorInjector.construct(ConstructorInjector.java:93)
	at ConstructorBindingImpl$Factory.get(ConstructorBindingImpl.java:296)
	at ProviderToInternalFactoryAdapter.get(ProviderToInternalFactoryAdapter.java:40)
	at SingletonScope$1.get(SingletonScope.java:169)
	at InternalFactoryToProviderAdapter.get(InternalFactoryToProviderAdapter.java:45)
	at SingleParameterInjector.inject(SingleParameterInjector.java:40)
	at SingleParameterInjector.getAll(SingleParameterInjector.java:60)
	at ConstructorInjector.provision(ConstructorInjector.java:113)
	at ConstructorInjector.access$000(ConstructorInjector.java:33)
	at ConstructorInjector$1.call(ConstructorInjector.java:98)
	at ProvisionListenerStackCallback$Provision.provision(ProvisionListenerStackCallback.java:109)
	at LifeCycleModule.provision(LifeCycleModule.java:54)
	at ProvisionListenerStackCallback$Provision.provision(ProvisionListenerStackCallback.java:117)
	at ProvisionListenerStackCallback.provision(ProvisionListenerStackCallback.java:66)
	at ConstructorInjector.construct(ConstructorInjector.java:93)
	at ConstructorBindingImpl$Factory.get(ConstructorBindingImpl.java:296)
	at ProviderToInternalFactoryAdapter.get(ProviderToInternalFactoryAdapter.java:40)
	at SingletonScope$1.get(SingletonScope.java:169)
	at InternalFactoryToProviderAdapter.get(InternalFactoryToProviderAdapter.java:45)
	at InternalInjectorCreator.loadEagerSingletons(InternalInjectorCreator.java:213)
	at InternalInjectorCreator.injectDynamically(InternalInjectorCreator.java:186)
	at InternalInjectorCreator.build(InternalInjectorCreator.java:113)
	at Guice.createInjector(Guice.java:87)
	at Bootstrap.initialize(Bootstrap.java:275)
	at AwsConnectorFactory.create(AwsConnectorFactory.java:64)
	at ConnectorManager.createConnector(ConnectorManager.java:360)
	at ConnectorManager.createCatalog(ConnectorManager.java:215)
	at ConnectorManager.createCatalog(ConnectorManager.java:207)
	at ConnectorManager.createCatalog(ConnectorManager.java:193)
	at TestingTrinoServer.createCatalog(TestingTrinoServer.java:387)
	at DistributedQueryRunner.createCatalog(DistributedQueryRunner.java:403)
	at AwsQueryRunner.createQueryRunner(AwsQueryRunner.java:50)
	at TestAwsQueries.createQueryRunner(TestAwsQueries.java:28)
	at AbstractTestQueryFramework.init(AbstractTestQueryFramework.java:91)
	at java.base/NativeMethodAccessorImpl.invoke0(Native Method)
	at java.base/NativeMethodAccessorImpl.invoke(NativeMethodAccessorImpl.java:62)
	at java.base/DelegatingMethodAccessorImpl.invoke(DelegatingMethodAccessorImpl.java:43)
	at java.base/Method.invoke(Method.java:566)
	at MethodInvocationHelper.invokeMethod(MethodInvocationHelper.java:104)
	at Invoker.invokeConfigurationMethod(Invoker.java:515)
	at Invoker.invokeConfigurations(Invoker.java:217)
	at Invoker.invokeConfigurations(Invoker.java:144)
	at TestMethodWorker.invokeBeforeClassMethods(TestMethodWorker.java:169)
	at TestMethodWorker.run(TestMethodWorker.java:108)
	at TestRunner.privateRun(TestRunner.java:756)
	at TestRunner.run(TestRunner.java:610)
	at SuiteRunner.runTest(SuiteRunner.java:387)
	at SuiteRunner.runSequentially(SuiteRunner.java:382)
	at SuiteRunner.privateRun(SuiteRunner.java:340)
	at SuiteRunner.run(SuiteRunner.java:289)
	at SuiteRunnerWorker.runSuite(SuiteRunnerWorker.java:52)
	at SuiteRunnerWorker.run(SuiteRunnerWorker.java:86)
	at TestNG.runSuitesSequentially(TestNG.java:1293)
	at TestNG.runSuitesLocally(TestNG.java:1218)
	at TestNG.runSuites(TestNG.java:1133)
	at TestNG.run(TestNG.java:1104)
	at TestNGExecutor.run(TestNGExecutor.java:136)
	at TestNGDirectoryTestSuite.executeSingleClass(TestNGDirectoryTestSuite.java:112)
	at TestNGDirectoryTestSuite.execute(TestNGDirectoryTestSuite.java:99)
	at TestNGProvider.invoke(TestNGProvider.java:145)
	at ForkedBooter.runSuitesInProcess(ForkedBooter.java:428)
	at ForkedBooter.execute(ForkedBooter.java:162)
	at ForkedBooter.run(ForkedBooter.java:562)
	at ForkedBooter.main(ForkedBooter.java:548)

4) [Guice/ErrorInCustomProvider]: IllegalArgumentException: region must not be blank or empty.
  while locating AwsModule$Ec2ClientProvider
  at AwsPageSinkProvider.<init>(AwsPageSinkProvider.java:37)
      \_ for 1st parameter ec2
  at AwsModule.configure(AwsModule.java:55)
  while locating AwsPageSinkProvider

Learn more:
  https://github.com/google/guice/wiki/ERROR_IN_CUSTOM_PROVIDER
Caused by: IllegalArgumentException (same stack trace as error #2)
4 errors

======================
Full classname legend:
======================
AbstractTestQueryFramework:               "io.trino.testing.AbstractTestQueryFramework"
AwsConnector:                             "pl.net.was.cloud.aws.AwsConnector"
AwsConnectorFactory:                      "pl.net.was.cloud.aws.AwsConnectorFactory"
AwsModule:                                "pl.net.was.cloud.aws.AwsModule"
AwsModule$Ec2ClientProvider:              "pl.net.was.cloud.aws.AwsModule$Ec2ClientProvider"
AwsPageSinkProvider:                      "pl.net.was.cloud.aws.AwsPageSinkProvider"
AwsPageSourceProvider:                    "pl.net.was.cloud.aws.AwsPageSourceProvider"
AwsQueryRunner:                           "pl.net.was.cloud.aws.AwsQueryRunner"
AwsRecordSetProvider:                     "pl.net.was.cloud.aws.AwsRecordSetProvider"
Bootstrap:                                "io.airlift.bootstrap.Bootstrap"
BoundProviderFactory:                     "com.google.inject.internal.BoundProviderFactory"
ConnectorManager:                         "io.trino.connector.ConnectorManager"
ConstructorBindingImpl$Factory:           "com.google.inject.internal.ConstructorBindingImpl$Factory"
ConstructorInjector:                      "com.google.inject.internal.ConstructorInjector"
ConstructorInjector$1:                    "com.google.inject.internal.ConstructorInjector$1"
DelegatingMethodAccessorImpl:             "jdk.internal.reflect.DelegatingMethodAccessorImpl"
DistributedQueryRunner:                   "io.trino.testing.DistributedQueryRunner"
ForkedBooter:                             "org.apache.maven.surefire.booter.ForkedBooter"
Guice:                                    "com.google.inject.Guice"
InternalFactoryToProviderAdapter:         "com.google.inject.internal.InternalFactoryToProviderAdapter"
InternalInjectorCreator:                  "com.google.inject.internal.InternalInjectorCreator"
Invoker:                                  "org.testng.internal.Invoker"
LifeCycleModule:                          "io.airlift.bootstrap.LifeCycleModule"
Method:                                   "java.lang.reflect.Method"
MethodInvocationHelper:                   "org.testng.internal.MethodInvocationHelper"
NativeMethodAccessorImpl:                 "jdk.internal.reflect.NativeMethodAccessorImpl"
ProviderInternalFactory:                  "com.google.inject.internal.ProviderInternalFactory"
ProviderInternalFactory$1:                "com.google.inject.internal.ProviderInternalFactory$1"
ProviderToInternalFactoryAdapter:         "com.google.inject.internal.ProviderToInternalFactoryAdapter"
ProvisionListenerStackCallback:           "com.google.inject.internal.ProvisionListenerStackCallback"
ProvisionListenerStackCallback$Provision: "com.google.inject.internal.ProvisionListenerStackCallback$Provision"
Region:                                   "software.amazon.awssdk.regions.Region"
SingleParameterInjector:                  "com.google.inject.internal.SingleParameterInjector"
SingletonScope$1:                         "com.google.inject.internal.SingletonScope$1"
SuiteRunner:                              "org.testng.SuiteRunner"
SuiteRunnerWorker:                        "org.testng.SuiteRunnerWorker"
TestAwsQueries:                           "pl.net.was.cloud.aws.TestAwsQueries"
TestMethodWorker:                         "org.testng.internal.TestMethodWorker"
TestNG:                                   "org.testng.TestNG"
TestNGDirectoryTestSuite:                 "org.apache.maven.surefire.testng.TestNGDirectoryTestSuite"
TestNGExecutor:                           "org.apache.maven.surefire.testng.TestNGExecutor"
TestNGProvider:                           "org.apache.maven.surefire.testng.TestNGProvider"
TestRunner:                               "org.testng.TestRunner"
TestingTrinoServer:                       "io.trino.server.testing.TestingTrinoServer"
Validate:                                 "software.amazon.awssdk.utils.Validate"
========================
End of classname legend:
========================

	at com.google.inject.internal.Errors.throwCreationExceptionIfErrorsExist(Errors.java:568)
	at com.google.inject.internal.InternalInjectorCreator.injectDynamically(InternalInjectorCreator.java:190)
	at com.google.inject.internal.InternalInjectorCreator.build(InternalInjectorCreator.java:113)
	at com.google.inject.Guice.createInjector(Guice.java:87)
	at io.airlift.bootstrap.Bootstrap.initialize(Bootstrap.java:275)
	at pl.net.was.cloud.aws.AwsConnectorFactory.create(AwsConnectorFactory.java:64)
	at io.trino.connector.ConnectorManager.createConnector(ConnectorManager.java:360)
	at io.trino.connector.ConnectorManager.createCatalog(ConnectorManager.java:215)
	at io.trino.connector.ConnectorManager.createCatalog(ConnectorManager.java:207)
	at io.trino.connector.ConnectorManager.createCatalog(ConnectorManager.java:193)
	at io.trino.server.testing.TestingTrinoServer.createCatalog(TestingTrinoServer.java:387)
	at io.trino.testing.DistributedQueryRunner.createCatalog(DistributedQueryRunner.java:403)
	at pl.net.was.cloud.aws.AwsQueryRunner.createQueryRunner(AwsQueryRunner.java:50)
	at pl.net.was.cloud.aws.TestAwsQueries.createQueryRunner(TestAwsQueries.java:28)
	at io.trino.testing.AbstractTestQueryFramework.init(AbstractTestQueryFramework.java:91)
	at java.base/jdk.internal.reflect.NativeMethodAccessorImpl.invoke0(Native Method)
	at java.base/jdk.internal.reflect.NativeMethodAccessorImpl.invoke(NativeMethodAccessorImpl.java:62)
	at java.base/jdk.internal.reflect.DelegatingMethodAccessorImpl.invoke(DelegatingMethodAccessorImpl.java:43)
	at java.base/java.lang.reflect.Method.invoke(Method.java:566)
	at org.testng.internal.MethodInvocationHelper.invokeMethod(MethodInvocationHelper.java:104)
	at org.testng.internal.Invoker.invokeConfigurationMethod(Invoker.java:515)
	at org.testng.internal.Invoker.invokeConfigurations(Invoker.java:217)
	at org.testng.internal.Invoker.invokeConfigurations(Invoker.java:144)
	at org.testng.internal.TestMethodWorker.invokeBeforeClassMethods(TestMethodWorker.java:169)
	at org.testng.internal.TestMethodWorker.run(TestMethodWorker.java:108)
	at org.testng.TestRunner.privateRun(TestRunner.java:756)
	at org.testng.TestRunner.run(TestRunner.java:610)
	at org.testng.SuiteRunner.runTest(SuiteRunner.java:387)
	at org.testng.SuiteRunner.runSequentially(SuiteRunner.java:382)
	at org.testng.SuiteRunner.privateRun(SuiteRunner.java:340)
	at org.testng.SuiteRunner.run(SuiteRunner.java:289)
	at org.testng.SuiteRunnerWorker.runSuite(SuiteRunnerWorker.java:52)
	at org.testng.SuiteRunnerWorker.run(SuiteRunnerWorker.java:86)
	at org.testng.TestNG.runSuitesSequentially(TestNG.java:1293)
	at org.testng.TestNG.runSuitesLocally(TestNG.java:1218)
	at org.testng.TestNG.runSuites(TestNG.java:1133)
	at org.testng.TestNG.run(TestNG.java:1104)
	at org.apache.maven.surefire.testng.TestNGExecutor.run(TestNGExecutor.java:136)
	at org.apache.maven.surefire.testng.TestNGDirectoryTestSuite.executeSingleClass(TestNGDirectoryTestSuite.java:112)
	at org.apache.maven.surefire.testng.TestNGDirectoryTestSuite.execute(TestNGDirectoryTestSuite.java:99)
	at org.apache.maven.surefire.testng.TestNGProvider.invoke(TestNGProvider.java:145)
	at org.apache.maven.surefire.booter.ForkedBooter.runSuitesInProcess(ForkedBooter.java:428)
	at org.apache.maven.surefire.booter.ForkedBooter.execute(ForkedBooter.java:162)
	at org.apache.maven.surefire.booter.ForkedBooter.run(ForkedBooter.java:562)
	at org.apache.maven.surefire.booter.ForkedBooter.main(ForkedBooter.java:548)

[INFO] 
[INFO] Results:
[INFO] 
[ERROR] Failures: 
[ERROR]   TestAwsQueries>AbstractTestQueryFramework.init:91->createQueryRunner:28 » Creation
[INFO] 
[ERROR] Tests run: 4, Failures: 1, Errors: 0, Skipped: 3
[INFO] 
[INFO] ------------------------------------------------------------------------
[INFO] Reactor Summary for trino-cloud 0.9-SNAPSHOT:
[INFO] 
[INFO] trino-cloud ........................................ SUCCESS [  3.075 s]
[INFO] trino-cloud-aws .................................... FAILURE [ 16.318 s]
[INFO] ------------------------------------------------------------------------
[INFO] BUILD FAILURE
[INFO] ------------------------------------------------------------------------
[INFO] Total time:  19.710 s
[INFO] Finished at: 2023-01-30T15:57:49Z
[INFO] ------------------------------------------------------------------------
[ERROR] Failed to execute goal org.apache.maven.plugins:maven-surefire-plugin:3.0.0-M5:test (default-test) on project trino-cloud-aws: There are test failures.
[ERROR] 
[ERROR] Please refer to /home/gabsko/breaking-updates/trino-cloud-aws/target/surefire-reports for the individual test results.
[ERROR] Please refer to dump files (if any exist) [date].dump, [date]-jvmRun[N].dump and [date].dumpstream.
[ERROR] -> [Help 1]
[ERROR] 
[ERROR] To see the full stack trace of the errors, re-run Maven with the -e switch.
[ERROR] Re-run Maven using the -X switch to enable full debug logging.
[ERROR] 
[ERROR] For more information about the errors and possible solutions, please read the following articles:
[ERROR] [Help 1] http://cwiki.apache.org/confluence/display/MAVEN/MojoFailureException
[ERROR] 
[ERROR] After correcting the problems, you can resume the build with the command
[ERROR]   mvn <args> -rf :trino-cloud-aws
