[INFO] Scanning for projects...
[WARNING] The project com.github.frameworkium:frameworkium-core:jar:4.0.0-BETA2-SNAPSHOT uses prerequisites which is only intended for maven-plugin projects but not for non maven-plugin projects. For such purposes you should use the maven-enforcer-plugin. See https://maven.apache.org/enforcer/enforcer-rules/requireMavenVersion.html
[INFO] 
[INFO] -------------< com.github.frameworkium:frameworkium-core >--------------
[INFO] Building frameworkium-core 4.0.0-BETA2-SNAPSHOT
[INFO] --------------------------------[ jar ]---------------------------------
[INFO] Downloading from central: https://repo.maven.apache.org/maven2/org/eclipse/jetty/jetty-alpn-conscrypt-client/9.4.42.v20210604/jetty-alpn-conscrypt-client-9.4.42.v20210604.jar
[INFO] Downloading from central: https://repo.maven.apache.org/maven2/org/eclipse/jetty/jetty-proxy/9.4.42.v20210604/jetty-proxy-9.4.42.v20210604.jar
[INFO] Downloading from central: https://repo.maven.apache.org/maven2/org/eclipse/jetty/jetty-alpn-conscrypt-server/9.4.42.v20210604/jetty-alpn-conscrypt-server-9.4.42.v20210604.jar
[INFO] Downloading from central: https://repo.maven.apache.org/maven2/org/eclipse/jetty/jetty-alpn-server/9.4.42.v20210604/jetty-alpn-server-9.4.42.v20210604.jar
[INFO] Downloading from central: https://repo.maven.apache.org/maven2/com/github/tomakehurst/wiremock-jre8/2.29.1/wiremock-jre8-2.29.1.jar
[INFO] Downloaded from central: https://repo.maven.apache.org/maven2/org/eclipse/jetty/jetty-alpn-conscrypt-client/9.4.42.v20210604/jetty-alpn-conscrypt-client-9.4.42.v20210604.jar (17 kB at 63 kB/s)
[INFO] Downloaded from central: https://repo.maven.apache.org/maven2/org/eclipse/jetty/jetty-alpn-conscrypt-server/9.4.42.v20210604/jetty-alpn-conscrypt-server-9.4.42.v20210604.jar (17 kB at 64 kB/s)
[INFO] Downloaded from central: https://repo.maven.apache.org/maven2/org/eclipse/jetty/jetty-alpn-server/9.4.42.v20210604/jetty-alpn-server-9.4.42.v20210604.jar (18 kB at 64 kB/s)
[INFO] Downloaded from central: https://repo.maven.apache.org/maven2/org/eclipse/jetty/jetty-proxy/9.4.42.v20210604/jetty-proxy-9.4.42.v20210604.jar (97 kB at 335 kB/s)
[INFO] Downloaded from central: https://repo.maven.apache.org/maven2/com/github/tomakehurst/wiremock-jre8/2.29.1/wiremock-jre8-2.29.1.jar (6.1 MB at 8.2 MB/s)
[INFO] 
[INFO] --- maven-clean-plugin:2.5:clean (default-clean) @ frameworkium-core ---
[INFO] Deleting /home/gabsko/breaking-updates/target
[INFO] 
[INFO] --- maven-checkstyle-plugin:3.1.2:check (validate) @ frameworkium-core ---
[INFO] Starting audit...
[WARN] /home/gabsko/breaking-updates/src/main/java/com/frameworkium/core/api/dto/AbstractDTO.java:10:1: Missing a Javadoc comment. [MissingJavadocType]
[WARN] /home/gabsko/breaking-updates/src/main/java/com/frameworkium/core/api/dto/AbstractDTO.java:10:23: Abbreviation in name 'AbstractDTO' must contain no more than '1' consecutive capital letters. [AbbreviationAsWordInName]
[WARN] /home/gabsko/breaking-updates/src/main/java/com/frameworkium/core/api/tests/BaseAPITest.java:13:1: Missing a Javadoc comment. [MissingJavadocType]
[WARN] /home/gabsko/breaking-updates/src/main/java/com/frameworkium/core/api/tests/BaseAPITest.java:17:23: Abbreviation in name 'BaseAPITest' must contain no more than '1' consecutive capital letters. [AbbreviationAsWordInName]
[WARN] /home/gabsko/breaking-updates/src/main/java/com/frameworkium/core/api/services/BaseService.java:16:1: Missing a Javadoc comment. [MissingJavadocType]
[WARN] /home/gabsko/breaking-updates/src/main/java/com/frameworkium/core/common/retry/RetryFlakyTest.java:7:1: Missing a Javadoc comment. [MissingJavadocType]
[WARN] /home/gabsko/breaking-updates/src/main/java/com/frameworkium/core/common/properties/Property.java:9:1: Missing a Javadoc comment. [MissingJavadocType]
[WARN] /home/gabsko/breaking-updates/src/main/java/com/frameworkium/core/common/properties/Property.java:107: Summary javadoc is missing. [SummaryJavadoc]
[WARN] /home/gabsko/breaking-updates/src/main/java/com/frameworkium/core/common/properties/Property.java:114:3: Missing a Javadoc comment. [MissingJavadocMethod]
[WARN] /home/gabsko/breaking-updates/src/main/java/com/frameworkium/core/common/listeners/ResultLoggerListener.java:24:1: Missing a Javadoc comment. [MissingJavadocType]
[WARN] /home/gabsko/breaking-updates/src/main/java/com/frameworkium/core/common/listeners/ResultLoggerListener.java:260:18: Abbreviation in name 'getOSInfo' must contain no more than '1' consecutive capital letters. [AbbreviationAsWordInName]
[WARN] /home/gabsko/breaking-updates/src/main/java/com/frameworkium/core/common/listeners/MethodInterceptor.java:18:1: Missing a Javadoc comment. [MissingJavadocType]
[WARN] /home/gabsko/breaking-updates/src/main/java/com/frameworkium/core/common/listeners/MethodInterceptor.java:29:33: Abbreviation in name 'filterTestsToRunByJQL' must contain no more than '1' consecutive capital letters. [AbbreviationAsWordInName]
[WARN] /home/gabsko/breaking-updates/src/main/java/com/frameworkium/core/common/listeners/MethodInterceptor.java:39:18: Abbreviation in name 'testIDsFromJQL' must contain no more than '1' consecutive capital letters. [AbbreviationAsWordInName]
[WARN] /home/gabsko/breaking-updates/src/main/java/com/frameworkium/core/common/listeners/MethodInterceptor.java:63:18: Abbreviation in name 'getMethodFromIMethod' must contain no more than '1' consecutive capital letters. [AbbreviationAsWordInName]
[WARN] /home/gabsko/breaking-updates/src/main/java/com/frameworkium/core/common/listeners/MethodInterceptor.java:63:55: Parameter name 'iMethod' must match pattern '^[a-z]([a-z0-9][a-zA-Z0-9]*)?$'. [ParameterName]
[WARN] /home/gabsko/breaking-updates/src/main/java/com/frameworkium/core/common/listeners/TestListener.java:10:1: Missing a Javadoc comment. [MissingJavadocType]
[WARN] /home/gabsko/breaking-updates/src/main/java/com/frameworkium/core/common/listeners/CreateJiraCycleListener.java:34:1: Missing a Javadoc comment. [MissingJavadocType]
[WARN] /home/gabsko/breaking-updates/src/main/java/com/frameworkium/core/common/reporting/spira/SpiraConfig.java:3:1: Missing a Javadoc comment. [MissingJavadocType]
[WARN] /home/gabsko/breaking-updates/src/main/java/com/frameworkium/core/common/reporting/spira/SpiraConfig.java:12:3: Missing a Javadoc comment. [MissingJavadocType]
[WARN] /home/gabsko/breaking-updates/src/main/java/com/frameworkium/core/common/reporting/spira/SpiraExecution.java:19:1: Missing a Javadoc comment. [MissingJavadocType]
[WARN] /home/gabsko/breaking-updates/src/main/java/com/frameworkium/core/common/reporting/jira/endpoint/ZephyrEndpoint.java:6:1: Missing a Javadoc comment. [MissingJavadocType]
[WARN] /home/gabsko/breaking-updates/src/main/java/com/frameworkium/core/common/reporting/jira/endpoint/ZephyrEndpoint.java:23: Summary javadoc is missing. [SummaryJavadoc]
[WARN] /home/gabsko/breaking-updates/src/main/java/com/frameworkium/core/common/reporting/jira/endpoint/ZephyrEndpoint.java:33:12: Abbreviation in name 'urlWithRestAPIPath' must contain no more than '1' consecutive capital letters. [AbbreviationAsWordInName]
[WARN] /home/gabsko/breaking-updates/src/main/java/com/frameworkium/core/common/reporting/jira/endpoint/JiraEndpoint.java:6:1: Missing a Javadoc comment. [MissingJavadocType]
[WARN] /home/gabsko/breaking-updates/src/main/java/com/frameworkium/core/common/reporting/jira/endpoint/JiraEndpoint.java:22: Summary javadoc is missing. [SummaryJavadoc]
[WARN] /home/gabsko/breaking-updates/src/main/java/com/frameworkium/core/common/reporting/jira/endpoint/JiraEndpoint.java:32:12: Abbreviation in name 'urlWithRestAPIPath' must contain no more than '1' consecutive capital letters. [AbbreviationAsWordInName]
[WARN] /home/gabsko/breaking-updates/src/main/java/com/frameworkium/core/common/reporting/jira/service/AbstractJiraService.java:18:1: Missing a Javadoc comment. [MissingJavadocType]
[WARN] /home/gabsko/breaking-updates/src/main/java/com/frameworkium/core/common/reporting/jira/service/Version.java:9:1: Missing a Javadoc comment. [MissingJavadocType]
[WARN] /home/gabsko/breaking-updates/src/main/java/com/frameworkium/core/common/reporting/jira/service/Version.java:10:3: Missing a Javadoc comment. [MissingJavadocMethod]
[WARN] /home/gabsko/breaking-updates/src/main/java/com/frameworkium/core/common/reporting/jira/service/Version.java:22:3: Missing a Javadoc comment. [MissingJavadocMethod]
[WARN] /home/gabsko/breaking-updates/src/main/java/com/frameworkium/core/common/reporting/jira/service/IssueLink.java:8:1: Missing a Javadoc comment. [MissingJavadocType]
[WARN] /home/gabsko/breaking-updates/src/main/java/com/frameworkium/core/common/reporting/jira/service/Attachment.java:5:1: Missing a Javadoc comment. [MissingJavadocType]
[WARN] /home/gabsko/breaking-updates/src/main/java/com/frameworkium/core/common/reporting/jira/service/Search.java:7:1: Missing a Javadoc comment. [MissingJavadocType]
[WARN] /home/gabsko/breaking-updates/src/main/java/com/frameworkium/core/common/reporting/jira/service/Search.java:15:3: Missing a Javadoc comment. [MissingJavadocMethod]
[WARN] /home/gabsko/breaking-updates/src/main/java/com/frameworkium/core/common/reporting/jira/service/Project.java:11:1: Missing a Javadoc comment. [MissingJavadocType]
[WARN] /home/gabsko/breaking-updates/src/main/java/com/frameworkium/core/common/reporting/jira/service/Project.java:12:3: Missing a Javadoc comment. [MissingJavadocMethod]
[WARN] /home/gabsko/breaking-updates/src/main/java/com/frameworkium/core/common/reporting/jira/service/Project.java:25:3: Missing a Javadoc comment. [MissingJavadocMethod]
[WARN] /home/gabsko/breaking-updates/src/main/java/com/frameworkium/core/common/reporting/jira/service/Issue.java:15:1: Missing a Javadoc comment. [MissingJavadocType]
[WARN] /home/gabsko/breaking-updates/src/main/java/com/frameworkium/core/common/reporting/jira/service/Issue.java:38: First sentence of Javadoc is missing an ending period. [SummaryJavadoc]
[WARN] /home/gabsko/breaking-updates/src/main/java/com/frameworkium/core/common/reporting/jira/service/Issue.java:80: First sentence of Javadoc is missing an ending period. [SummaryJavadoc]
[WARN] /home/gabsko/breaking-updates/src/main/java/com/frameworkium/core/common/reporting/jira/util/ExecutionSearchUtil.java:12:1: Missing a Javadoc comment. [MissingJavadocType]
[WARN] /home/gabsko/breaking-updates/src/main/java/com/frameworkium/core/common/reporting/jira/util/ExecutionSearchUtil.java:28:24: Abbreviation in name 'getExecutionIdsByZAPICycleRegex' must contain no more than '1' consecutive capital letters. [AbbreviationAsWordInName]
[WARN] /home/gabsko/breaking-updates/src/main/java/com/frameworkium/core/common/reporting/jira/util/ExecutionSearchUtil.java:39:24: Abbreviation in name 'getExecutionStatusesByZAPICycleRegex' must contain no more than '1' consecutive capital letters. [AbbreviationAsWordInName]
[WARN] /home/gabsko/breaking-updates/src/main/java/com/frameworkium/core/common/reporting/jira/util/ExecutionUtil.java:23:1: Missing a Javadoc comment. [MissingJavadocType]
[WARN] /home/gabsko/breaking-updates/src/main/java/com/frameworkium/core/common/reporting/jira/util/ExecutionUtil.java:45: First sentence of Javadoc is missing an ending period. [SummaryJavadoc]
[WARN] /home/gabsko/breaking-updates/src/main/java/com/frameworkium/core/common/reporting/jira/util/ExecutionUtil.java:61: First sentence of Javadoc is missing an ending period. [SummaryJavadoc]
[WARN] /home/gabsko/breaking-updates/src/main/java/com/frameworkium/core/common/reporting/jira/util/ExecutionUtil.java:86:21: Abbreviation in name 'getZAPIStatus' must contain no more than '1' consecutive capital letters. [AbbreviationAsWordInName]
[WARN] /home/gabsko/breaking-updates/src/main/java/com/frameworkium/core/common/reporting/jira/zapi/ExecutionSearch.java:8:1: Missing a Javadoc comment. [MissingJavadocType]
[WARN] /home/gabsko/breaking-updates/src/main/java/com/frameworkium/core/common/reporting/jira/zapi/ExecutionSearch.java:13:3: Missing a Javadoc comment. [MissingJavadocMethod]
[WARN] /home/gabsko/breaking-updates/src/main/java/com/frameworkium/core/common/reporting/jira/zapi/Attachment.java:10:1: Missing a Javadoc comment. [MissingJavadocType]
[WARN] /home/gabsko/breaking-updates/src/main/java/com/frameworkium/core/common/reporting/jira/zapi/Attachment.java:11:3: Missing a Javadoc comment. [MissingJavadocMethod]
[WARN] /home/gabsko/breaking-updates/src/main/java/com/frameworkium/core/common/reporting/jira/zapi/Attachment.java:23:3: Missing a Javadoc comment. [MissingJavadocMethod]
[WARN] /home/gabsko/breaking-updates/src/main/java/com/frameworkium/core/common/reporting/jira/zapi/Attachment.java:33:3: Missing a Javadoc comment. [MissingJavadocMethod]
[WARN] /home/gabsko/breaking-updates/src/main/java/com/frameworkium/core/common/reporting/jira/zapi/Execution.java:10:1: Missing a Javadoc comment. [MissingJavadocType]
[WARN] /home/gabsko/breaking-updates/src/main/java/com/frameworkium/core/common/reporting/jira/zapi/Execution.java:11:3: Missing a Javadoc comment. [MissingJavadocMethod]
[WARN] /home/gabsko/breaking-updates/src/main/java/com/frameworkium/core/common/reporting/jira/zapi/Execution.java:23:3: Missing a Javadoc comment. [MissingJavadocMethod]
[WARN] /home/gabsko/breaking-updates/src/main/java/com/frameworkium/core/common/reporting/jira/zapi/Cycle.java:11:1: Missing a Javadoc comment. [MissingJavadocType]
[WARN] /home/gabsko/breaking-updates/src/main/java/com/frameworkium/core/common/reporting/jira/zapi/Cycle.java:12:3: Missing a Javadoc comment. [MissingJavadocMethod]
[WARN] /home/gabsko/breaking-updates/src/main/java/com/frameworkium/core/common/reporting/jira/zapi/Cycle.java:25:3: Missing a Javadoc comment. [MissingJavadocMethod]
[WARN] /home/gabsko/breaking-updates/src/main/java/com/frameworkium/core/common/reporting/jira/dto/executionsearch/ExecutionSearchDto.java:11:1: Missing a Javadoc comment. [MissingJavadocType]
[WARN] /home/gabsko/breaking-updates/src/main/java/com/frameworkium/core/common/reporting/jira/dto/executionsearch/ExecutionSearchListDto.java:8:1: Missing a Javadoc comment. [MissingJavadocType]
[WARN] /home/gabsko/breaking-updates/src/main/java/com/frameworkium/core/common/reporting/jira/dto/executionsearch/ExecutionSearchListDto.java:17:3: Missing a Javadoc comment. [MissingJavadocMethod]
[WARN] /home/gabsko/breaking-updates/src/main/java/com/frameworkium/core/common/reporting/jira/dto/executionsearch/ExecutionSearchListDto.java:30:3: Missing a Javadoc comment. [MissingJavadocType]
[WARN] /home/gabsko/breaking-updates/src/main/java/com/frameworkium/core/common/reporting/jira/dto/execution/ExecutionDto.java:8:1: Missing a Javadoc comment. [MissingJavadocType]
[WARN] /home/gabsko/breaking-updates/src/main/java/com/frameworkium/core/common/reporting/jira/dto/execution/ExecutionDto.java:35:3: Missing a Javadoc comment. [MissingJavadocType]
[WARN] /home/gabsko/breaking-updates/src/main/java/com/frameworkium/core/common/reporting/jira/dto/execution/AddTestToCycleOperationDto.java:10:1: Missing a Javadoc comment. [MissingJavadocType]
[WARN] /home/gabsko/breaking-updates/src/main/java/com/frameworkium/core/common/reporting/jira/dto/execution/AddTestToCycleOperationDto.java:35:3: Missing a Javadoc comment. [MissingJavadocType]
[WARN] /home/gabsko/breaking-updates/src/main/java/com/frameworkium/core/common/reporting/jira/dto/execution/UpdateExecutionOperationDto.java:8:1: Missing a Javadoc comment. [MissingJavadocType]
[WARN] /home/gabsko/breaking-updates/src/main/java/com/frameworkium/core/common/reporting/jira/dto/execution/UpdateExecutionOperationDto.java:29:3: Missing a Javadoc comment. [MissingJavadocType]
[WARN] /home/gabsko/breaking-updates/src/main/java/com/frameworkium/core/common/reporting/jira/dto/execution/ExecutionLightDto.java:7:1: Missing a Javadoc comment. [MissingJavadocType]
[WARN] /home/gabsko/breaking-updates/src/main/java/com/frameworkium/core/common/reporting/jira/dto/execution/ExecutionLightDto.java:21:3: Missing a Javadoc comment. [MissingJavadocMethod]
[WARN] /home/gabsko/breaking-updates/src/main/java/com/frameworkium/core/common/reporting/jira/dto/execution/ExecutionLightDto.java:39:3: Missing a Javadoc comment. [MissingJavadocType]
[WARN] /home/gabsko/breaking-updates/src/main/java/com/frameworkium/core/common/reporting/jira/dto/version/VersionDto.java:10:1: Missing a Javadoc comment. [MissingJavadocType]
[WARN] /home/gabsko/breaking-updates/src/main/java/com/frameworkium/core/common/reporting/jira/dto/version/VersionDto.java:43:3: Missing a Javadoc comment. [MissingJavadocType]
[WARN] /home/gabsko/breaking-updates/src/main/java/com/frameworkium/core/common/reporting/jira/dto/status/StatusDto.java:5:1: Missing a Javadoc comment. [MissingJavadocType]
[WARN] /home/gabsko/breaking-updates/src/main/java/com/frameworkium/core/common/reporting/jira/dto/cycle/CycleDto.java:8:1: Missing a Javadoc comment. [MissingJavadocType]
[WARN] /home/gabsko/breaking-updates/src/main/java/com/frameworkium/core/common/reporting/jira/dto/cycle/CycleDto.java:55:3: Missing a Javadoc comment. [MissingJavadocType]
[WARN] /home/gabsko/breaking-updates/src/main/java/com/frameworkium/core/common/reporting/jira/dto/cycle/CycleListDto.java:11:1: Missing a Javadoc comment. [MissingJavadocType]
[WARN] /home/gabsko/breaking-updates/src/main/java/com/frameworkium/core/common/reporting/jira/dto/cycle/CreateCycleSuccessDto.java:5:1: Missing a Javadoc comment. [MissingJavadocType]
[WARN] /home/gabsko/breaking-updates/src/main/java/com/frameworkium/core/common/reporting/jira/dto/cycle/CycleLightDto.java:9:1: Missing a Javadoc comment. [MissingJavadocType]
[WARN] /home/gabsko/breaking-updates/src/main/java/com/frameworkium/core/common/reporting/jira/dto/cycle/CycleLightDto.java:35:3: Missing a Javadoc comment. [MissingJavadocType]
[WARN] /home/gabsko/breaking-updates/src/main/java/com/frameworkium/core/common/reporting/jira/dto/cycle/CreateNewCycleDto.java:8:1: Missing a Javadoc comment. [MissingJavadocType]
[WARN] /home/gabsko/breaking-updates/src/main/java/com/frameworkium/core/common/reporting/jira/dto/cycle/CreateNewCycleDto.java:25:3: Missing a Javadoc comment. [MissingJavadocType]
[WARN] /home/gabsko/breaking-updates/src/main/java/com/frameworkium/core/common/reporting/jira/dto/project/ProjectDto.java:7:1: Missing a Javadoc comment. [MissingJavadocType]
[WARN] /home/gabsko/breaking-updates/src/main/java/com/frameworkium/core/common/reporting/jira/dto/attachment/AttachmentListDto.java:6:1: Missing a Javadoc comment. [MissingJavadocType]
[WARN] /home/gabsko/breaking-updates/src/main/java/com/frameworkium/core/common/reporting/jira/dto/attachment/AttachmentDto.java:5:1: Missing a Javadoc comment. [MissingJavadocType]
[WARN] /home/gabsko/breaking-updates/src/main/java/com/frameworkium/core/common/reporting/jira/JiraConfig.java:3:1: Missing a Javadoc comment. [MissingJavadocType]
[WARN] /home/gabsko/breaking-updates/src/main/java/com/frameworkium/core/common/reporting/allure/AllureLogger.java:13:1: Missing a Javadoc comment. [MissingJavadocType]
[WARN] /home/gabsko/breaking-updates/src/main/java/com/frameworkium/core/common/reporting/allure/AllureLogger.java:33:3: Missing a Javadoc comment. [MissingJavadocMethod]
[WARN] /home/gabsko/breaking-updates/src/main/java/com/frameworkium/core/common/reporting/allure/AllureProperties.java:28:3: Missing a Javadoc comment. [MissingJavadocMethod]
[WARN] /home/gabsko/breaking-updates/src/main/java/com/frameworkium/core/common/reporting/allure/AllureProperties.java:28:22: Abbreviation in name 'createUI' must contain no more than '1' consecutive capital letters. [AbbreviationAsWordInName]
[WARN] /home/gabsko/breaking-updates/src/main/java/com/frameworkium/core/common/reporting/allure/AllureProperties.java:36:3: Missing a Javadoc comment. [MissingJavadocMethod]
[WARN] /home/gabsko/breaking-updates/src/main/java/com/frameworkium/core/common/reporting/allure/AllureProperties.java:36:22: Abbreviation in name 'createAPI' must contain no more than '1' consecutive capital letters. [AbbreviationAsWordInName]
[WARN] /home/gabsko/breaking-updates/src/main/java/com/frameworkium/core/common/reporting/allure/AllureProperties.java:84:29: Abbreviation in name 'getUIProperties' must contain no more than '1' consecutive capital letters. [AbbreviationAsWordInName]
[WARN] /home/gabsko/breaking-updates/src/main/java/com/frameworkium/core/common/reporting/TestIdUtils.java:15:1: Missing a Javadoc comment. [MissingJavadocType]
[WARN] /home/gabsko/breaking-updates/src/main/java/com/frameworkium/core/common/reporting/TestIdUtils.java:32:73: Parameter name 'iMethod' must match pattern '^[a-z]([a-z0-9][a-zA-Z0-9]*)?$'. [ParameterName]
[WARN] /home/gabsko/breaking-updates/src/main/java/com/frameworkium/core/common/reporting/TestIdUtils.java:68:70: Parameter name 'iMethod' must match pattern '^[a-z]([a-z0-9][a-zA-Z0-9]*)?$'. [ParameterName]
[WARN] /home/gabsko/breaking-updates/src/main/java/com/frameworkium/core/ui/browsers/UserAgent.java:5:1: Missing a Javadoc comment. [MissingJavadocType]
[WARN] /home/gabsko/breaking-updates/src/main/java/com/frameworkium/core/ui/browsers/UserAgent.java:13:3: Missing a Javadoc comment. [MissingJavadocMethod]
[WARN] /home/gabsko/breaking-updates/src/main/java/com/frameworkium/core/ui/element/AbstractStreamTable.java:46: Summary javadoc is missing. [SummaryJavadoc]
[WARN] /home/gabsko/breaking-updates/src/main/java/com/frameworkium/core/ui/element/AbstractStreamTable.java:52: Summary javadoc is missing. [SummaryJavadoc]
[WARN] /home/gabsko/breaking-updates/src/main/java/com/frameworkium/core/ui/element/AbstractStreamTable.java:58: Summary javadoc is missing. [SummaryJavadoc]
[WARN] /home/gabsko/breaking-updates/src/main/java/com/frameworkium/core/ui/element/AbstractStreamTable.java:63: Summary javadoc is missing. [SummaryJavadoc]
[WARN] /home/gabsko/breaking-updates/src/main/java/com/frameworkium/core/ui/element/AbstractStreamTable.java:71: Summary javadoc is missing. [SummaryJavadoc]
[WARN] /home/gabsko/breaking-updates/src/main/java/com/frameworkium/core/ui/element/AbstractStreamTable.java:79: Summary javadoc is missing. [SummaryJavadoc]
[WARN] /home/gabsko/breaking-updates/src/main/java/com/frameworkium/core/ui/element/AbstractStreamTable.java:87: Summary javadoc is missing. [SummaryJavadoc]
[WARN] /home/gabsko/breaking-updates/src/main/java/com/frameworkium/core/ui/element/AbstractStreamTable.java:95: Summary javadoc is missing. [SummaryJavadoc]
[WARN] /home/gabsko/breaking-updates/src/main/java/com/frameworkium/core/ui/element/AbstractStreamTable.java:103: Summary javadoc is missing. [SummaryJavadoc]
[WARN] /home/gabsko/breaking-updates/src/main/java/com/frameworkium/core/ui/element/AbstractStreamTable.java:127: Summary javadoc is missing. [SummaryJavadoc]
[WARN] /home/gabsko/breaking-updates/src/main/java/com/frameworkium/core/ui/element/AbstractStreamTable.java:137: Summary javadoc is missing. [SummaryJavadoc]
[WARN] /home/gabsko/breaking-updates/src/main/java/com/frameworkium/core/ui/driver/DriverSetup.java:21:1: Missing a Javadoc comment. [MissingJavadocType]
[WARN] /home/gabsko/breaking-updates/src/main/java/com/frameworkium/core/ui/driver/DriverSetup.java:26: Summary javadoc is missing. [SummaryJavadoc]
[WARN] /home/gabsko/breaking-updates/src/main/java/com/frameworkium/core/ui/driver/DriverSetup.java:92:3: Missing a Javadoc comment. [MissingJavadocMethod]
[WARN] /home/gabsko/breaking-updates/src/main/java/com/frameworkium/core/ui/driver/lifecycle/MultiUseDriverLifecycle.java:12: Summary javadoc is missing. [SummaryJavadoc]
[WARN] /home/gabsko/breaking-updates/src/main/java/com/frameworkium/core/ui/driver/lifecycle/DriverLifecycle.java:43: Summary javadoc is missing. [SummaryJavadoc]
[WARN] /home/gabsko/breaking-updates/src/main/java/com/frameworkium/core/ui/driver/remotes/Sauce.java:13:1: Missing a Javadoc comment. [MissingJavadocType]
[WARN] /home/gabsko/breaking-updates/src/main/java/com/frameworkium/core/ui/driver/remotes/Sauce.java:25:3: Missing a Javadoc comment. [MissingJavadocMethod]
[WARN] /home/gabsko/breaking-updates/src/main/java/com/frameworkium/core/ui/driver/remotes/Sauce.java:25:21: Abbreviation in name 'getURL' must contain no more than '1' consecutive capital letters. [AbbreviationAsWordInName]
[WARN] /home/gabsko/breaking-updates/src/main/java/com/frameworkium/core/ui/driver/remotes/Sauce.java:40:3: Missing a Javadoc comment. [MissingJavadocMethod]
[WARN] /home/gabsko/breaking-updates/src/main/java/com/frameworkium/core/ui/driver/remotes/BrowserStack.java:8:1: Missing a Javadoc comment. [MissingJavadocType]
[WARN] /home/gabsko/breaking-updates/src/main/java/com/frameworkium/core/ui/driver/remotes/BrowserStack.java:14:3: Missing a Javadoc comment. [MissingJavadocMethod]
[WARN] /home/gabsko/breaking-updates/src/main/java/com/frameworkium/core/ui/driver/remotes/BrowserStack.java:14:21: Abbreviation in name 'getURL' must contain no more than '1' consecutive capital letters. [AbbreviationAsWordInName]
[WARN] /home/gabsko/breaking-updates/src/main/java/com/frameworkium/core/ui/driver/AbstractDriver.java:19:1: Missing a Javadoc comment. [MissingJavadocType]
[WARN] /home/gabsko/breaking-updates/src/main/java/com/frameworkium/core/ui/driver/AbstractDriver.java:63:26: Abbreviation in name 'eventFiringWD' must contain no more than '1' consecutive capital letters. [AbbreviationAsWordInName]
[WARN] /home/gabsko/breaking-updates/src/main/java/com/frameworkium/core/ui/driver/Driver.java:9:1: Missing a Javadoc comment. [MissingJavadocType]
[WARN] /home/gabsko/breaking-updates/src/main/java/com/frameworkium/core/ui/driver/drivers/LegacyFirefoxImpl.java:5:1: Missing a Javadoc comment. [MissingJavadocType]
[WARN] /home/gabsko/breaking-updates/src/main/java/com/frameworkium/core/ui/driver/drivers/InternetExplorerImpl.java:10:1: Missing a Javadoc comment. [MissingJavadocType]
[WARN] /home/gabsko/breaking-updates/src/main/java/com/frameworkium/core/ui/driver/drivers/SafariImpl.java:10:1: Missing a Javadoc comment. [MissingJavadocType]
[WARN] /home/gabsko/breaking-updates/src/main/java/com/frameworkium/core/ui/driver/drivers/BrowserStackImpl.java:15:1: Missing a Javadoc comment. [MissingJavadocType]
[WARN] /home/gabsko/breaking-updates/src/main/java/com/frameworkium/core/ui/driver/drivers/BrowserStackImpl.java:17:15: Abbreviation in name 'remoteURL' must contain no more than '1' consecutive capital letters. [AbbreviationAsWordInName]
[WARN] /home/gabsko/breaking-updates/src/main/java/com/frameworkium/core/ui/driver/drivers/EdgeImpl.java:9:1: Missing a Javadoc comment. [MissingJavadocType]
[WARN] /home/gabsko/breaking-updates/src/main/java/com/frameworkium/core/ui/driver/drivers/ChromeImpl.java:12:1: Missing a Javadoc comment. [MissingJavadocType]
[WARN] /home/gabsko/breaking-updates/src/main/java/com/frameworkium/core/ui/driver/drivers/GridImpl.java:17:1: Missing a Javadoc comment. [MissingJavadocType]
[WARN] /home/gabsko/breaking-updates/src/main/java/com/frameworkium/core/ui/driver/drivers/GridImpl.java:19:15: Abbreviation in name 'remoteURL' must contain no more than '1' consecutive capital letters. [AbbreviationAsWordInName]
[WARN] /home/gabsko/breaking-updates/src/main/java/com/frameworkium/core/ui/driver/drivers/ElectronImpl.java:13:1: Missing a Javadoc comment. [MissingJavadocType]
[WARN] /home/gabsko/breaking-updates/src/main/java/com/frameworkium/core/ui/driver/drivers/FirefoxImpl.java:11:1: Missing a Javadoc comment. [MissingJavadocType]
[WARN] /home/gabsko/breaking-updates/src/main/java/com/frameworkium/core/ui/driver/drivers/SauceImpl.java:20:1: Missing a Javadoc comment. [MissingJavadocType]
[WARN] /home/gabsko/breaking-updates/src/main/java/com/frameworkium/core/ui/driver/drivers/SauceImpl.java:24:15: Abbreviation in name 'remoteURL' must contain no more than '1' consecutive capital letters. [AbbreviationAsWordInName]
[WARN] /home/gabsko/breaking-updates/src/main/java/com/frameworkium/core/ui/driver/drivers/SauceImpl.java:26:3: Missing a Javadoc comment. [MissingJavadocMethod]
[WARN] /home/gabsko/breaking-updates/src/main/java/com/frameworkium/core/ui/driver/drivers/SauceImpl.java:92:31: Abbreviation in name 'getIOSCapabilities' must contain no more than '1' consecutive capital letters. [AbbreviationAsWordInName]
[WARN] /home/gabsko/breaking-updates/src/main/java/com/frameworkium/core/ui/capture/model/Browser.java:17:1: Missing a Javadoc comment. [MissingJavadocType]
[WARN] /home/gabsko/breaking-updates/src/main/java/com/frameworkium/core/ui/capture/model/message/CreateExecution.java:9:1: Missing a Javadoc comment. [MissingJavadocType]
[WARN] /home/gabsko/breaking-updates/src/main/java/com/frameworkium/core/ui/capture/model/message/CreateExecution.java:13:17: Abbreviation in name 'testID' must contain no more than '1' consecutive capital letters. [AbbreviationAsWordInName]
[WARN] /home/gabsko/breaking-updates/src/main/java/com/frameworkium/core/ui/capture/model/message/CreateExecution.java:21:33: Abbreviation in name 'testID' must contain no more than '1' consecutive capital letters. [AbbreviationAsWordInName]
[WARN] /home/gabsko/breaking-updates/src/main/java/com/frameworkium/core/ui/capture/model/message/CreateScreenshot.java:8:1: Missing a Javadoc comment. [MissingJavadocType]
[WARN] /home/gabsko/breaking-updates/src/main/java/com/frameworkium/core/ui/capture/model/message/CreateScreenshot.java:14:17: Abbreviation in name 'executionID' must contain no more than '1' consecutive capital letters. [AbbreviationAsWordInName]
[WARN] /home/gabsko/breaking-updates/src/main/java/com/frameworkium/core/ui/capture/model/message/CreateScreenshot.java:22:14: Abbreviation in name 'executionID' must contain no more than '1' consecutive capital letters. [AbbreviationAsWordInName]
[WARN] /home/gabsko/breaking-updates/src/main/java/com/frameworkium/core/ui/capture/model/Command.java:8:1: Missing a Javadoc comment. [MissingJavadocType]
[WARN] /home/gabsko/breaking-updates/src/main/java/com/frameworkium/core/ui/capture/model/Command.java:15:3: Missing a Javadoc comment. [MissingJavadocMethod]
[WARN] /home/gabsko/breaking-updates/src/main/java/com/frameworkium/core/ui/capture/model/SoftwareUnderTest.java:6:1: Missing a Javadoc comment. [MissingJavadocType]
[WARN] /home/gabsko/breaking-updates/src/main/java/com/frameworkium/core/ui/capture/ScreenshotCapture.java:46:18: Abbreviation in name 'testID' must contain no more than '1' consecutive capital letters. [AbbreviationAsWordInName]
[WARN] /home/gabsko/breaking-updates/src/main/java/com/frameworkium/core/ui/capture/ScreenshotCapture.java:47:18: Abbreviation in name 'executionID' must contain no more than '1' consecutive capital letters. [AbbreviationAsWordInName]
[WARN] /home/gabsko/breaking-updates/src/main/java/com/frameworkium/core/ui/capture/ScreenshotCapture.java:49:3: Missing a Javadoc comment. [MissingJavadocMethod]
[WARN] /home/gabsko/breaking-updates/src/main/java/com/frameworkium/core/ui/capture/ScreenshotCapture.java:49:35: Abbreviation in name 'testID' must contain no more than '1' consecutive capital letters. [AbbreviationAsWordInName]
[WARN] /home/gabsko/breaking-updates/src/main/java/com/frameworkium/core/ui/capture/ScreenshotCapture.java:56:3: Missing a Javadoc comment. [MissingJavadocMethod]
[WARN] /home/gabsko/breaking-updates/src/main/java/com/frameworkium/core/ui/capture/ScreenshotCapture.java:147:18: Abbreviation in name 'getTestSessionURL' must contain no more than '1' consecutive capital letters. [AbbreviationAsWordInName]
[WARN] /home/gabsko/breaking-updates/src/main/java/com/frameworkium/core/ui/capture/ScreenshotCapture.java:148:9: Abbreviation in name 'gridURL' must contain no more than '1' consecutive capital letters. [AbbreviationAsWordInName]
[WARN] /home/gabsko/breaking-updates/src/main/java/com/frameworkium/core/ui/capture/ElementHighlighter.java:8:1: Missing a Javadoc comment. [MissingJavadocType]
[WARN] /home/gabsko/breaking-updates/src/main/java/com/frameworkium/core/ui/UITestLifecycle.java:31:14: Abbreviation in name 'UITestLifecycle' must contain no more than '1' consecutive capital letters. [AbbreviationAsWordInName]
[WARN] /home/gabsko/breaking-updates/src/main/java/com/frameworkium/core/ui/UITestLifecycle.java:43: Summary javadoc is missing. [SummaryJavadoc]
[WARN] /home/gabsko/breaking-updates/src/main/java/com/frameworkium/core/ui/UITestLifecycle.java:50: Summary javadoc is missing. [SummaryJavadoc]
[WARN] /home/gabsko/breaking-updates/src/main/java/com/frameworkium/core/ui/UITestLifecycle.java:94: Summary javadoc is missing. [SummaryJavadoc]
[WARN] /home/gabsko/breaking-updates/src/main/java/com/frameworkium/core/ui/UITestLifecycle.java:103:22: Abbreviation in name 'testID' must contain no more than '1' consecutive capital letters. [AbbreviationAsWordInName]
[WARN] /home/gabsko/breaking-updates/src/main/java/com/frameworkium/core/ui/UITestLifecycle.java:110: First sentence of Javadoc is missing an ending period. [SummaryJavadoc]
[WARN] /home/gabsko/breaking-updates/src/main/java/com/frameworkium/core/ui/UITestLifecycle.java:128: Summary javadoc is missing. [SummaryJavadoc]
[WARN] /home/gabsko/breaking-updates/src/main/java/com/frameworkium/core/ui/UITestLifecycle.java:137: Summary javadoc is missing. [SummaryJavadoc]
[WARN] /home/gabsko/breaking-updates/src/main/java/com/frameworkium/core/ui/UITestLifecycle.java:160: Summary javadoc is missing. [SummaryJavadoc]
[WARN] /home/gabsko/breaking-updates/src/main/java/com/frameworkium/core/ui/UITestLifecycle.java:167: Summary javadoc is missing. [SummaryJavadoc]
[WARN] /home/gabsko/breaking-updates/src/main/java/com/frameworkium/core/ui/proxy/SeleniumProxyFactory.java:9:1: Missing a Javadoc comment. [MissingJavadocType]
[WARN] /home/gabsko/breaking-updates/src/main/java/com/frameworkium/core/ui/proxy/SeleniumProxyFactory.java:13: First sentence of Javadoc is missing an ending period. [SummaryJavadoc]
[WARN] /home/gabsko/breaking-updates/src/main/java/com/frameworkium/core/ui/proxy/SeleniumProxyFactory.java:53:25: Abbreviation in name 'getProxyURL' must contain no more than '1' consecutive capital letters. [AbbreviationAsWordInName]
[WARN] /home/gabsko/breaking-updates/src/main/java/com/frameworkium/core/ui/proxy/SeleniumProxyFactory.java:55:11: Abbreviation in name 'proxyURI' must contain no more than '1' consecutive capital letters. [AbbreviationAsWordInName]
[WARN] /home/gabsko/breaking-updates/src/main/java/com/frameworkium/core/ui/pages/BasePage.java:19:1: Missing a Javadoc comment. [MissingJavadocType]
[WARN] /home/gabsko/breaking-updates/src/main/java/com/frameworkium/core/ui/pages/BasePage.java:193: Summary javadoc is missing. [SummaryJavadoc]
[WARN] /home/gabsko/breaking-updates/src/main/java/com/frameworkium/core/ui/pages/BasePage.java:198:20: Abbreviation in name 'executeJS' must contain no more than '1' consecutive capital letters. [AbbreviationAsWordInName]
[WARN] /home/gabsko/breaking-updates/src/main/java/com/frameworkium/core/ui/pages/BasePage.java:223:20: Abbreviation in name 'executeAsyncJS' must contain no more than '1' consecutive capital letters. [AbbreviationAsWordInName]
[WARN] /home/gabsko/breaking-updates/src/main/java/com/frameworkium/core/ui/pages/PageFactory.java:8:1: Missing a Javadoc comment. [MissingJavadocType]
[WARN] /home/gabsko/breaking-updates/src/main/java/com/frameworkium/core/ui/listeners/CaptureListener.java:56:19: Abbreviation in name 'isUITest' must contain no more than '1' consecutive capital letters. [AbbreviationAsWordInName]
[WARN] /home/gabsko/breaking-updates/src/main/java/com/frameworkium/core/ui/listeners/LoggingListener.java:14:1: Missing a Javadoc comment. [MissingJavadocType]
[WARN] /home/gabsko/breaking-updates/src/main/java/com/frameworkium/core/ui/listeners/ScreenshotListener.java:24:1: Missing a Javadoc comment. [MissingJavadocType]
[WARN] /home/gabsko/breaking-updates/src/main/java/com/frameworkium/core/ui/listeners/ScreenshotListener.java:94:13: Abbreviation in name 'isUITest' must contain no more than '1' consecutive capital letters. [AbbreviationAsWordInName]
[WARN] /home/gabsko/breaking-updates/src/main/java/com/frameworkium/core/ui/listeners/VideoListener.java:9:1: Missing a Javadoc comment. [MissingJavadocType]
[WARN] /home/gabsko/breaking-updates/src/main/java/com/frameworkium/core/ui/listeners/VideoListener.java:12:39: Parameter name 'iTestResult' must match pattern '^[a-z]([a-z0-9][a-zA-Z0-9]*)?$'. [ParameterName]
[WARN] /home/gabsko/breaking-updates/src/main/java/com/frameworkium/core/ui/listeners/VideoListener.java:21:37: Parameter name 'iTestContext' must match pattern '^[a-z]([a-z0-9][a-zA-Z0-9]*)?$'. [ParameterName]
[WARN] /home/gabsko/breaking-updates/src/main/java/com/frameworkium/core/ui/listeners/SauceLabsListener.java:16:1: Missing a Javadoc comment. [MissingJavadocType]
[WARN] /home/gabsko/breaking-updates/src/main/java/com/frameworkium/core/ui/video/VideoCapture.java:18:1: Missing a Javadoc comment. [MissingJavadocType]
[WARN] /home/gabsko/breaking-updates/src/main/java/com/frameworkium/core/ui/video/VideoCapture.java:43:22: Abbreviation in name 'saveTestSessionID' must contain no more than '1' consecutive capital letters. [AbbreviationAsWordInName]
[WARN] /home/gabsko/breaking-updates/src/main/java/com/frameworkium/core/ui/video/VideoCapture.java:52:9: Abbreviation in name 'videoCaptureURL' must contain no more than '1' consecutive capital letters. [AbbreviationAsWordInName]
[WARN] /home/gabsko/breaking-updates/src/main/java/com/frameworkium/core/ui/video/VideoCapture.java:61:15: Abbreviation in name 'getVideoCaptureURL' must contain no more than '1' consecutive capital letters. [AbbreviationAsWordInName]
[WARN] /home/gabsko/breaking-updates/src/main/java/com/frameworkium/core/ui/video/VideoCapture.java:70:31: Abbreviation in name 'videoCaptureURL' must contain no more than '1' consecutive capital letters. [AbbreviationAsWordInName]
[WARN] /home/gabsko/breaking-updates/src/main/java/com/frameworkium/core/ui/video/UrlFetcher.java:12:1: Missing a Javadoc comment. [MissingJavadocType]
[WARN] /home/gabsko/breaking-updates/src/main/java/com/frameworkium/core/ui/video/UrlFetcher.java:16: Summary javadoc is missing. [SummaryJavadoc]
[WARN] /home/gabsko/breaking-updates/src/main/java/com/frameworkium/core/ui/annotations/Invisible.java:8:1: Missing a Javadoc comment. [MissingJavadocType]
[WARN] /home/gabsko/breaking-updates/src/main/java/com/frameworkium/core/ui/annotations/Visible.java:8:1: Missing a Javadoc comment. [MissingJavadocType]
[WARN] /home/gabsko/breaking-updates/src/main/java/com/frameworkium/core/ui/annotations/ForceVisible.java:8:1: Missing a Javadoc comment. [MissingJavadocType]
[WARN] /home/gabsko/breaking-updates/src/main/java/com/frameworkium/core/ui/tests/BaseUITest.java:32:1: Missing a Javadoc comment. [MissingJavadocType]
[WARN] /home/gabsko/breaking-updates/src/main/java/com/frameworkium/core/ui/tests/BaseUITest.java:37:23: Abbreviation in name 'BaseUITest' must contain no more than '1' consecutive capital letters. [AbbreviationAsWordInName]
[WARN] /home/gabsko/breaking-updates/src/main/java/com/frameworkium/core/ui/tests/BaseUITest.java:61: First sentence of Javadoc is missing an ending period. [SummaryJavadoc]
[WARN] /home/gabsko/breaking-updates/src/main/java/com/frameworkium/core/ui/tests/BaseUITest.java:97: Summary javadoc is missing. [SummaryJavadoc]
[WARN] /home/gabsko/breaking-updates/src/main/java/com/frameworkium/core/ui/tests/BaseUITest.java:106: Summary javadoc is missing. [SummaryJavadoc]
[WARN] /home/gabsko/breaking-updates/src/main/java/com/frameworkium/core/ui/tests/BaseUITest.java:114: Summary javadoc is missing. [SummaryJavadoc]
[WARN] /home/gabsko/breaking-updates/src/main/java/com/frameworkium/core/ui/tests/BaseUITest.java:122: Summary javadoc is missing. [SummaryJavadoc]
[WARN] /home/gabsko/breaking-updates/src/main/java/com/frameworkium/core/ui/tests/BaseUITest.java:131: Summary javadoc is missing. [SummaryJavadoc]
[WARN] /home/gabsko/breaking-updates/src/main/java/com/frameworkium/core/ui/tests/BaseUITest.java:139: First sentence of Javadoc is missing an ending period. [SummaryJavadoc]
[WARN] /home/gabsko/breaking-updates/src/main/java/com/frameworkium/core/ui/ExtraExpectedConditions.java:113:44: Method name 'jQueryAjaxDone' must match pattern '^[a-z][a-z0-9][a-zA-Z0-9_]*$'. [MethodName]
[WARN] /home/gabsko/breaking-updates/src/main/java/com/frameworkium/core/htmlelements/element/Table.java:34: <p> tag should be placed immediately before the first word, with no space after. [JavadocParagraph]
[WARN] /home/gabsko/breaking-updates/src/main/java/com/frameworkium/core/htmlelements/element/Table.java:34: <p> tag should be preceded with an empty line. [JavadocParagraph]
[WARN] /home/gabsko/breaking-updates/src/main/java/com/frameworkium/core/htmlelements/element/Table.java:144: Line is longer than 100 characters (found 105). [LineLength]
[WARN] /home/gabsko/breaking-updates/src/main/java/com/frameworkium/core/htmlelements/element/Table.java:155: Line is longer than 100 characters (found 107). [LineLength]
[WARN] /home/gabsko/breaking-updates/src/main/java/com/frameworkium/core/htmlelements/element/Table.java:178: Line is longer than 100 characters (found 104). [LineLength]
[WARN] /home/gabsko/breaking-updates/src/main/java/com/frameworkium/core/htmlelements/element/Select.java:12: <p> tag should be placed immediately before the first word, with no space after. [JavadocParagraph]
[WARN] /home/gabsko/breaking-updates/src/main/java/com/frameworkium/core/htmlelements/element/Select.java:12: <p> tag should be preceded with an empty line. [JavadocParagraph]
[WARN] /home/gabsko/breaking-updates/src/main/java/com/frameworkium/core/htmlelements/element/FileInput.java:35: <p> tag should be placed immediately before the first word, with no space after. [JavadocParagraph]
[WARN] /home/gabsko/breaking-updates/src/main/java/com/frameworkium/core/htmlelements/element/FileInput.java:35: <p> tag should be preceded with an empty line. [JavadocParagraph]
[WARN] /home/gabsko/breaking-updates/src/main/java/com/frameworkium/core/htmlelements/element/FileInput.java:51: <p> tag should be placed immediately before the first word, with no space after. [JavadocParagraph]
[WARN] /home/gabsko/breaking-updates/src/main/java/com/frameworkium/core/htmlelements/element/FileInput.java:51: <p> tag should be preceded with an empty line. [JavadocParagraph]
[WARN] /home/gabsko/breaking-updates/src/main/java/com/frameworkium/core/htmlelements/element/TextInput.java:43: <p> tag should be placed immediately before the first word, with no space after. [JavadocParagraph]
[WARN] /home/gabsko/breaking-updates/src/main/java/com/frameworkium/core/htmlelements/element/TextInput.java:43: <p> tag should be preceded with an empty line. [JavadocParagraph]
[WARN] /home/gabsko/breaking-updates/src/main/java/com/frameworkium/core/htmlelements/element/Image.java:5: First sentence of Javadoc is missing an ending period. [SummaryJavadoc]
[WARN] /home/gabsko/breaking-updates/src/main/java/com/frameworkium/core/htmlelements/element/Image.java:14: First sentence of Javadoc is missing an ending period. [SummaryJavadoc]
[WARN] /home/gabsko/breaking-updates/src/main/java/com/frameworkium/core/htmlelements/element/Image.java:23: First sentence of Javadoc is missing an ending period. [SummaryJavadoc]
[WARN] /home/gabsko/breaking-updates/src/main/java/com/frameworkium/core/htmlelements/loader/HtmlElementLoader.java:29: Line is longer than 100 characters (found 103). [LineLength]
[WARN] /home/gabsko/breaking-updates/src/main/java/com/frameworkium/core/htmlelements/loader/HtmlElementLoader.java:44: Line is longer than 100 characters (found 110). [LineLength]
[WARN] /home/gabsko/breaking-updates/src/main/java/com/frameworkium/core/htmlelements/loader/HtmlElementLoader.java:62:3: Missing a Javadoc comment. [MissingJavadocMethod]
[WARN] /home/gabsko/breaking-updates/src/main/java/com/frameworkium/core/htmlelements/loader/HtmlElementLoader.java:76:3: Missing a Javadoc comment. [MissingJavadocMethod]
[WARN] /home/gabsko/breaking-updates/src/main/java/com/frameworkium/core/htmlelements/loader/HtmlElementLoader.java:87:3: Missing a Javadoc comment. [MissingJavadocMethod]
[WARN] /home/gabsko/breaking-updates/src/main/java/com/frameworkium/core/htmlelements/loader/HtmlElementLoader.java:113: Line is longer than 100 characters (found 110). [LineLength]
[WARN] /home/gabsko/breaking-updates/src/main/java/com/frameworkium/core/htmlelements/loader/decorator/proxyhandlers/WebElementListNamedProxyHandler.java:7:1: Missing a Javadoc comment. [MissingJavadocType]
[WARN] /home/gabsko/breaking-updates/src/main/java/com/frameworkium/core/htmlelements/loader/decorator/proxyhandlers/HtmlElementListNamedProxyHandler.java:14:1: Missing a Javadoc comment. [MissingJavadocType]
[WARN] /home/gabsko/breaking-updates/src/main/java/com/frameworkium/core/htmlelements/loader/decorator/proxyhandlers/HtmlElementListNamedProxyHandler.java:20:3: Missing a Javadoc comment. [MissingJavadocMethod]
[WARN] /home/gabsko/breaking-updates/src/main/java/com/frameworkium/core/htmlelements/loader/decorator/proxyhandlers/TypifiedElementListNamedProxyHandler.java:14:1: Missing a Javadoc comment. [MissingJavadocType]
[WARN] /home/gabsko/breaking-updates/src/main/java/com/frameworkium/core/htmlelements/loader/decorator/proxyhandlers/TypifiedElementListNamedProxyHandler.java:21:3: Missing a Javadoc comment. [MissingJavadocMethod]
[WARN] /home/gabsko/breaking-updates/src/main/java/com/frameworkium/core/htmlelements/loader/decorator/proxyhandlers/WebElementNamedProxyHandler.java:11:1: Missing a Javadoc comment. [MissingJavadocType]
[WARN] /home/gabsko/breaking-updates/src/main/java/com/frameworkium/core/htmlelements/loader/decorator/proxyhandlers/WebElementNamedProxyHandler.java:17:3: Missing a Javadoc comment. [MissingJavadocMethod]
[WARN] /home/gabsko/breaking-updates/src/main/java/com/frameworkium/core/htmlelements/loader/decorator/proxyhandlers/WebElementNamedProxyHandler.java:40:5: '}' at column 5 should be on the same line as the next part of a multi-block statement (one that directly contains multiple blocks: if/else-if/else, do/while or try/catch/finally). [RightCurlySame]
[WARN] /home/gabsko/breaking-updates/src/main/java/com/frameworkium/core/htmlelements/loader/decorator/HtmlElementDecorator.java:43: Line is longer than 100 characters (found 108). [LineLength]
[WARN] /home/gabsko/breaking-updates/src/main/java/com/frameworkium/core/htmlelements/loader/decorator/HtmlElementDecorator.java:47: Line is longer than 100 characters (found 102). [LineLength]
[WARN] /home/gabsko/breaking-updates/src/main/java/com/frameworkium/core/htmlelements/loader/decorator/HtmlElementDecorator.java:48: Line is longer than 100 characters (found 113). [LineLength]
[WARN] /home/gabsko/breaking-updates/src/main/java/com/frameworkium/core/htmlelements/loader/decorator/HtmlElementDecorator.java:58:3: Missing a Javadoc comment. [MissingJavadocMethod]
[WARN] /home/gabsko/breaking-updates/src/main/java/com/frameworkium/core/htmlelements/loader/decorator/HtmlElementLocatorFactory.java:26: Line is longer than 100 characters (found 114). [LineLength]
[WARN] /home/gabsko/breaking-updates/src/main/java/com/frameworkium/core/htmlelements/loader/decorator/HtmlElementLocatorFactory.java:28: Line is longer than 100 characters (found 113). [LineLength]
[WARN] /home/gabsko/breaking-updates/src/main/java/com/frameworkium/core/htmlelements/loader/decorator/HtmlElementLocatorFactory.java:38: Line is longer than 100 characters (found 114). [LineLength]
[WARN] /home/gabsko/breaking-updates/src/main/java/com/frameworkium/core/htmlelements/loader/decorator/HtmlElementLocatorFactory.java:40: Line is longer than 100 characters (found 113). [LineLength]
[WARN] /home/gabsko/breaking-updates/src/main/java/com/frameworkium/core/htmlelements/loader/decorator/HtmlElementLocatorFactory.java:50:3: Missing a Javadoc comment. [MissingJavadocMethod]
[WARN] /home/gabsko/breaking-updates/src/main/java/com/frameworkium/core/htmlelements/loader/decorator/HtmlElementLocatorFactory.java:61:3: Missing a Javadoc comment. [MissingJavadocMethod]
[WARN] /home/gabsko/breaking-updates/src/main/java/com/frameworkium/core/htmlelements/loader/decorator/HtmlElementLocatorFactory.java:69:7: '}' at column 7 should be on the same line as the next part of a multi-block statement (one that directly contains multiple blocks: if/else-if/else, do/while or try/catch/finally). [RightCurlySame]
[WARN] /home/gabsko/breaking-updates/src/main/java/com/frameworkium/core/htmlelements/loader/decorator/HtmlElementLocatorFactory.java:73:43: Empty catch block. [EmptyCatchBlock]
[WARN] /home/gabsko/breaking-updates/src/main/java/com/frameworkium/core/htmlelements/loader/decorator/ProxyFactory.java:12: First sentence of Javadoc is missing an ending period. [SummaryJavadoc]
[WARN] /home/gabsko/breaking-updates/src/main/java/com/frameworkium/core/htmlelements/loader/decorator/ProxyFactory.java:24: Line is longer than 100 characters (found 101). [LineLength]
[WARN] /home/gabsko/breaking-updates/src/main/java/com/frameworkium/core/htmlelements/loader/decorator/ProxyFactory.java:35: Line is longer than 100 characters (found 103). [LineLength]
[WARN] /home/gabsko/breaking-updates/src/main/java/com/frameworkium/core/htmlelements/utils/HtmlElementUtils.java:27: First sentence of Javadoc is missing an ending period. [SummaryJavadoc]
[WARN] /home/gabsko/breaking-updates/src/main/java/com/frameworkium/core/htmlelements/utils/HtmlElementUtils.java:37:3: Missing a Javadoc comment. [MissingJavadocMethod]
[WARN] /home/gabsko/breaking-updates/src/main/java/com/frameworkium/core/htmlelements/utils/HtmlElementUtils.java:75:3: Missing a Javadoc comment. [MissingJavadocMethod]
[WARN] /home/gabsko/breaking-updates/src/main/java/com/frameworkium/core/htmlelements/utils/HtmlElementUtils.java:83:3: Missing a Javadoc comment. [MissingJavadocMethod]
[WARN] /home/gabsko/breaking-updates/src/main/java/com/frameworkium/core/htmlelements/utils/HtmlElementUtils.java:91:3: Missing a Javadoc comment. [MissingJavadocMethod]
[WARN] /home/gabsko/breaking-updates/src/main/java/com/frameworkium/core/htmlelements/utils/HtmlElementUtils.java:128:3: Missing a Javadoc comment. [MissingJavadocMethod]
[WARN] /home/gabsko/breaking-updates/src/main/java/com/frameworkium/core/htmlelements/utils/HtmlElementUtils.java:133: Line is longer than 100 characters (found 113). [LineLength]
[WARN] /home/gabsko/breaking-updates/src/main/java/com/frameworkium/core/htmlelements/utils/HtmlElementUtils.java:134: Line is longer than 100 characters (found 113). [LineLength]
[WARN] /home/gabsko/breaking-updates/src/main/java/com/frameworkium/core/htmlelements/utils/HtmlElementUtils.java:135: Line is longer than 100 characters (found 112). [LineLength]
[WARN] /home/gabsko/breaking-updates/src/main/java/com/frameworkium/core/htmlelements/annotations/Timeout.java:11: <p> tag should be placed immediately before the first word, with no space after. [JavadocParagraph]
[WARN] /home/gabsko/breaking-updates/src/main/java/com/frameworkium/core/htmlelements/annotations/Timeout.java:11: <p> tag should be preceded with an empty line. [JavadocParagraph]
[WARN] /home/gabsko/breaking-updates/src/main/java/com/frameworkium/core/htmlelements/annotations/Timeout.java:29:3: Missing a Javadoc comment. [MissingJavadocMethod]
Audit done.
[INFO] You have 0 Checkstyle violations.
[INFO] 
[INFO] --- jacoco-maven-plugin:0.8.7:prepare-agent (jacoco-initialize) @ frameworkium-core ---
[INFO] surefireArgLine set to -javaagent:/home/gabsko/.m2/repository/org/jacoco/org.jacoco.agent/0.8.7/org.jacoco.agent-0.8.7-runtime.jar=destfile=/home/gabsko/breaking-updates/target/jacoco.exec
[INFO] 
[INFO] --- maven-resources-plugin:2.6:resources (default-resources) @ frameworkium-core ---
[INFO] Using 'UTF-8' encoding to copy filtered resources.
[INFO] Copying 4 resources
[INFO] 
[INFO] --- maven-compiler-plugin:3.8.1:compile (default-compile) @ frameworkium-core ---
[INFO] Changes detected - recompiling the module!
[INFO] Compiling 122 source files to /home/gabsko/breaking-updates/target/classes
[INFO] /home/gabsko/breaking-updates/src/main/java/com/frameworkium/core/ui/listeners/CaptureListener.java: Some input files use or override a deprecated API.
[INFO] /home/gabsko/breaking-updates/src/main/java/com/frameworkium/core/ui/listeners/CaptureListener.java: Recompile with -Xlint:deprecation for details.
[INFO] /home/gabsko/breaking-updates/src/main/java/com/frameworkium/core/htmlelements/loader/decorator/HtmlElementLocatorFactory.java: Some input files use unchecked or unsafe operations.
[INFO] /home/gabsko/breaking-updates/src/main/java/com/frameworkium/core/htmlelements/loader/decorator/HtmlElementLocatorFactory.java: Recompile with -Xlint:unchecked for details.
[INFO] 
[INFO] --- maven-resources-plugin:2.6:testResources (default-testResources) @ frameworkium-core ---
[INFO] Using 'UTF-8' encoding to copy filtered resources.
[INFO] Copying 1 resource
[INFO] 
[INFO] --- maven-compiler-plugin:3.8.1:testCompile (default-testCompile) @ frameworkium-core ---
[INFO] Changes detected - recompiling the module!
[INFO] Compiling 53 source files to /home/gabsko/breaking-updates/target/test-classes
[INFO] 
[INFO] --- gmavenplus-plugin:1.12.1:compileTests (default) @ frameworkium-core ---
[INFO] Using isolated classloader, without GMavenPlus classpath.
[INFO] Using Groovy 3.0.8 to perform compileTests.
[INFO] Parallel parsing disabled.
[INFO] Compiled 78 files.
[INFO] 
[INFO] --- maven-surefire-plugin:3.0.0-M5:test (default-test) @ frameworkium-core ---
[INFO] 
[INFO] -------------------------------------------------------
[INFO]  T E S T S
[INFO] -------------------------------------------------------
[INFO] Running com.frameworkium.core.api.dto.AbstractDTOSpec
[INFO] Tests run: 6, Failures: 0, Errors: 0, Skipped: 0, Time elapsed: 0.129 s - in com.frameworkium.core.api.dto.AbstractDTOSpec
[INFO] Running com.frameworkium.core.common.retry.RetryFlakyTestSpec
[INFO] Tests run: 1, Failures: 0, Errors: 0, Skipped: 0, Time elapsed: 0.065 s - in com.frameworkium.core.common.retry.RetryFlakyTestSpec
[INFO] Running com.frameworkium.core.common.reporting.TestIdUtilsSpec
[INFO] Tests run: 18, Failures: 0, Errors: 0, Skipped: 0, Time elapsed: 0.065 s - in com.frameworkium.core.common.reporting.TestIdUtilsSpec
[INFO] Running com.frameworkium.core.common.reporting.jira.service.SearchSpec
[ERROR] Tests run: 1, Failures: 0, Errors: 1, Skipped: 0, Time elapsed: 0.671 s <<< FAILURE! - in com.frameworkium.core.common.reporting.jira.service.SearchSpec
[ERROR] com.frameworkium.core.common.reporting.jira.service.SearchSpec.Getting keys from JQL JIRA search  Time elapsed: 0.654 s  <<< ERROR!
org.apache.http.conn.HttpHostConnectException: Connect to localhost:8080 [localhost/127.0.0.1] failed: Connection refused (Connection refused)
	at com.frameworkium.core.common.reporting.jira.service.SearchSpec.Getting keys from JQL JIRA search(SearchSpec.groovy:36)
Caused by: java.net.ConnectException: Connection refused (Connection refused)
	at com.frameworkium.core.common.reporting.jira.service.SearchSpec.Getting keys from JQL JIRA search(SearchSpec.groovy:36)

[INFO] Running com.frameworkium.core.common.reporting.jira.service.IssueSpec
[ERROR] Tests run: 5, Failures: 0, Errors: 5, Skipped: 0, Time elapsed: 0.699 s <<< FAILURE! - in com.frameworkium.core.common.reporting.jira.service.IssueSpec
[ERROR] com.frameworkium.core.common.reporting.jira.service.IssueSpec.Get an Issue  Time elapsed: 0.006 s  <<< ERROR!
org.apache.http.conn.HttpHostConnectException: Connect to localhost:8080 [localhost/127.0.0.1] failed: Connection refused (Connection refused)
	at com.frameworkium.core.common.reporting.jira.service.IssueSpec.Get an Issue(IssueSpec.groovy:39)
Caused by: java.net.ConnectException: Connection refused (Connection refused)
	at com.frameworkium.core.common.reporting.jira.service.IssueSpec.Get an Issue(IssueSpec.groovy:39)

[ERROR] com.frameworkium.core.common.reporting.jira.service.IssueSpec.Edit a field in JIRA issue  Time elapsed: 0.004 s  <<< ERROR!
org.apache.http.conn.HttpHostConnectException: Connect to localhost:8080 [localhost/127.0.0.1] failed: Connection refused (Connection refused)
	at com.frameworkium.core.common.reporting.jira.service.IssueSpec.Edit a field in JIRA issue(IssueSpec.groovy:64)
Caused by: java.net.ConnectException: Connection refused (Connection refused)
	at com.frameworkium.core.common.reporting.jira.service.IssueSpec.Edit a field in JIRA issue(IssueSpec.groovy:64)

[ERROR] com.frameworkium.core.common.reporting.jira.service.IssueSpec.Add a comment into JIRA issue  Time elapsed: 0.024 s  <<< ERROR!
org.apache.http.conn.HttpHostConnectException: Connect to localhost:8080 [localhost/127.0.0.1] failed: Connection refused (Connection refused)
	at com.frameworkium.core.common.reporting.jira.service.IssueSpec.Add a comment into JIRA issue(IssueSpec.groovy:89)
Caused by: java.net.ConnectException: Connection refused (Connection refused)
	at com.frameworkium.core.common.reporting.jira.service.IssueSpec.Add a comment into JIRA issue(IssueSpec.groovy:89)

[ERROR] com.frameworkium.core.common.reporting.jira.service.IssueSpec.Perform a transition on an issue   Time elapsed: 0.01 s  <<< ERROR!
org.apache.http.conn.HttpHostConnectException: Connect to localhost:8080 [localhost/127.0.0.1] failed: Connection refused (Connection refused)
	at com.frameworkium.core.common.reporting.jira.service.IssueSpec.Perform a transition on an issue (IssueSpec.groovy:110)
Caused by: java.net.ConnectException: Connection refused (Connection refused)
	at com.frameworkium.core.common.reporting.jira.service.IssueSpec.Perform a transition on an issue (IssueSpec.groovy:110)

[ERROR] com.frameworkium.core.common.reporting.jira.service.IssueSpec.Attach a file to a issue  Time elapsed: 0.009 s  <<< ERROR!
org.apache.http.conn.HttpHostConnectException: Connect to localhost:8080 [localhost/127.0.0.1] failed: Connection refused (Connection refused)
	at com.frameworkium.core.common.reporting.jira.service.IssueSpec.Attach a file to a issue(IssueSpec.groovy:136)
Caused by: java.net.ConnectException: Connection refused (Connection refused)
	at com.frameworkium.core.common.reporting.jira.service.IssueSpec.Attach a file to a issue(IssueSpec.groovy:136)

[INFO] Running com.frameworkium.core.common.reporting.jira.service.AttachmentSpec
[INFO] Tests run: 1, Failures: 0, Errors: 0, Skipped: 0, Time elapsed: 1.136 s - in com.frameworkium.core.common.reporting.jira.service.AttachmentSpec
[INFO] Running com.frameworkium.core.common.reporting.jira.service.ProjectSpec
[ERROR] Tests run: 2, Failures: 0, Errors: 2, Skipped: 0, Time elapsed: 0.034 s <<< FAILURE! - in com.frameworkium.core.common.reporting.jira.service.ProjectSpec
[ERROR] com.frameworkium.core.common.reporting.jira.service.ProjectSpec.Get project from Jira  Time elapsed: 0.023 s  <<< ERROR!
org.apache.http.conn.HttpHostConnectException: Connect to localhost:8080 [localhost/127.0.0.1] failed: Connection refused (Connection refused)
	at com.frameworkium.core.common.reporting.jira.service.ProjectSpec.Get project from Jira(ProjectSpec.groovy:39)
Caused by: java.net.ConnectException: Connection refused (Connection refused)
	at com.frameworkium.core.common.reporting.jira.service.ProjectSpec.Get project from Jira(ProjectSpec.groovy:39)

[ERROR] com.frameworkium.core.common.reporting.jira.service.ProjectSpec.get project versions from Jira  Time elapsed: 0.005 s  <<< ERROR!
org.apache.http.conn.HttpHostConnectException: Connect to localhost:8080 [localhost/127.0.0.1] failed: Connection refused (Connection refused)
	at com.frameworkium.core.common.reporting.jira.service.ProjectSpec.get project versions from Jira(ProjectSpec.groovy:58)
Caused by: java.net.ConnectException: Connection refused (Connection refused)
	at com.frameworkium.core.common.reporting.jira.service.ProjectSpec.get project versions from Jira(ProjectSpec.groovy:58)

[INFO] Running com.frameworkium.core.common.reporting.jira.service.IssueLinkSpec
[ERROR] Tests run: 1, Failures: 0, Errors: 1, Skipped: 0, Time elapsed: 0.01 s <<< FAILURE! - in com.frameworkium.core.common.reporting.jira.service.IssueLinkSpec
[ERROR] com.frameworkium.core.common.reporting.jira.service.IssueLinkSpec.Create link between two JIRA issues  Time elapsed: 0.006 s  <<< ERROR!
org.apache.http.conn.HttpHostConnectException: Connect to localhost:8080 [localhost/127.0.0.1] failed: Connection refused (Connection refused)
	at com.frameworkium.core.common.reporting.jira.service.IssueLinkSpec.Create link between two JIRA issues(IssueLinkSpec.groovy:40)
Caused by: java.net.ConnectException: Connection refused (Connection refused)
	at com.frameworkium.core.common.reporting.jira.service.IssueLinkSpec.Create link between two JIRA issues(IssueLinkSpec.groovy:40)

[INFO] Running com.frameworkium.core.common.reporting.jira.service.VersionSpec
[ERROR] Tests run: 2, Failures: 0, Errors: 2, Skipped: 0, Time elapsed: 0.015 s <<< FAILURE! - in com.frameworkium.core.common.reporting.jira.service.VersionSpec
[ERROR] com.frameworkium.core.common.reporting.jira.service.VersionSpec.Get Jira project version  Time elapsed: 0.006 s  <<< ERROR!
org.apache.http.conn.HttpHostConnectException: Connect to localhost:8080 [localhost/127.0.0.1] failed: Connection refused (Connection refused)
	at com.frameworkium.core.common.reporting.jira.service.VersionSpec.Get Jira project version(VersionSpec.groovy:43)
Caused by: java.net.ConnectException: Connection refused (Connection refused)
	at com.frameworkium.core.common.reporting.jira.service.VersionSpec.Get Jira project version(VersionSpec.groovy:43)

[ERROR] com.frameworkium.core.common.reporting.jira.service.VersionSpec.Create Jira project version  Time elapsed: 0.007 s  <<< ERROR!
org.apache.http.conn.HttpHostConnectException: Connect to localhost:8080 [localhost/127.0.0.1] failed: Connection refused (Connection refused)
	at com.frameworkium.core.common.reporting.jira.service.VersionSpec.Create Jira project version(VersionSpec.groovy:64)
Caused by: java.net.ConnectException: Connection refused (Connection refused)
	at com.frameworkium.core.common.reporting.jira.service.VersionSpec.Create Jira project version(VersionSpec.groovy:64)

[INFO] Running com.frameworkium.core.common.reporting.jira.zapi.ExecutionSearchSpec
[ERROR] Tests run: 3, Failures: 0, Errors: 1, Skipped: 2, Time elapsed: 0.011 s <<< FAILURE! - in com.frameworkium.core.common.reporting.jira.zapi.ExecutionSearchSpec
[ERROR] com.frameworkium.core.common.reporting.jira.zapi.ExecutionSearchSpec.Search Zephyr for execution  Time elapsed: 0.006 s  <<< ERROR!
org.apache.http.conn.HttpHostConnectException: Connect to localhost:8080 [localhost/127.0.0.1] failed: Connection refused (Connection refused)
	at com.frameworkium.core.common.reporting.jira.zapi.ExecutionSearchSpec.Search Zephyr for execution(ExecutionSearchSpec.groovy:38)
Caused by: java.net.ConnectException: Connection refused (Connection refused)
	at com.frameworkium.core.common.reporting.jira.zapi.ExecutionSearchSpec.Search Zephyr for execution(ExecutionSearchSpec.groovy:38)

[INFO] Running com.frameworkium.core.common.reporting.jira.zapi.CycleSpec
[ERROR] Tests run: 2, Failures: 0, Errors: 2, Skipped: 0, Time elapsed: 0.014 s <<< FAILURE! - in com.frameworkium.core.common.reporting.jira.zapi.CycleSpec
[ERROR] com.frameworkium.core.common.reporting.jira.zapi.CycleSpec.Get list of Zephyr cycles  Time elapsed: 0.005 s  <<< ERROR!
org.apache.http.conn.HttpHostConnectException: Connect to localhost:8080 [localhost/127.0.0.1] failed: Connection refused (Connection refused)
	at com.frameworkium.core.common.reporting.jira.zapi.CycleSpec.Get list of Zephyr cycles(CycleSpec.groovy:44)
Caused by: java.net.ConnectException: Connection refused (Connection refused)
	at com.frameworkium.core.common.reporting.jira.zapi.CycleSpec.Get list of Zephyr cycles(CycleSpec.groovy:44)

[ERROR] com.frameworkium.core.common.reporting.jira.zapi.CycleSpec.Create new Zephyr cycle  Time elapsed: 0.005 s  <<< ERROR!
org.apache.http.conn.HttpHostConnectException: Connect to localhost:8080 [localhost/127.0.0.1] failed: Connection refused (Connection refused)
	at com.frameworkium.core.common.reporting.jira.zapi.CycleSpec.Create new Zephyr cycle(CycleSpec.groovy:69)
Caused by: java.net.ConnectException: Connection refused (Connection refused)
	at com.frameworkium.core.common.reporting.jira.zapi.CycleSpec.Create new Zephyr cycle(CycleSpec.groovy:69)

[INFO] Running com.frameworkium.core.common.reporting.jira.zapi.AttachmentSpec
[ERROR] Tests run: 3, Failures: 0, Errors: 3, Skipped: 0, Time elapsed: 0.027 s <<< FAILURE! - in com.frameworkium.core.common.reporting.jira.zapi.AttachmentSpec
[ERROR] com.frameworkium.core.common.reporting.jira.zapi.AttachmentSpec.Get Zephyr attachment by entity  Time elapsed: 0.007 s  <<< ERROR!
org.apache.http.conn.HttpHostConnectException: Connect to localhost:8080 [localhost/127.0.0.1] failed: Connection refused (Connection refused)
	at com.frameworkium.core.common.reporting.jira.zapi.AttachmentSpec.Get Zephyr attachment by entity(AttachmentSpec.groovy:38)
Caused by: java.net.ConnectException: Connection refused (Connection refused)
	at com.frameworkium.core.common.reporting.jira.zapi.AttachmentSpec.Get Zephyr attachment by entity(AttachmentSpec.groovy:38)

[ERROR] com.frameworkium.core.common.reporting.jira.zapi.AttachmentSpec.Delete Zephyr attachment  Time elapsed: 0.013 s  <<< ERROR!
org.apache.http.conn.HttpHostConnectException: Connect to localhost:8080 [localhost/127.0.0.1] failed: Connection refused (Connection refused)
	at com.frameworkium.core.common.reporting.jira.zapi.AttachmentSpec.Delete Zephyr attachment(AttachmentSpec.groovy:56)
Caused by: java.net.ConnectException: Connection refused (Connection refused)
	at com.frameworkium.core.common.reporting.jira.zapi.AttachmentSpec.Delete Zephyr attachment(AttachmentSpec.groovy:56)

[ERROR] com.frameworkium.core.common.reporting.jira.zapi.AttachmentSpec.Add Zephyr attachment  Time elapsed: 0.004 s  <<< ERROR!
org.apache.http.conn.HttpHostConnectException: Connect to localhost:8080 [localhost/127.0.0.1] failed: Connection refused (Connection refused)
	at com.frameworkium.core.common.reporting.jira.zapi.AttachmentSpec.Add Zephyr attachment(AttachmentSpec.groovy:73)
Caused by: java.net.ConnectException: Connection refused (Connection refused)
	at com.frameworkium.core.common.reporting.jira.zapi.AttachmentSpec.Add Zephyr attachment(AttachmentSpec.groovy:73)

[INFO] Running com.frameworkium.core.common.reporting.jira.zapi.ExecutionSpec
[ERROR] Tests run: 1, Failures: 0, Errors: 1, Skipped: 0, Time elapsed: 0.009 s <<< FAILURE! - in com.frameworkium.core.common.reporting.jira.zapi.ExecutionSpec
[ERROR] com.frameworkium.core.common.reporting.jira.zapi.ExecutionSpec.Add tests to Zephyr execution cycle  Time elapsed: 0.005 s  <<< ERROR!
org.apache.http.conn.HttpHostConnectException: Connect to localhost:8080 [localhost/127.0.0.1] failed: Connection refused (Connection refused)
	at com.frameworkium.core.common.reporting.jira.zapi.ExecutionSpec.Add tests to Zephyr execution cycle(ExecutionSpec.groovy:42)
Caused by: java.net.ConnectException: Connection refused (Connection refused)
	at com.frameworkium.core.common.reporting.jira.zapi.ExecutionSpec.Add tests to Zephyr execution cycle(ExecutionSpec.groovy:42)

[INFO] Running com.frameworkium.core.ui.driver.lifecycle.SingleUseDriverLifecycleSpec
09:04:57.246 [main] ERROR - Failed to quit browser.
[INFO] Tests run: 3, Failures: 0, Errors: 0, Skipped: 0, Time elapsed: 0.19 s - in com.frameworkium.core.ui.driver.lifecycle.SingleUseDriverLifecycleSpec
[INFO] Running com.frameworkium.core.ui.driver.lifecycle.MultiUseDriverLifecycleSpec
09:04:57.302 [main] ERROR - Failed to tear down browser after test method.
09:04:57.309 [main] ERROR - Failed to quit a browser in the pool.
[INFO] Tests run: 7, Failures: 0, Errors: 0, Skipped: 0, Time elapsed: 0.046 s - in com.frameworkium.core.ui.driver.lifecycle.MultiUseDriverLifecycleSpec
[INFO] Running com.frameworkium.core.ui.capture.ElementHighlighterSpec
[INFO] Tests run: 2, Failures: 0, Errors: 0, Skipped: 0, Time elapsed: 0.026 s - in com.frameworkium.core.ui.capture.ElementHighlighterSpec
[INFO] Running com.frameworkium.core.ui.ExtraExpectedConditionsSpec
[INFO] Tests run: 17, Failures: 0, Errors: 0, Skipped: 0, Time elapsed: 0.046 s - in com.frameworkium.core.ui.ExtraExpectedConditionsSpec
[INFO] Running com.frameworkium.core.ui.proxy.SeleniumProxyFactorySpec
09:04:57.419 [main] FATAL - Invalid proxy specified, acceptable values are: system, autodetect, direct or http://{hostname}:{port}.
09:04:57.420 [main] FATAL - Invalid proxy specified, acceptable values are: system, autodetect, direct or http://{hostname}:{port}.
09:04:57.420 [main] FATAL - Invalid proxy specified, acceptable values are: system, autodetect, direct or http://{hostname}:{port}.
09:04:57.428 [main] FATAL - Invalid proxy specified, acceptable values are: system, autodetect, direct or http://{hostname}:{port}.
[INFO] Tests run: 13, Failures: 0, Errors: 0, Skipped: 0, Time elapsed: 0.033 s - in com.frameworkium.core.ui.proxy.SeleniumProxyFactorySpec
[INFO] Running com.frameworkium.core.ui.pages.VisibilitySpec
[INFO] Tests run: 13, Failures: 0, Errors: 0, Skipped: 0, Time elapsed: 0.154 s - in com.frameworkium.core.ui.pages.VisibilitySpec
[INFO] Running com.frameworkium.core.ui.listeners.ScreenshotListenerSpec
09:04:57.644 [main] INFO  - Written screenshot to screenshots/1674723897624_testName.png
[INFO] Tests run: 1, Failures: 0, Errors: 0, Skipped: 0, Time elapsed: 0.06 s - in com.frameworkium.core.ui.listeners.ScreenshotListenerSpec
[INFO] Running com.frameworkium.core.ui.video.VideoCaptureSpec
09:04:57.674 [main] INFO  - Captured video: test1-session1.ext
09:04:57.681 [main] ERROR - Failed fetching URL http://foo/bar/session2.ext.
[INFO] Tests run: 3, Failures: 0, Errors: 0, Skipped: 0, Time elapsed: 0.031 s - in com.frameworkium.core.ui.video.VideoCaptureSpec
[INFO] 
[INFO] Results:
[INFO] 
[ERROR] Errors: 
[ERROR]   IssueLinkSpec.Create link between two JIRA issues:40  HttpHostConnect Connect...
[ERROR]   IssueSpec.Add a comment into JIRA issue:89  HttpHostConnect Connect to localh...
[ERROR]   IssueSpec.Attach a file to a issue:136  HttpHostConnect Connect to localhost:...
[ERROR]   IssueSpec.Edit a field in JIRA issue:64  HttpHostConnect Connect to localhost...
[ERROR]   IssueSpec.Get an Issue:39  HttpHostConnect Connect to localhost:8080 [localho...
[ERROR]   IssueSpec.Perform a transition on an issue :110  HttpHostConnect Connect to l...
[ERROR]   ProjectSpec.Get project from Jira:39  HttpHostConnect Connect to localhost:80...
[ERROR]   ProjectSpec.get project versions from Jira:58  HttpHostConnect Connect to loc...
[ERROR]   SearchSpec.Getting keys from JQL JIRA search:36  HttpHostConnect Connect to l...
[ERROR]   VersionSpec.Create Jira project version:64  HttpHostConnect Connect to localh...
[ERROR]   VersionSpec.Get Jira project version:43  HttpHostConnect Connect to localhost...
[ERROR]   AttachmentSpec.Add Zephyr attachment:73  HttpHostConnect Connect to localhost...
[ERROR]   AttachmentSpec.Delete Zephyr attachment:56  HttpHostConnect Connect to localh...
[ERROR]   AttachmentSpec.Get Zephyr attachment by entity:38  HttpHostConnect Connect to...
[ERROR]   CycleSpec.Create new Zephyr cycle:69  HttpHostConnect Connect to localhost:80...
[ERROR]   CycleSpec.Get list of Zephyr cycles:44  HttpHostConnect Connect to localhost:...
[ERROR]   ExecutionSearchSpec.Search Zephyr for execution:38  HttpHostConnect Connect t...
[ERROR]   ExecutionSpec.Add tests to Zephyr execution cycle:42  HttpHostConnect Connect...
[INFO] 
[ERROR] Tests run: 105, Failures: 0, Errors: 18, Skipped: 2
[INFO] 
[INFO] ------------------------------------------------------------------------
[INFO] BUILD FAILURE
[INFO] ------------------------------------------------------------------------
[INFO] Total time:  16.308 s
[INFO] Finished at: 2023-01-26T09:04:57Z
[INFO] ------------------------------------------------------------------------
[ERROR] Failed to execute goal org.apache.maven.plugins:maven-surefire-plugin:3.0.0-M5:test (default-test) on project frameworkium-core: There are test failures.
[ERROR] 
[ERROR] Please refer to /home/gabsko/breaking-updates/target/surefire-reports for the individual test results.
[ERROR] Please refer to dump files (if any exist) [date].dump, [date]-jvmRun[N].dump and [date].dumpstream.
[ERROR] -> [Help 1]
[ERROR] 
[ERROR] To see the full stack trace of the errors, re-run Maven with the -e switch.
[ERROR] Re-run Maven using the -X switch to enable full debug logging.
[ERROR] 
[ERROR] For more information about the errors and possible solutions, please read the following articles:
[ERROR] [Help 1] http://cwiki.apache.org/confluence/display/MAVEN/MojoFailureException
