[INFO] Scanning for projects...
[INFO] ------------------------------------------------------------------------
[INFO] Reactor Build Order:
[INFO] 
[INFO] trino-cloud                                                        [pom]
[INFO] trino-cloud-aws                                           [trino-plugin]
[INFO] 
[INFO] -----------------------< pl.net.was:trino-cloud >-----------------------
[INFO] Building trino-cloud 0.9-SNAPSHOT                                  [1/2]
[INFO] --------------------------------[ pom ]---------------------------------
[INFO] Downloading from central: https://repo.maven.apache.org/maven2/org/basepom/maven/duplicate-finder-maven-plugin/1.5.0/duplicate-finder-maven-plugin-1.5.0.pom
[INFO] Downloaded from central: https://repo.maven.apache.org/maven2/org/basepom/maven/duplicate-finder-maven-plugin/1.5.0/duplicate-finder-maven-plugin-1.5.0.pom (17 kB at 58 kB/s)
[INFO] Downloading from central: https://repo.maven.apache.org/maven2/org/basepom/basepom-oss/33/basepom-oss-33.pom
[INFO] Downloaded from central: https://repo.maven.apache.org/maven2/org/basepom/basepom-oss/33/basepom-oss-33.pom (9.2 kB at 87 kB/s)
[INFO] Downloading from central: https://repo.maven.apache.org/maven2/org/basepom/basepom-minimal/33/basepom-minimal-33.pom
[INFO] Downloaded from central: https://repo.maven.apache.org/maven2/org/basepom/basepom-minimal/33/basepom-minimal-33.pom (16 kB at 989 kB/s)
[INFO] Downloading from central: https://repo.maven.apache.org/maven2/org/basepom/basepom-foundation/33/basepom-foundation-33.pom
[INFO] Downloaded from central: https://repo.maven.apache.org/maven2/org/basepom/basepom-foundation/33/basepom-foundation-33.pom (53 kB at 450 kB/s)
[INFO] Downloading from central: https://repo.maven.apache.org/maven2/org/basepom/maven/duplicate-finder-maven-plugin/1.5.0/duplicate-finder-maven-plugin-1.5.0.jar
[INFO] Downloaded from central: https://repo.maven.apache.org/maven2/org/basepom/maven/duplicate-finder-maven-plugin/1.5.0/duplicate-finder-maven-plugin-1.5.0.jar (72 kB at 4.8 MB/s)
[INFO] 
[INFO] --- maven-clean-plugin:3.0.0:clean (default-clean) @ trino-cloud ---
[INFO] Deleting /home/gabsko/breaking-updates/target
[INFO] 
[INFO] --- maven-enforcer-plugin:3.0.0-M3:enforce (default) @ trino-cloud ---
[INFO] 
[INFO] --- dependency-scope-maven-plugin:0.10:check (default) @ trino-cloud ---
[INFO] No test dependency scope issues found
[INFO] 
[INFO] --- license-maven-plugin:3.0:check (default) @ trino-cloud ---
[INFO] Checking licenses...
[INFO] 
[INFO] --- maven-checkstyle-plugin:3.1.2:check (checkstyle) @ trino-cloud ---
[INFO] You have 0 Checkstyle violations.
[INFO] 
[INFO] --- jacoco-maven-plugin:0.8.6:prepare-agent (default) @ trino-cloud ---
[INFO] Skipping JaCoCo execution because property jacoco.skip is set.
[INFO] argLine set to empty
[INFO] 
[INFO] --- git-commit-id-plugin:4.0.3:revision (default) @ trino-cloud ---
[INFO] 
[INFO] --- maven-dependency-plugin:3.1.2:analyze-only (default) @ trino-cloud ---
[INFO] Downloading from central: https://repo.maven.apache.org/maven2/org/apache/maven/shared/maven-dependency-analyzer/1.11.3/maven-dependency-analyzer-1.11.3.pom
[INFO] Downloaded from central: https://repo.maven.apache.org/maven2/org/apache/maven/shared/maven-dependency-analyzer/1.11.3/maven-dependency-analyzer-1.11.3.pom (6.8 kB at 679 kB/s)
[INFO] Downloading from central: https://repo.maven.apache.org/maven2/org/apache/maven/shared/maven-dependency-analyzer/1.11.3/maven-dependency-analyzer-1.11.3.jar
[INFO] Downloaded from central: https://repo.maven.apache.org/maven2/org/apache/maven/shared/maven-dependency-analyzer/1.11.3/maven-dependency-analyzer-1.11.3.jar (36 kB at 4.0 MB/s)
[INFO] Skipping pom project
[INFO] 
[INFO] --- maven-dependency-plugin:3.1.2:analyze-duplicate (default) @ trino-cloud ---
[INFO] No duplicate dependencies found in <dependencies/> or in <dependencyManagement/>
[INFO] 
[INFO] --- duplicate-finder-maven-plugin:1.5.0:check (default) @ trino-cloud ---
[INFO] Downloading from central: https://repo.maven.apache.org/maven2/org/slf4j/slf4j-log4j12/1.7.28/slf4j-log4j12-1.7.28.pom
[INFO] Downloaded from central: https://repo.maven.apache.org/maven2/org/slf4j/slf4j-log4j12/1.7.28/slf4j-log4j12-1.7.28.pom (1.1 kB at 162 kB/s)
[INFO] Downloading from central: https://repo.maven.apache.org/maven2/com/fasterxml/staxmate/staxmate/2.2.1/staxmate-2.2.1.pom
[INFO] Downloaded from central: https://repo.maven.apache.org/maven2/com/fasterxml/staxmate/staxmate/2.2.1/staxmate-2.2.1.pom (7.8 kB at 978 kB/s)
[INFO] Downloading from central: https://repo.maven.apache.org/maven2/org/codehaus/woodstox/stax2-api/3.1.1/stax2-api-3.1.1.pom
[INFO] Downloaded from central: https://repo.maven.apache.org/maven2/org/codehaus/woodstox/stax2-api/3.1.1/stax2-api-3.1.1.pom (1.4 kB at 236 kB/s)
[INFO] Downloading from central: https://repo.maven.apache.org/maven2/com/pyx4j/maven-plugin-log4j/1.0.1/maven-plugin-log4j-1.0.1.pom
[INFO] Downloaded from central: https://repo.maven.apache.org/maven2/com/pyx4j/maven-plugin-log4j/1.0.1/maven-plugin-log4j-1.0.1.pom (1.3 kB at 159 kB/s)
[INFO] Downloading from central: https://repo.maven.apache.org/maven2/com/pyx4j/pyx4j-maven-plugins/1.0.1/pyx4j-maven-plugins-1.0.1.pom
[INFO] Downloaded from central: https://repo.maven.apache.org/maven2/com/pyx4j/pyx4j-maven-plugins/1.0.1/pyx4j-maven-plugins-1.0.1.pom (1.8 kB at 231 kB/s)
[INFO] Downloading from central: https://repo.maven.apache.org/maven2/com/pyx4j/pyx4j/1.0.1/pyx4j-1.0.1.pom
[INFO] Downloaded from central: https://repo.maven.apache.org/maven2/com/pyx4j/pyx4j/1.0.1/pyx4j-1.0.1.pom (14 kB at 1.4 MB/s)
[INFO] Downloading from central: https://repo.maven.apache.org/maven2/log4j/log4j/1.2.14/log4j-1.2.14.pom
[INFO] Downloaded from central: https://repo.maven.apache.org/maven2/log4j/log4j/1.2.14/log4j-1.2.14.pom (2.4 kB at 264 kB/s)
[INFO] Downloading from central: https://repo.maven.apache.org/maven2/org/apache/maven/maven-artifact/2.0/maven-artifact-2.0.pom
[INFO] Downloaded from central: https://repo.maven.apache.org/maven2/org/apache/maven/maven-artifact/2.0/maven-artifact-2.0.pom (723 B at 43 kB/s)
[INFO] Downloading from central: https://repo.maven.apache.org/maven2/com/google/guava/guava/28.1-jre/guava-28.1-jre.jar
[INFO] Downloading from central: https://repo.maven.apache.org/maven2/org/codehaus/mojo/animal-sniffer-annotations/1.18/animal-sniffer-annotations-1.18.jar
[INFO] Downloading from central: https://repo.maven.apache.org/maven2/org/slf4j/slf4j-log4j12/1.7.28/slf4j-log4j12-1.7.28.jar
[INFO] Downloading from central: https://repo.maven.apache.org/maven2/com/fasterxml/staxmate/staxmate/2.2.1/staxmate-2.2.1.jar
[INFO] Downloading from central: https://repo.maven.apache.org/maven2/com/pyx4j/maven-plugin-log4j/1.0.1/maven-plugin-log4j-1.0.1.jar
[INFO] Downloaded from central: https://repo.maven.apache.org/maven2/org/codehaus/mojo/animal-sniffer-annotations/1.18/animal-sniffer-annotations-1.18.jar (3.5 kB at 150 kB/s)
[INFO] Downloaded from central: https://repo.maven.apache.org/maven2/com/pyx4j/maven-plugin-log4j/1.0.1/maven-plugin-log4j-1.0.1.jar (3.7 kB at 169 kB/s)
[INFO] Downloaded from central: https://repo.maven.apache.org/maven2/org/slf4j/slf4j-log4j12/1.7.28/slf4j-log4j12-1.7.28.jar (12 kB at 509 kB/s)
[INFO] Downloaded from central: https://repo.maven.apache.org/maven2/com/fasterxml/staxmate/staxmate/2.2.1/staxmate-2.2.1.jar (83 kB at 2.5 MB/s)
[INFO] Downloaded from central: https://repo.maven.apache.org/maven2/com/google/guava/guava/28.1-jre/guava-28.1-jre.jar (2.8 MB at 23 MB/s)
[INFO] Ignoring POM project!
[INFO] 
[INFO] --- modernizer-maven-plugin:2.2.0:modernizer (modernizer) @ trino-cloud ---
[INFO] Downloading from central: https://repo.maven.apache.org/maven2/org/ow2/asm/asm-commons/9.0/asm-commons-9.0.pom
[INFO] Downloaded from central: https://repo.maven.apache.org/maven2/org/ow2/asm/asm-commons/9.0/asm-commons-9.0.pom (3.3 kB at 663 kB/s)
[INFO] Downloading from central: https://repo.maven.apache.org/maven2/org/gaul/modernizer-maven-annotations/2.2.0/modernizer-maven-annotations-2.2.0.pom
[INFO] Downloaded from central: https://repo.maven.apache.org/maven2/org/gaul/modernizer-maven-annotations/2.2.0/modernizer-maven-annotations-2.2.0.pom (2.0 kB at 281 kB/s)
[INFO] Downloading from central: https://repo.maven.apache.org/maven2/org/ow2/asm/asm-commons/9.0/asm-commons-9.0.jar
[INFO] Downloading from central: https://repo.maven.apache.org/maven2/org/gaul/modernizer-maven-annotations/2.2.0/modernizer-maven-annotations-2.2.0.jar
[INFO] Downloaded from central: https://repo.maven.apache.org/maven2/org/gaul/modernizer-maven-annotations/2.2.0/modernizer-maven-annotations-2.2.0.jar (3.2 kB at 265 kB/s)
[INFO] Downloaded from central: https://repo.maven.apache.org/maven2/org/ow2/asm/asm-commons/9.0/asm-commons-9.0.jar (72 kB at 4.2 MB/s)
[INFO] Skipping modernizer execution!
[INFO] 
[INFO] ---------------------< pl.net.was:trino-cloud-aws >---------------------
[INFO] Building trino-cloud-aws 0.9-SNAPSHOT                              [2/2]
[INFO] ----------------------------[ trino-plugin ]----------------------------
[INFO] 
[INFO] --- maven-clean-plugin:3.0.0:clean (default-clean) @ trino-cloud-aws ---
[INFO] Deleting /home/gabsko/breaking-updates/trino-cloud-aws/target
[INFO] 
[INFO] --- trino-maven-plugin:11:check-spi-dependencies (default-check-spi-dependencies) @ trino-cloud-aws ---
[INFO] 
[INFO] --- maven-enforcer-plugin:3.0.0-M3:enforce (default) @ trino-cloud-aws ---
[INFO] 
[INFO] --- dependency-scope-maven-plugin:0.10:check (default) @ trino-cloud-aws ---
[INFO] No test dependency scope issues found
[INFO] 
[INFO] --- license-maven-plugin:3.0:check (default) @ trino-cloud-aws ---
[INFO] Checking licenses...
[INFO] 
[INFO] --- maven-checkstyle-plugin:3.1.2:check (checkstyle) @ trino-cloud-aws ---
[INFO] You have 0 Checkstyle violations.
[INFO] 
[INFO] --- jacoco-maven-plugin:0.8.6:prepare-agent (default) @ trino-cloud-aws ---
[INFO] Skipping JaCoCo execution because property jacoco.skip is set.
[INFO] argLine set to empty
[INFO] 
[INFO] --- git-commit-id-plugin:4.0.3:revision (default) @ trino-cloud-aws ---
[INFO] 
[INFO] --- maven-resources-plugin:3.2.0:resources (default-resources) @ trino-cloud-aws ---
[INFO] Using 'UTF-8' encoding to copy filtered resources.
[INFO] Using 'UTF-8' encoding to copy filtered properties files.
[INFO] skip non existing resourceDirectory /home/gabsko/breaking-updates/trino-cloud-aws/src/main/resources
[INFO] 
[INFO] --- maven-compiler-plugin:3.8.1:compile (default-compile) @ trino-cloud-aws ---
[INFO] Changes detected - recompiling the module!
[INFO] Compiling 24 source files to /home/gabsko/breaking-updates/trino-cloud-aws/target/classes
[INFO] /home/gabsko/breaking-updates/trino-cloud-aws/src/main/java/pl/net/was/cloud/aws/AwsRecordSetProvider.java: /home/gabsko/breaking-updates/trino-cloud-aws/src/main/java/pl/net/was/cloud/aws/AwsRecordSetProvider.java uses unchecked or unsafe operations.
[INFO] /home/gabsko/breaking-updates/trino-cloud-aws/src/main/java/pl/net/was/cloud/aws/AwsRecordSetProvider.java: Recompile with -Xlint:unchecked for details.
[INFO] 
[INFO] --- trino-maven-plugin:11:generate-service-descriptor (default-generate-service-descriptor) @ trino-cloud-aws ---
[INFO] Wrote pl.net.was.cloud.aws.AwsPlugin to /home/gabsko/breaking-updates/trino-cloud-aws/target/trino-cloud-aws-0.9-SNAPSHOT-services.jar
[INFO] 
[INFO] --- maven-resources-plugin:3.2.0:testResources (default-testResources) @ trino-cloud-aws ---
[INFO] Using 'UTF-8' encoding to copy filtered resources.
[INFO] Using 'UTF-8' encoding to copy filtered properties files.
[INFO] skip non existing resourceDirectory /home/gabsko/breaking-updates/trino-cloud-aws/src/test/resources
[INFO] 
[INFO] --- maven-compiler-plugin:3.8.1:testCompile (default-testCompile) @ trino-cloud-aws ---
[INFO] Changes detected - recompiling the module!
[INFO] Compiling 2 source files to /home/gabsko/breaking-updates/trino-cloud-aws/target/test-classes
[INFO] 
[INFO] --- maven-dependency-plugin:3.1.2:analyze-only (default) @ trino-cloud-aws ---
[INFO] No dependency problems found
[INFO] 
[INFO] --- maven-dependency-plugin:3.1.2:analyze-duplicate (default) @ trino-cloud-aws ---
[INFO] No duplicate dependencies found in <dependencies/> or in <dependencyManagement/>
[INFO] 
[INFO] --- duplicate-finder-maven-plugin:1.5.0:check (default) @ trino-cloud-aws ---
[INFO] Checking compile classpath
[INFO] Checking runtime classpath
[INFO] Checking test classpath
[INFO] 
[INFO] --- modernizer-maven-plugin:2.2.0:modernizer (modernizer) @ trino-cloud-aws ---
[INFO] Skipping modernizer execution!
[INFO] 
[INFO] --- maven-surefire-plugin:3.0.0-M5:test (default-test) @ trino-cloud-aws ---
[INFO] Downloading from central: https://repo.maven.apache.org/maven2/org/apache/maven/surefire/surefire-testng/3.0.0-M5/surefire-testng-3.0.0-M5.pom
[INFO] Downloaded from central: https://repo.maven.apache.org/maven2/org/apache/maven/surefire/surefire-testng/3.0.0-M5/surefire-testng-3.0.0-M5.pom (4.1 kB at 294 kB/s)
[INFO] Downloading from central: https://repo.maven.apache.org/maven2/org/apache/maven/surefire/surefire-testng-utils/3.0.0-M5/surefire-testng-utils-3.0.0-M5.pom
[INFO] Downloaded from central: https://repo.maven.apache.org/maven2/org/apache/maven/surefire/surefire-testng-utils/3.0.0-M5/surefire-testng-utils-3.0.0-M5.pom (3.0 kB at 500 kB/s)
[INFO] Downloading from central: https://repo.maven.apache.org/maven2/org/apache/maven/surefire/surefire-grouper/3.0.0-M5/surefire-grouper-3.0.0-M5.pom
[INFO] Downloaded from central: https://repo.maven.apache.org/maven2/org/apache/maven/surefire/surefire-grouper/3.0.0-M5/surefire-grouper-3.0.0-M5.pom (3.1 kB at 445 kB/s)
[INFO] Downloading from central: https://repo.maven.apache.org/maven2/org/junit/jupiter/junit-jupiter-engine/5.8.0-M1/junit-jupiter-engine-5.8.0-M1.jar
[INFO] Downloading from central: https://repo.maven.apache.org/maven2/org/apiguardian/apiguardian-api/1.1.1/apiguardian-api-1.1.1.jar
[INFO] Downloading from central: https://repo.maven.apache.org/maven2/org/junit/platform/junit-platform-engine/1.8.0-M1/junit-platform-engine-1.8.0-M1.jar
[INFO] Downloading from central: https://repo.maven.apache.org/maven2/org/junit/platform/junit-platform-commons/1.8.0-M1/junit-platform-commons-1.8.0-M1.jar
[INFO] Downloading from central: https://repo.maven.apache.org/maven2/org/junit/jupiter/junit-jupiter-api/5.8.0-M1/junit-jupiter-api-5.8.0-M1.jar
[INFO] Downloaded from central: https://repo.maven.apache.org/maven2/org/apiguardian/apiguardian-api/1.1.1/apiguardian-api-1.1.1.jar (6.5 kB at 645 kB/s)
[INFO] Downloading from central: https://repo.maven.apache.org/maven2/org/jetbrains/kotlin/kotlin-stdlib-jdk8/1.4.20/kotlin-stdlib-jdk8-1.4.20.jar
[INFO] Downloaded from central: https://repo.maven.apache.org/maven2/org/jetbrains/kotlin/kotlin-stdlib-jdk8/1.4.20/kotlin-stdlib-jdk8-1.4.20.jar (16 kB at 902 kB/s)
[INFO] Downloading from central: https://repo.maven.apache.org/maven2/org/jetbrains/kotlin/kotlin-stdlib/1.4.20/kotlin-stdlib-1.4.20.jar
[INFO] Downloaded from central: https://repo.maven.apache.org/maven2/org/junit/platform/junit-platform-commons/1.8.0-M1/junit-platform-commons-1.8.0-M1.jar (101 kB at 4.8 MB/s)
[INFO] Downloading from central: https://repo.maven.apache.org/maven2/org/jetbrains/kotlin/kotlin-stdlib-common/1.4.20/kotlin-stdlib-common-1.4.20.jar
[INFO] Downloaded from central: https://repo.maven.apache.org/maven2/org/junit/jupiter/junit-jupiter-engine/5.8.0-M1/junit-jupiter-engine-5.8.0-M1.jar (222 kB at 10 MB/s)
[INFO] Downloaded from central: https://repo.maven.apache.org/maven2/org/junit/jupiter/junit-jupiter-api/5.8.0-M1/junit-jupiter-api-5.8.0-M1.jar (188 kB at 8.5 MB/s)
[INFO] Downloading from central: https://repo.maven.apache.org/maven2/org/jetbrains/kotlin/kotlin-stdlib-jdk7/1.4.20/kotlin-stdlib-jdk7-1.4.20.jar
[INFO] Downloading from central: https://repo.maven.apache.org/maven2/org/apache/maven/surefire/surefire-testng/3.0.0-M5/surefire-testng-3.0.0-M5.jar
[INFO] Downloaded from central: https://repo.maven.apache.org/maven2/org/junit/platform/junit-platform-engine/1.8.0-M1/junit-platform-engine-1.8.0-M1.jar (185 kB at 8.4 MB/s)
[INFO] Downloading from central: https://repo.maven.apache.org/maven2/org/apache/maven/surefire/surefire-testng-utils/3.0.0-M5/surefire-testng-utils-3.0.0-M5.jar
[INFO] Downloaded from central: https://repo.maven.apache.org/maven2/org/apache/maven/surefire/surefire-testng/3.0.0-M5/surefire-testng-3.0.0-M5.jar (44 kB at 1.5 MB/s)
[INFO] Downloading from central: https://repo.maven.apache.org/maven2/org/apache/maven/surefire/surefire-grouper/3.0.0-M5/surefire-grouper-3.0.0-M5.jar
[INFO] Downloaded from central: https://repo.maven.apache.org/maven2/org/apache/maven/surefire/surefire-testng-utils/3.0.0-M5/surefire-testng-utils-3.0.0-M5.jar (14 kB at 437 kB/s)
[INFO] Downloaded from central: https://repo.maven.apache.org/maven2/org/jetbrains/kotlin/kotlin-stdlib-common/1.4.20/kotlin-stdlib-common-1.4.20.jar (191 kB at 5.6 MB/s)
[INFO] Downloaded from central: https://repo.maven.apache.org/maven2/org/jetbrains/kotlin/kotlin-stdlib-jdk7/1.4.20/kotlin-stdlib-jdk7-1.4.20.jar (22 kB at 621 kB/s)
[INFO] Downloaded from central: https://repo.maven.apache.org/maven2/org/apache/maven/surefire/surefire-grouper/3.0.0-M5/surefire-grouper-3.0.0-M5.jar (40 kB at 843 kB/s)
[INFO] Downloaded from central: https://repo.maven.apache.org/maven2/org/jetbrains/kotlin/kotlin-stdlib/1.4.20/kotlin-stdlib-1.4.20.jar (1.5 MB at 18 MB/s)
[INFO] Downloading from central: https://repo.maven.apache.org/maven2/org/junit/platform/junit-platform-launcher/1.8.0-M1/junit-platform-launcher-1.8.0-M1.jar
[INFO] Downloaded from central: https://repo.maven.apache.org/maven2/org/junit/platform/junit-platform-launcher/1.8.0-M1/junit-platform-launcher-1.8.0-M1.jar (154 kB at 11 MB/s)
[INFO] Downloading from central: https://repo.maven.apache.org/maven2/org/junit/platform/junit-platform-launcher/1.8.0-M1/junit-platform-launcher-1.8.0-M1.pom
[INFO] Downloaded from central: https://repo.maven.apache.org/maven2/org/junit/platform/junit-platform-launcher/1.8.0-M1/junit-platform-launcher-1.8.0-M1.pom (3.0 kB at 607 kB/s)
[INFO] 
[INFO] -------------------------------------------------------
[INFO]  T E S T S
[INFO] -------------------------------------------------------
[INFO] 
[INFO] Results:
[INFO] 
[INFO] Tests run: 0, Failures: 0, Errors: 0, Skipped: 0
[INFO] 
[INFO] Downloading from central: https://repo.maven.apache.org/maven2/org/testng/testng/5.10/testng-5.10.pom
[INFO] Downloaded from central: https://repo.maven.apache.org/maven2/org/testng/testng/5.10/testng-5.10.pom (2.1 kB at 352 kB/s)
[INFO] 
[INFO] -------------------------------------------------------
[INFO]  T E S T S
[INFO] -------------------------------------------------------
[INFO] Running pl.net.was.cloud.aws.TestAwsQueries
2023-02-07T11:08:40.757+0000 INFO LogTestDurationListener enabled: false
2023-02-07T11:08:42.219+0000 INFO jetty-9.4.42.v20210604; built: 2021-06-04T17:33:38.939Z; git: 5cd5e6d2375eeab146813b0de9f19eda6ab6e6cb; jvm 11.0.17+8-post-Ubuntu-1ubuntu218.04
2023-02-07T11:08:42.438+0000 WARNING A provider io.airlift.discovery.server.DynamicAnnouncementResource registered in SERVER runtime does not implement any provider interfaces applicable in the SERVER runtime. Due to constraint configuration problems the provider io.airlift.discovery.server.DynamicAnnouncementResource will be ignored. 
2023-02-07T11:08:42.438+0000 WARNING A provider io.airlift.discovery.store.StoreResource registered in SERVER runtime does not implement any provider interfaces applicable in the SERVER runtime. Due to constraint configuration problems the provider io.airlift.discovery.store.StoreResource will be ignored. 
2023-02-07T11:08:42.439+0000 WARNING A provider io.airlift.discovery.server.ServiceResource registered in SERVER runtime does not implement any provider interfaces applicable in the SERVER runtime. Due to constraint configuration problems the provider io.airlift.discovery.server.ServiceResource will be ignored. 
2023-02-07T11:08:42.565+0000 INFO Started o.e.j.s.ServletContextHandler@47044f7d{/,null,AVAILABLE,@http}
2023-02-07T11:08:42.580+0000 INFO Started http@656922a0{HTTP/1.1, (http/1.1, h2c)}{127.0.0.1:44079}
2023-02-07T11:08:42.581+0000 INFO Started @2160ms
2023-02-07T11:08:42.717+0000 INFO Life cycle starting...
2023-02-07T11:08:42.718+0000 INFO Life cycle startup complete
2023-02-07T11:08:42.719+0000 INFO Created TestingDiscoveryServer in 1.67s
2023-02-07T11:08:44.839+0000 INFO jetty-9.4.42.v20210604; built: 2021-06-04T17:33:38.939Z; git: 5cd5e6d2375eeab146813b0de9f19eda6ab6e6cb; jvm 11.0.17+8-post-Ubuntu-1ubuntu218.04
2023-02-07T11:08:44.890+0000 WARNING A provider io.trino.server.NodeResource registered in SERVER runtime does not implement any provider interfaces applicable in the SERVER runtime. Due to constraint configuration problems the provider io.trino.server.NodeResource will be ignored. 
2023-02-07T11:08:44.890+0000 WARNING A provider io.trino.server.QueryResource registered in SERVER runtime does not implement any provider interfaces applicable in the SERVER runtime. Due to constraint configuration problems the provider io.trino.server.QueryResource will be ignored. 
2023-02-07T11:08:44.891+0000 WARNING A provider io.trino.server.TaskExecutorResource registered in SERVER runtime does not implement any provider interfaces applicable in the SERVER runtime. Due to constraint configuration problems the provider io.trino.server.TaskExecutorResource will be ignored. 
2023-02-07T11:08:44.891+0000 WARNING A provider io.trino.server.ServerInfoResource registered in SERVER runtime does not implement any provider interfaces applicable in the SERVER runtime. Due to constraint configuration problems the provider io.trino.server.ServerInfoResource will be ignored. 
2023-02-07T11:08:44.891+0000 WARNING A provider io.trino.memory.MemoryResource registered in SERVER runtime does not implement any provider interfaces applicable in the SERVER runtime. Due to constraint configuration problems the provider io.trino.memory.MemoryResource will be ignored. 
2023-02-07T11:08:44.891+0000 WARNING A provider io.trino.server.protocol.ExecutingStatementResource registered in SERVER runtime does not implement any provider interfaces applicable in the SERVER runtime. Due to constraint configuration problems the provider io.trino.server.protocol.ExecutingStatementResource will be ignored. 
2023-02-07T11:08:44.891+0000 WARNING A provider io.trino.server.ResourceGroupStateInfoResource registered in SERVER runtime does not implement any provider interfaces applicable in the SERVER runtime. Due to constraint configuration problems the provider io.trino.server.ResourceGroupStateInfoResource will be ignored. 
2023-02-07T11:08:44.892+0000 WARNING A provider io.trino.server.ThreadResource registered in SERVER runtime does not implement any provider interfaces applicable in the SERVER runtime. Due to constraint configuration problems the provider io.trino.server.ThreadResource will be ignored. 
2023-02-07T11:08:44.892+0000 WARNING A provider io.trino.server.ui.WorkerResource registered in SERVER runtime does not implement any provider interfaces applicable in the SERVER runtime. Due to constraint configuration problems the provider io.trino.server.ui.WorkerResource will be ignored. 
2023-02-07T11:08:44.892+0000 WARNING A provider io.trino.server.ui.WebUiStaticResource registered in SERVER runtime does not implement any provider interfaces applicable in the SERVER runtime. Due to constraint configuration problems the provider io.trino.server.ui.WebUiStaticResource will be ignored. 
2023-02-07T11:08:44.892+0000 WARNING A provider io.trino.server.StatusResource registered in SERVER runtime does not implement any provider interfaces applicable in the SERVER runtime. Due to constraint configuration problems the provider io.trino.server.StatusResource will be ignored. 
2023-02-07T11:08:44.892+0000 WARNING A provider io.trino.server.QueryStateInfoResource registered in SERVER runtime does not implement any provider interfaces applicable in the SERVER runtime. Due to constraint configuration problems the provider io.trino.server.QueryStateInfoResource will be ignored. 
2023-02-07T11:08:44.893+0000 WARNING A provider io.trino.server.ui.UiQueryResource registered in SERVER runtime does not implement any provider interfaces applicable in the SERVER runtime. Due to constraint configuration problems the provider io.trino.server.ui.UiQueryResource will be ignored. 
2023-02-07T11:08:44.893+0000 WARNING A provider io.trino.dispatcher.QueuedStatementResource registered in SERVER runtime does not implement any provider interfaces applicable in the SERVER runtime. Due to constraint configuration problems the provider io.trino.dispatcher.QueuedStatementResource will be ignored. 
2023-02-07T11:08:44.893+0000 WARNING A provider io.trino.server.ui.ClusterResource registered in SERVER runtime does not implement any provider interfaces applicable in the SERVER runtime. Due to constraint configuration problems the provider io.trino.server.ui.ClusterResource will be ignored. 
2023-02-07T11:08:44.893+0000 WARNING A provider io.trino.server.ui.ClusterStatsResource registered in SERVER runtime does not implement any provider interfaces applicable in the SERVER runtime. Due to constraint configuration problems the provider io.trino.server.ui.ClusterStatsResource will be ignored. 
2023-02-07T11:08:44.893+0000 WARNING A provider io.trino.server.TaskResource registered in SERVER runtime does not implement any provider interfaces applicable in the SERVER runtime. Due to constraint configuration problems the provider io.trino.server.TaskResource will be ignored. 
2023-02-07T11:08:45.008+0000 WARNING The following warnings have been detected: WARNING: The (sub)resource method getRoot in io.trino.server.ui.WebUiStaticResource contains empty path annotation.
WARNING: Parameter 2 of type io.trino.execution.resourcegroups.ResourceGroupManager<?> from public io.trino.server.QueryStateInfoResource(io.trino.dispatcher.DispatchManager,io.trino.execution.resourcegroups.ResourceGroupManager<?>,io.trino.security.AccessControl,io.trino.spi.security.GroupProvider,io.trino.server.ProtocolConfig) is not resolvable to a concrete type.
WARNING: Parameter 2 of type io.trino.execution.resourcegroups.ResourceGroupManager<?> from public io.trino.server.QueryStateInfoResource(io.trino.dispatcher.DispatchManager,io.trino.execution.resourcegroups.ResourceGroupManager<?>,io.trino.security.AccessControl,io.trino.spi.security.GroupProvider,io.trino.server.ProtocolConfig) is not resolvable to a concrete type.
WARNING: Parameter 1 of type io.trino.execution.resourcegroups.ResourceGroupManager<?> from public io.trino.server.ResourceGroupStateInfoResource(io.trino.execution.resourcegroups.ResourceGroupManager<?>) is not resolvable to a concrete type.

2023-02-07T11:08:45.009+0000 INFO Started o.e.j.s.ServletContextHandler@76641439{/,null,AVAILABLE,@http}
2023-02-07T11:08:45.018+0000 INFO Started http@13868c41{HTTP/1.1, (http/1.1, h2c)}{127.0.0.1:8082}
2023-02-07T11:08:45.019+0000 INFO Started @4599ms
2023-02-07T11:08:45.281+0000 INFO Life cycle starting...
2023-02-07T11:08:45.281+0000 INFO Life cycle startup complete
2023-02-07T11:08:45.360+0000 INFO Created coordinator TestingTrinoServer in 2.64s: http://127.0.0.1:8082
2023-02-07T11:08:45.424+0000 INFO Announced servers in 6.97ms
2023-02-07T11:08:45.449+0000 INFO Added functions in 24.58ms
2023-02-07T11:08:45.450+0000 INFO Registering connector aws
2023-02-07T11:08:45.451+0000 INFO Installed plugin AwsPlugin in 1.77ms
2023-02-07T11:08:45.472+0000 INFO PROPERTY  DEFAULT  RUNTIME  DESCRIPTION
2023-02-07T11:08:45.472+0000 INFO region    ----
[ERROR] Tests run: 4, Failures: 1, Errors: 0, Skipped: 3, Time elapsed: 5.321 s <<< FAILURE! - in pl.net.was.cloud.aws.TestAwsQueries
[ERROR] pl.net.was.cloud.aws.TestAwsQueries.init  Time elapsed: 5.11 s  <<< FAILURE!
com.google.inject.CreationException: 
Unable to create injector, see the following errors:

1) [Guice/ErrorInCustomProvider]: IllegalArgumentException: region must not be blank or empty.
  while locating AwsModule$Ec2ClientProvider
  at AwsRecordSetProvider.<init>(AwsRecordSetProvider.java:82)
      \_ for 2nd parameter ec2
  at AwsModule.configure(AwsModule.java:53)
  at AwsPageSourceProvider.<init>(AwsPageSourceProvider.java:69)
      \_ for 1st parameter recordSetProvider
  at AwsModule.configure(AwsModule.java:54)
  at AwsConnector.<init>(AwsConnector.java:47)
      \_ for 4th parameter pageSourceProvider
  at AwsModule.configure(AwsModule.java:50)
  while locating AwsConnector

Learn more:
  https://github.com/google/guice/wiki/ERROR_IN_CUSTOM_PROVIDER
Caused by: IllegalArgumentException: region must not be blank or empty.
	at Validate.paramNotBlank(Validate.java:180)
	at Region.of(Region.java:136)
	at Region.of(Region.java:132)
	at AwsModule$Ec2ClientProvider.get(AwsModule.java:78)
	at AwsModule$Ec2ClientProvider.get(AwsModule.java:62)
	at ProviderInternalFactory.provision(ProviderInternalFactory.java:86)
	at BoundProviderFactory.provision(BoundProviderFactory.java:72)
	at ProviderInternalFactory$1.call(ProviderInternalFactory.java:67)
	at ProvisionListenerStackCallback$Provision.provision(ProvisionListenerStackCallback.java:109)
	at LifeCycleModule.provision(LifeCycleModule.java:54)
	at ProvisionListenerStackCallback$Provision.provision(ProvisionListenerStackCallback.java:117)
	at ProvisionListenerStackCallback.provision(ProvisionListenerStackCallback.java:66)
	at ProviderInternalFactory.circularGet(ProviderInternalFactory.java:62)
	at BoundProviderFactory.get(BoundProviderFactory.java:59)
	at SingleParameterInjector.inject(SingleParameterInjector.java:40)
	at SingleParameterInjector.getAll(SingleParameterInjector.java:60)
	at ConstructorInjector.provision(ConstructorInjector.java:113)
	at ConstructorInjector.access$000(ConstructorInjector.java:33)
	at ConstructorInjector$1.call(ConstructorInjector.java:98)
	at ProvisionListenerStackCallback$Provision.provision(ProvisionListenerStackCallback.java:109)
	at LifeCycleModule.provision(LifeCycleModule.java:54)
	at ProvisionListenerStackCallback$Provision.provision(ProvisionListenerStackCallback.java:117)
	at ProvisionListenerStackCallback.provision(ProvisionListenerStackCallback.java:66)
	at ConstructorInjector.construct(ConstructorInjector.java:93)
	at ConstructorBindingImpl$Factory.get(ConstructorBindingImpl.java:296)
	at ProviderToInternalFactoryAdapter.get(ProviderToInternalFactoryAdapter.java:40)
	at SingletonScope$1.get(SingletonScope.java:169)
	at InternalFactoryToProviderAdapter.get(InternalFactoryToProviderAdapter.java:45)
	at SingleParameterInjector.inject(SingleParameterInjector.java:40)
	at SingleParameterInjector.getAll(SingleParameterInjector.java:60)
	at ConstructorInjector.provision(ConstructorInjector.java:113)
	at ConstructorInjector.access$000(ConstructorInjector.java:33)
	at ConstructorInjector$1.call(ConstructorInjector.java:98)
	at ProvisionListenerStackCallback$Provision.provision(ProvisionListenerStackCallback.java:109)
	at LifeCycleModule.provision(LifeCycleModule.java:54)
	at ProvisionListenerStackCallback$Provision.provision(ProvisionListenerStackCallback.java:117)
	at ProvisionListenerStackCallback.provision(ProvisionListenerStackCallback.java:66)
	at ConstructorInjector.construct(ConstructorInjector.java:93)
	at ConstructorBindingImpl$Factory.get(ConstructorBindingImpl.java:296)
	at ProviderToInternalFactoryAdapter.get(ProviderToInternalFactoryAdapter.java:40)
	at SingletonScope$1.get(SingletonScope.java:169)
	at InternalFactoryToProviderAdapter.get(InternalFactoryToProviderAdapter.java:45)
	at SingleParameterInjector.inject(SingleParameterInjector.java:40)
	at SingleParameterInjector.getAll(SingleParameterInjector.java:60)
	at ConstructorInjector.provision(ConstructorInjector.java:113)
	at ConstructorInjector.access$000(ConstructorInjector.java:33)
	at ConstructorInjector$1.call(ConstructorInjector.java:98)
	at ProvisionListenerStackCallback$Provision.provision(ProvisionListenerStackCallback.java:109)
	at LifeCycleModule.provision(LifeCycleModule.java:54)
	at ProvisionListenerStackCallback$Provision.provision(ProvisionListenerStackCallback.java:117)
	at ProvisionListenerStackCallback.provision(ProvisionListenerStackCallback.java:66)
	at ConstructorInjector.construct(ConstructorInjector.java:93)
	at ConstructorBindingImpl$Factory.get(ConstructorBindingImpl.java:296)
	at ProviderToInternalFactoryAdapter.get(ProviderToInternalFactoryAdapter.java:40)
	at SingletonScope$1.get(SingletonScope.java:169)
	at InternalFactoryToProviderAdapter.get(InternalFactoryToProviderAdapter.java:45)
	at InternalInjectorCreator.loadEagerSingletons(InternalInjectorCreator.java:213)
	at InternalInjectorCreator.injectDynamically(InternalInjectorCreator.java:186)
	at InternalInjectorCreator.build(InternalInjectorCreator.java:113)
	at Guice.createInjector(Guice.java:87)
	at Bootstrap.initialize(Bootstrap.java:275)
	at AwsConnectorFactory.create(AwsConnectorFactory.java:64)
	at ConnectorManager.createConnector(ConnectorManager.java:360)
	at ConnectorManager.createCatalog(ConnectorManager.java:215)
	at ConnectorManager.createCatalog(ConnectorManager.java:207)
	at ConnectorManager.createCatalog(ConnectorManager.java:193)
	at TestingTrinoServer.createCatalog(TestingTrinoServer.java:387)
	at DistributedQueryRunner.createCatalog(DistributedQueryRunner.java:403)
	at AwsQueryRunner.createQueryRunner(AwsQueryRunner.java:50)
	at TestAwsQueries.createQueryRunner(TestAwsQueries.java:28)
	at AbstractTestQueryFramework.init(AbstractTestQueryFramework.java:91)
	at java.base/NativeMethodAccessorImpl.invoke0(Native Method)
	at java.base/NativeMethodAccessorImpl.invoke(NativeMethodAccessorImpl.java:62)
	at java.base/DelegatingMethodAccessorImpl.invoke(DelegatingMethodAccessorImpl.java:43)
	at java.base/Method.invoke(Method.java:566)
	at MethodInvocationHelper.invokeMethod(MethodInvocationHelper.java:104)
	at Invoker.invokeConfigurationMethod(Invoker.java:515)
	at Invoker.invokeConfigurations(Invoker.java:217)
	at Invoker.invokeConfigurations(Invoker.java:144)
	at TestMethodWorker.invokeBeforeClassMethods(TestMethodWorker.java:169)
	at TestMethodWorker.run(TestMethodWorker.java:108)
	at TestRunner.privateRun(TestRunner.java:756)
	at TestRunner.run(TestRunner.java:610)
	at SuiteRunner.runTest(SuiteRunner.java:387)
	at SuiteRunner.runSequentially(SuiteRunner.java:382)
	at SuiteRunner.privateRun(SuiteRunner.java:340)
	at SuiteRunner.run(SuiteRunner.java:289)
	at SuiteRunnerWorker.runSuite(SuiteRunnerWorker.java:52)
	at SuiteRunnerWorker.run(SuiteRunnerWorker.java:86)
	at TestNG.runSuitesSequentially(TestNG.java:1293)
	at TestNG.runSuitesLocally(TestNG.java:1218)
	at TestNG.runSuites(TestNG.java:1133)
	at TestNG.run(TestNG.java:1104)
	at TestNGExecutor.run(TestNGExecutor.java:136)
	at TestNGDirectoryTestSuite.executeSingleClass(TestNGDirectoryTestSuite.java:112)
	at TestNGDirectoryTestSuite.execute(TestNGDirectoryTestSuite.java:99)
	at TestNGProvider.invoke(TestNGProvider.java:145)
	at ForkedBooter.runSuitesInProcess(ForkedBooter.java:428)
	at ForkedBooter.execute(ForkedBooter.java:162)
	at ForkedBooter.run(ForkedBooter.java:562)
	at ForkedBooter.main(ForkedBooter.java:548)

2) [Guice/ErrorInCustomProvider]: IllegalArgumentException: region must not be blank or empty.
  while locating AwsModule$Ec2ClientProvider
  at AwsRecordSetProvider.<init>(AwsRecordSetProvider.java:82)
      \_ for 2nd parameter ec2
  at AwsModule.configure(AwsModule.java:53)
  while locating AwsRecordSetProvider

Learn more:
  https://github.com/google/guice/wiki/ERROR_IN_CUSTOM_PROVIDER
Caused by: IllegalArgumentException: region must not be blank or empty.
	at Validate.paramNotBlank(Validate.java:180)
	at Region.of(Region.java:136)
	at Region.of(Region.java:132)
	at AwsModule$Ec2ClientProvider.get(AwsModule.java:78)
	at AwsModule$Ec2ClientProvider.get(AwsModule.java:62)
	at ProviderInternalFactory.provision(ProviderInternalFactory.java:86)
	at BoundProviderFactory.provision(BoundProviderFactory.java:72)
	at ProviderInternalFactory$1.call(ProviderInternalFactory.java:67)
	at ProvisionListenerStackCallback$Provision.provision(ProvisionListenerStackCallback.java:109)
	at LifeCycleModule.provision(LifeCycleModule.java:54)
	at ProvisionListenerStackCallback$Provision.provision(ProvisionListenerStackCallback.java:117)
	at ProvisionListenerStackCallback.provision(ProvisionListenerStackCallback.java:66)
	at ProviderInternalFactory.circularGet(ProviderInternalFactory.java:62)
	at BoundProviderFactory.get(BoundProviderFactory.java:59)
	at SingleParameterInjector.inject(SingleParameterInjector.java:40)
	at SingleParameterInjector.getAll(SingleParameterInjector.java:60)
	at ConstructorInjector.provision(ConstructorInjector.java:113)
	at ConstructorInjector.access$000(ConstructorInjector.java:33)
	at ConstructorInjector$1.call(ConstructorInjector.java:98)
	at ProvisionListenerStackCallback$Provision.provision(ProvisionListenerStackCallback.java:109)
	at LifeCycleModule.provision(LifeCycleModule.java:54)
	at ProvisionListenerStackCallback$Provision.provision(ProvisionListenerStackCallback.java:117)
	at ProvisionListenerStackCallback.provision(ProvisionListenerStackCallback.java:66)
	at ConstructorInjector.construct(ConstructorInjector.java:93)
	at ConstructorBindingImpl$Factory.get(ConstructorBindingImpl.java:296)
	at ProviderToInternalFactoryAdapter.get(ProviderToInternalFactoryAdapter.java:40)
	at SingletonScope$1.get(SingletonScope.java:169)
	at InternalFactoryToProviderAdapter.get(InternalFactoryToProviderAdapter.java:45)
	at InternalInjectorCreator.loadEagerSingletons(InternalInjectorCreator.java:213)
	at InternalInjectorCreator.injectDynamically(InternalInjectorCreator.java:186)
	at InternalInjectorCreator.build(InternalInjectorCreator.java:113)
	at Guice.createInjector(Guice.java:87)
	at Bootstrap.initialize(Bootstrap.java:275)
	at AwsConnectorFactory.create(AwsConnectorFactory.java:64)
	at ConnectorManager.createConnector(ConnectorManager.java:360)
	at ConnectorManager.createCatalog(ConnectorManager.java:215)
	at ConnectorManager.createCatalog(ConnectorManager.java:207)
	at ConnectorManager.createCatalog(ConnectorManager.java:193)
	at TestingTrinoServer.createCatalog(TestingTrinoServer.java:387)
	at DistributedQueryRunner.createCatalog(DistributedQueryRunner.java:403)
	at AwsQueryRunner.createQueryRunner(AwsQueryRunner.java:50)
	at TestAwsQueries.createQueryRunner(TestAwsQueries.java:28)
	at AbstractTestQueryFramework.init(AbstractTestQueryFramework.java:91)
	at java.base/NativeMethodAccessorImpl.invoke0(Native Method)
	at java.base/NativeMethodAccessorImpl.invoke(NativeMethodAccessorImpl.java:62)
	at java.base/DelegatingMethodAccessorImpl.invoke(DelegatingMethodAccessorImpl.java:43)
	at java.base/Method.invoke(Method.java:566)
	at MethodInvocationHelper.invokeMethod(MethodInvocationHelper.java:104)
	at Invoker.invokeConfigurationMethod(Invoker.java:515)
	at Invoker.invokeConfigurations(Invoker.java:217)
	at Invoker.invokeConfigurations(Invoker.java:144)
	at TestMethodWorker.invokeBeforeClassMethods(TestMethodWorker.java:169)
	at TestMethodWorker.run(TestMethodWorker.java:108)
	at TestRunner.privateRun(TestRunner.java:756)
	at TestRunner.run(TestRunner.java:610)
	at SuiteRunner.runTest(SuiteRunner.java:387)
	at SuiteRunner.runSequentially(SuiteRunner.java:382)
	at SuiteRunner.privateRun(SuiteRunner.java:340)
	at SuiteRunner.run(SuiteRunner.java:289)
	at SuiteRunnerWorker.runSuite(SuiteRunnerWorker.java:52)
	at SuiteRunnerWorker.run(SuiteRunnerWorker.java:86)
	at TestNG.runSuitesSequentially(TestNG.java:1293)
	at TestNG.runSuitesLocally(TestNG.java:1218)
	at TestNG.runSuites(TestNG.java:1133)
	at TestNG.run(TestNG.java:1104)
	at TestNGExecutor.run(TestNGExecutor.java:136)
	at TestNGDirectoryTestSuite.executeSingleClass(TestNGDirectoryTestSuite.java:112)
	at TestNGDirectoryTestSuite.execute(TestNGDirectoryTestSuite.java:99)
	at TestNGProvider.invoke(TestNGProvider.java:145)
	at ForkedBooter.runSuitesInProcess(ForkedBooter.java:428)
	at ForkedBooter.execute(ForkedBooter.java:162)
	at ForkedBooter.run(ForkedBooter.java:562)
	at ForkedBooter.main(ForkedBooter.java:548)

3) [Guice/ErrorInCustomProvider]: IllegalArgumentException: region must not be blank or empty.
  while locating AwsModule$Ec2ClientProvider
  at AwsRecordSetProvider.<init>(AwsRecordSetProvider.java:82)
      \_ for 2nd parameter ec2
  at AwsModule.configure(AwsModule.java:53)
  at AwsPageSourceProvider.<init>(AwsPageSourceProvider.java:69)
      \_ for 1st parameter recordSetProvider
  at AwsModule.configure(AwsModule.java:54)
  while locating AwsPageSourceProvider

Learn more:
  https://github.com/google/guice/wiki/ERROR_IN_CUSTOM_PROVIDER
Caused by: IllegalArgumentException: region must not be blank or empty.
	at Validate.paramNotBlank(Validate.java:180)
	at Region.of(Region.java:136)
	at Region.of(Region.java:132)
	at AwsModule$Ec2ClientProvider.get(AwsModule.java:78)
	at AwsModule$Ec2ClientProvider.get(AwsModule.java:62)
	at ProviderInternalFactory.provision(ProviderInternalFactory.java:86)
	at BoundProviderFactory.provision(BoundProviderFactory.java:72)
	at ProviderInternalFactory$1.call(ProviderInternalFactory.java:67)
	at ProvisionListenerStackCallback$Provision.provision(ProvisionListenerStackCallback.java:109)
	at LifeCycleModule.provision(LifeCycleModule.java:54)
	at ProvisionListenerStackCallback$Provision.provision(ProvisionListenerStackCallback.java:117)
	at ProvisionListenerStackCallback.provision(ProvisionListenerStackCallback.java:66)
	at ProviderInternalFactory.circularGet(ProviderInternalFactory.java:62)
	at BoundProviderFactory.get(BoundProviderFactory.java:59)
	at SingleParameterInjector.inject(SingleParameterInjector.java:40)
	at SingleParameterInjector.getAll(SingleParameterInjector.java:60)
	at ConstructorInjector.provision(ConstructorInjector.java:113)
	at ConstructorInjector.access$000(ConstructorInjector.java:33)
	at ConstructorInjector$1.call(ConstructorInjector.java:98)
	at ProvisionListenerStackCallback$Provision.provision(ProvisionListenerStackCallback.java:109)
	at LifeCycleModule.provision(LifeCycleModule.java:54)
	at ProvisionListenerStackCallback$Provision.provision(ProvisionListenerStackCallback.java:117)
	at ProvisionListenerStackCallback.provision(ProvisionListenerStackCallback.java:66)
	at ConstructorInjector.construct(ConstructorInjector.java:93)
	at ConstructorBindingImpl$Factory.get(ConstructorBindingImpl.java:296)
	at ProviderToInternalFactoryAdapter.get(ProviderToInternalFactoryAdapter.java:40)
	at SingletonScope$1.get(SingletonScope.java:169)
	at InternalFactoryToProviderAdapter.get(InternalFactoryToProviderAdapter.java:45)
	at SingleParameterInjector.inject(SingleParameterInjector.java:40)
	at SingleParameterInjector.getAll(SingleParameterInjector.java:60)
	at ConstructorInjector.provision(ConstructorInjector.java:113)
	at ConstructorInjector.access$000(ConstructorInjector.java:33)
	at ConstructorInjector$1.call(ConstructorInjector.java:98)
	at ProvisionListenerStackCallback$Provision.provision(ProvisionListenerStackCallback.java:109)
	at LifeCycleModule.provision(LifeCycleModule.java:54)
	at ProvisionListenerStackCallback$Provision.provision(ProvisionListenerStackCallback.java:117)
	at ProvisionListenerStackCallback.provision(ProvisionListenerStackCallback.java:66)
	at ConstructorInjector.construct(ConstructorInjector.java:93)
	at ConstructorBindingImpl$Factory.get(ConstructorBindingImpl.java:296)
	at ProviderToInternalFactoryAdapter.get(ProviderToInternalFactoryAdapter.java:40)
	at SingletonScope$1.get(SingletonScope.java:169)
	at InternalFactoryToProviderAdapter.get(InternalFactoryToProviderAdapter.java:45)
	at InternalInjectorCreator.loadEagerSingletons(InternalInjectorCreator.java:213)
	at InternalInjectorCreator.injectDynamically(InternalInjectorCreator.java:186)
	at InternalInjectorCreator.build(InternalInjectorCreator.java:113)
	at Guice.createInjector(Guice.java:87)
	at Bootstrap.initialize(Bootstrap.java:275)
	at AwsConnectorFactory.create(AwsConnectorFactory.java:64)
	at ConnectorManager.createConnector(ConnectorManager.java:360)
	at ConnectorManager.createCatalog(ConnectorManager.java:215)
	at ConnectorManager.createCatalog(ConnectorManager.java:207)
	at ConnectorManager.createCatalog(ConnectorManager.java:193)
	at TestingTrinoServer.createCatalog(TestingTrinoServer.java:387)
	at DistributedQueryRunner.createCatalog(DistributedQueryRunner.java:403)
	at AwsQueryRunner.createQueryRunner(AwsQueryRunner.java:50)
	at TestAwsQueries.createQueryRunner(TestAwsQueries.java:28)
	at AbstractTestQueryFramework.init(AbstractTestQueryFramework.java:91)
	at java.base/NativeMethodAccessorImpl.invoke0(Native Method)
	at java.base/NativeMethodAccessorImpl.invoke(NativeMethodAccessorImpl.java:62)
	at java.base/DelegatingMethodAccessorImpl.invoke(DelegatingMethodAccessorImpl.java:43)
	at java.base/Method.invoke(Method.java:566)
	at MethodInvocationHelper.invokeMethod(MethodInvocationHelper.java:104)
	at Invoker.invokeConfigurationMethod(Invoker.java:515)
	at Invoker.invokeConfigurations(Invoker.java:217)
	at Invoker.invokeConfigurations(Invoker.java:144)
	at TestMethodWorker.invokeBeforeClassMethods(TestMethodWorker.java:169)
	at TestMethodWorker.run(TestMethodWorker.java:108)
	at TestRunner.privateRun(TestRunner.java:756)
	at TestRunner.run(TestRunner.java:610)
	at SuiteRunner.runTest(SuiteRunner.java:387)
	at SuiteRunner.runSequentially(SuiteRunner.java:382)
	at SuiteRunner.privateRun(SuiteRunner.java:340)
	at SuiteRunner.run(SuiteRunner.java:289)
	at SuiteRunnerWorker.runSuite(SuiteRunnerWorker.java:52)
	at SuiteRunnerWorker.run(SuiteRunnerWorker.java:86)
	at TestNG.runSuitesSequentially(TestNG.java:1293)
	at TestNG.runSuitesLocally(TestNG.java:1218)
	at TestNG.runSuites(TestNG.java:1133)
	at TestNG.run(TestNG.java:1104)
	at TestNGExecutor.run(TestNGExecutor.java:136)
	at TestNGDirectoryTestSuite.executeSingleClass(TestNGDirectoryTestSuite.java:112)
	at TestNGDirectoryTestSuite.execute(TestNGDirectoryTestSuite.java:99)
	at TestNGProvider.invoke(TestNGProvider.java:145)
	at ForkedBooter.runSuitesInProcess(ForkedBooter.java:428)
	at ForkedBooter.execute(ForkedBooter.java:162)
	at ForkedBooter.run(ForkedBooter.java:562)
	at ForkedBooter.main(ForkedBooter.java:548)

4) [Guice/ErrorInCustomProvider]: IllegalArgumentException: region must not be blank or empty.
  while locating AwsModule$Ec2ClientProvider
  at AwsPageSinkProvider.<init>(AwsPageSinkProvider.java:37)
      \_ for 1st parameter ec2
  at AwsModule.configure(AwsModule.java:55)
  while locating AwsPageSinkProvider

Learn more:
  https://github.com/google/guice/wiki/ERROR_IN_CUSTOM_PROVIDER
Caused by: IllegalArgumentException (same stack trace as error #2)
4 errors

======================
Full classname legend:
======================
AbstractTestQueryFramework:               "io.trino.testing.AbstractTestQueryFramework"
AwsConnector:                             "pl.net.was.cloud.aws.AwsConnector"
AwsConnectorFactory:                      "pl.net.was.cloud.aws.AwsConnectorFactory"
AwsModule:                                "pl.net.was.cloud.aws.AwsModule"
AwsModule$Ec2ClientProvider:              "pl.net.was.cloud.aws.AwsModule$Ec2ClientProvider"
AwsPageSinkProvider:                      "pl.net.was.cloud.aws.AwsPageSinkProvider"
AwsPageSourceProvider:                    "pl.net.was.cloud.aws.AwsPageSourceProvider"
AwsQueryRunner:                           "pl.net.was.cloud.aws.AwsQueryRunner"
AwsRecordSetProvider:                     "pl.net.was.cloud.aws.AwsRecordSetProvider"
Bootstrap:                                "io.airlift.bootstrap.Bootstrap"
BoundProviderFactory:                     "com.google.inject.internal.BoundProviderFactory"
ConnectorManager:                         "io.trino.connector.ConnectorManager"
ConstructorBindingImpl$Factory:           "com.google.inject.internal.ConstructorBindingImpl$Factory"
ConstructorInjector:                      "com.google.inject.internal.ConstructorInjector"
ConstructorInjector$1:                    "com.google.inject.internal.ConstructorInjector$1"
DelegatingMethodAccessorImpl:             "jdk.internal.reflect.DelegatingMethodAccessorImpl"
DistributedQueryRunner:                   "io.trino.testing.DistributedQueryRunner"
ForkedBooter:                             "org.apache.maven.surefire.booter.ForkedBooter"
Guice:                                    "com.google.inject.Guice"
InternalFactoryToProviderAdapter:         "com.google.inject.internal.InternalFactoryToProviderAdapter"
InternalInjectorCreator:                  "com.google.inject.internal.InternalInjectorCreator"
Invoker:                                  "org.testng.internal.Invoker"
LifeCycleModule:                          "io.airlift.bootstrap.LifeCycleModule"
Method:                                   "java.lang.reflect.Method"
MethodInvocationHelper:                   "org.testng.internal.MethodInvocationHelper"
NativeMethodAccessorImpl:                 "jdk.internal.reflect.NativeMethodAccessorImpl"
ProviderInternalFactory:                  "com.google.inject.internal.ProviderInternalFactory"
ProviderInternalFactory$1:                "com.google.inject.internal.ProviderInternalFactory$1"
ProviderToInternalFactoryAdapter:         "com.google.inject.internal.ProviderToInternalFactoryAdapter"
ProvisionListenerStackCallback:           "com.google.inject.internal.ProvisionListenerStackCallback"
ProvisionListenerStackCallback$Provision: "com.google.inject.internal.ProvisionListenerStackCallback$Provision"
Region:                                   "software.amazon.awssdk.regions.Region"
SingleParameterInjector:                  "com.google.inject.internal.SingleParameterInjector"
SingletonScope$1:                         "com.google.inject.internal.SingletonScope$1"
SuiteRunner:                              "org.testng.SuiteRunner"
SuiteRunnerWorker:                        "org.testng.SuiteRunnerWorker"
TestAwsQueries:                           "pl.net.was.cloud.aws.TestAwsQueries"
TestMethodWorker:                         "org.testng.internal.TestMethodWorker"
TestNG:                                   "org.testng.TestNG"
TestNGDirectoryTestSuite:                 "org.apache.maven.surefire.testng.TestNGDirectoryTestSuite"
TestNGExecutor:                           "org.apache.maven.surefire.testng.TestNGExecutor"
TestNGProvider:                           "org.apache.maven.surefire.testng.TestNGProvider"
TestRunner:                               "org.testng.TestRunner"
TestingTrinoServer:                       "io.trino.server.testing.TestingTrinoServer"
Validate:                                 "software.amazon.awssdk.utils.Validate"
========================
End of classname legend:
========================

	at com.google.inject.internal.Errors.throwCreationExceptionIfErrorsExist(Errors.java:568)
	at com.google.inject.internal.InternalInjectorCreator.injectDynamically(InternalInjectorCreator.java:190)
	at com.google.inject.internal.InternalInjectorCreator.build(InternalInjectorCreator.java:113)
	at com.google.inject.Guice.createInjector(Guice.java:87)
	at io.airlift.bootstrap.Bootstrap.initialize(Bootstrap.java:275)
	at pl.net.was.cloud.aws.AwsConnectorFactory.create(AwsConnectorFactory.java:64)
	at io.trino.connector.ConnectorManager.createConnector(ConnectorManager.java:360)
	at io.trino.connector.ConnectorManager.createCatalog(ConnectorManager.java:215)
	at io.trino.connector.ConnectorManager.createCatalog(ConnectorManager.java:207)
	at io.trino.connector.ConnectorManager.createCatalog(ConnectorManager.java:193)
	at io.trino.server.testing.TestingTrinoServer.createCatalog(TestingTrinoServer.java:387)
	at io.trino.testing.DistributedQueryRunner.createCatalog(DistributedQueryRunner.java:403)
	at pl.net.was.cloud.aws.AwsQueryRunner.createQueryRunner(AwsQueryRunner.java:50)
	at pl.net.was.cloud.aws.TestAwsQueries.createQueryRunner(TestAwsQueries.java:28)
	at io.trino.testing.AbstractTestQueryFramework.init(AbstractTestQueryFramework.java:91)
	at java.base/jdk.internal.reflect.NativeMethodAccessorImpl.invoke0(Native Method)
	at java.base/jdk.internal.reflect.NativeMethodAccessorImpl.invoke(NativeMethodAccessorImpl.java:62)
	at java.base/jdk.internal.reflect.DelegatingMethodAccessorImpl.invoke(DelegatingMethodAccessorImpl.java:43)
	at java.base/java.lang.reflect.Method.invoke(Method.java:566)
	at org.testng.internal.MethodInvocationHelper.invokeMethod(MethodInvocationHelper.java:104)
	at org.testng.internal.Invoker.invokeConfigurationMethod(Invoker.java:515)
	at org.testng.internal.Invoker.invokeConfigurations(Invoker.java:217)
	at org.testng.internal.Invoker.invokeConfigurations(Invoker.java:144)
	at org.testng.internal.TestMethodWorker.invokeBeforeClassMethods(TestMethodWorker.java:169)
	at org.testng.internal.TestMethodWorker.run(TestMethodWorker.java:108)
	at org.testng.TestRunner.privateRun(TestRunner.java:756)
	at org.testng.TestRunner.run(TestRunner.java:610)
	at org.testng.SuiteRunner.runTest(SuiteRunner.java:387)
	at org.testng.SuiteRunner.runSequentially(SuiteRunner.java:382)
	at org.testng.SuiteRunner.privateRun(SuiteRunner.java:340)
	at org.testng.SuiteRunner.run(SuiteRunner.java:289)
	at org.testng.SuiteRunnerWorker.runSuite(SuiteRunnerWorker.java:52)
	at org.testng.SuiteRunnerWorker.run(SuiteRunnerWorker.java:86)
	at org.testng.TestNG.runSuitesSequentially(TestNG.java:1293)
	at org.testng.TestNG.runSuitesLocally(TestNG.java:1218)
	at org.testng.TestNG.runSuites(TestNG.java:1133)
	at org.testng.TestNG.run(TestNG.java:1104)
	at org.apache.maven.surefire.testng.TestNGExecutor.run(TestNGExecutor.java:136)
	at org.apache.maven.surefire.testng.TestNGDirectoryTestSuite.executeSingleClass(TestNGDirectoryTestSuite.java:112)
	at org.apache.maven.surefire.testng.TestNGDirectoryTestSuite.execute(TestNGDirectoryTestSuite.java:99)
	at org.apache.maven.surefire.testng.TestNGProvider.invoke(TestNGProvider.java:145)
	at org.apache.maven.surefire.booter.ForkedBooter.runSuitesInProcess(ForkedBooter.java:428)
	at org.apache.maven.surefire.booter.ForkedBooter.execute(ForkedBooter.java:162)
	at org.apache.maven.surefire.booter.ForkedBooter.run(ForkedBooter.java:562)
	at org.apache.maven.surefire.booter.ForkedBooter.main(ForkedBooter.java:548)

[INFO] 
[INFO] Results:
[INFO] 
[ERROR] Failures: 
[ERROR]   TestAwsQueries>AbstractTestQueryFramework.init:91->createQueryRunner:28  Creation
[INFO] 
[ERROR] Tests run: 4, Failures: 1, Errors: 0, Skipped: 3
[INFO] 
[INFO] ------------------------------------------------------------------------
[INFO] Reactor Summary for trino-cloud 0.9-SNAPSHOT:
[INFO] 
[INFO] trino-cloud ........................................ SUCCESS [  3.642 s]
[INFO] trino-cloud-aws .................................... FAILURE [ 14.540 s]
[INFO] ------------------------------------------------------------------------
[INFO] BUILD FAILURE
[INFO] ------------------------------------------------------------------------
[INFO] Total time:  18.462 s
[INFO] Finished at: 2023-02-07T11:08:46Z
[INFO] ------------------------------------------------------------------------
[ERROR] Failed to execute goal org.apache.maven.plugins:maven-surefire-plugin:3.0.0-M5:test (default-test) on project trino-cloud-aws: There are test failures.
[ERROR] 
[ERROR] Please refer to /home/gabsko/breaking-updates/trino-cloud-aws/target/surefire-reports for the individual test results.
[ERROR] Please refer to dump files (if any exist) [date].dump, [date]-jvmRun[N].dump and [date].dumpstream.
[ERROR] -> [Help 1]
[ERROR] 
[ERROR] To see the full stack trace of the errors, re-run Maven with the -e switch.
[ERROR] Re-run Maven using the -X switch to enable full debug logging.
[ERROR] 
[ERROR] For more information about the errors and possible solutions, please read the following articles:
[ERROR] [Help 1] http://cwiki.apache.org/confluence/display/MAVEN/MojoFailureException
[ERROR] 
[ERROR] After correcting the problems, you can resume the build with the command
[ERROR]   mvn <args> -rf :trino-cloud-aws
