[INFO] Scanning for projects...
[WARNING] 
[WARNING] Some problems were encountered while building the effective model for org.fcrepo.camel:fcrepo-indexing-triplestore:jar:6.0.0-SNAPSHOT
[WARNING] 'dependencies.dependency.(groupId:artifactId:type:classifier)' must be unique: org.apache.camel:camel-spring-javaconfig:jar -> duplicate declaration of version (?) @ line 44, column 17
[WARNING] 
[WARNING] Some problems were encountered while building the effective model for org.fcrepo.camel:fcrepo-ldpath:jar:6.0.0-SNAPSHOT
[WARNING] 'dependencies.dependency.(groupId:artifactId:type:classifier)' must be unique: org.apache.marmotta:ldcache-api:jar -> duplicate declaration of version (?) @ line 109, column 17
[WARNING] 'dependencies.dependency.(groupId:artifactId:type:classifier)' must be unique: org.apache.marmotta:ldcache-backend-file:jar -> duplicate declaration of version (?) @ line 148, column 17
[WARNING] 
[WARNING] It is highly recommended to fix these problems because they threaten the stability of your build.
[WARNING] 
[WARNING] For this reason, future Maven versions might no longer support building such malformed projects.
[WARNING] 
[INFO] ------------------------------------------------------------------------
[INFO] Reactor Build Order:
[INFO] 
[INFO] Fedora Camel Workflows                                             [pom]
[INFO] fcrepo-camel-common                                                [jar]
[INFO] Fedora Repository Connector Service                                [jar]
[INFO] Fedora Indexing Service with a Triplestore backend                 [jar]
[INFO] Fedora ActiveMQ Service                                            [jar]
[INFO] Fedora Re-indexing Service                                         [jar]
[INFO] Fedora Indexing Service with a Solr backend                        [jar]
[INFO] Fedora LDPath Service                                              [jar]
[INFO] fcrepo-camel-toolbox-app                                           [jar]
[INFO] 
[INFO] ---------------< org.fcrepo.camel:fcrepo-camel-toolbox >----------------
[INFO] Building Fedora Camel Workflows 6.0.0-SNAPSHOT                     [1/9]
[INFO] --------------------------------[ pom ]---------------------------------
[INFO] 
[INFO] --- maven-clean-plugin:3.1.0:clean (default-clean) @ fcrepo-camel-toolbox ---
[INFO] 
[INFO] --- jacoco-maven-plugin:0.8.2:prepare-agent (default-prepare-agent) @ fcrepo-camel-toolbox ---
[INFO] jacoco.agent.unit.arg set to -javaagent:/home/gabsko/.m2/repository/org/jacoco/org.jacoco.agent/0.8.2/org.jacoco.agent-0.8.2-runtime.jar=destfile=/home/gabsko/breaking-updates/target/jacoco-ut.exec,append=true
[INFO] 
[INFO] --- maven-resources-plugin:3.1.0:resources (filter) @ fcrepo-camel-toolbox ---
[INFO] Using 'UTF-8' encoding to copy filtered resources.
[INFO] skip non existing resourceDirectory /home/gabsko/breaking-updates/src/main/resources
[INFO] 
[INFO] --- build-helper-maven-plugin:3.0.0:reserve-network-port (reserve-port) @ fcrepo-camel-toolbox ---
[INFO] 
[INFO] ----------------< org.fcrepo.camel:fcrepo-camel-common >----------------
[INFO] Building fcrepo-camel-common 6.0.0-SNAPSHOT                        [2/9]
[INFO] --------------------------------[ jar ]---------------------------------
[INFO] 
[INFO] --- maven-clean-plugin:3.1.0:clean (default-clean) @ fcrepo-camel-common ---
[INFO] Deleting /home/gabsko/breaking-updates/fcrepo-camel-common/target
[INFO] 
[INFO] --- jacoco-maven-plugin:0.8.2:prepare-agent (default-prepare-agent) @ fcrepo-camel-common ---
[INFO] jacoco.agent.unit.arg set to -javaagent:/home/gabsko/.m2/repository/org/jacoco/org.jacoco.agent/0.8.2/org.jacoco.agent-0.8.2-runtime.jar=destfile=/home/gabsko/breaking-updates/fcrepo-camel-common/target/jacoco-ut.exec,append=true
[INFO] 
[INFO] --- maven-resources-plugin:3.1.0:resources (filter) @ fcrepo-camel-common ---
[INFO] Using 'UTF-8' encoding to copy filtered resources.
[INFO] skip non existing resourceDirectory /home/gabsko/breaking-updates/fcrepo-camel-common/src/main/resources
[INFO] 
[INFO] --- maven-resources-plugin:3.1.0:resources (default-resources) @ fcrepo-camel-common ---
[INFO] Using 'UTF-8' encoding to copy filtered resources.
[INFO] skip non existing resourceDirectory /home/gabsko/breaking-updates/fcrepo-camel-common/src/main/resources
[INFO] 
[INFO] --- maven-compiler-plugin:3.8.0:compile (default-compile) @ fcrepo-camel-common ---
[INFO] Changes detected - recompiling the module!
[INFO] Compiling 4 source files to /home/gabsko/breaking-updates/fcrepo-camel-common/target/classes
[INFO] 
[INFO] --- build-helper-maven-plugin:3.0.0:reserve-network-port (reserve-port) @ fcrepo-camel-common ---
[INFO] 
[INFO] --- maven-resources-plugin:3.1.0:testResources (default-testResources) @ fcrepo-camel-common ---
[INFO] Using 'UTF-8' encoding to copy filtered resources.
[INFO] skip non existing resourceDirectory /home/gabsko/breaking-updates/fcrepo-camel-common/src/test/resources
[INFO] 
[INFO] --- maven-compiler-plugin:3.8.0:testCompile (default-testCompile) @ fcrepo-camel-common ---
[INFO] No sources to compile
[INFO] 
[INFO] --- maven-surefire-plugin:2.22.1:test (default-test) @ fcrepo-camel-common ---
[INFO] No tests to run.
[INFO] 
[INFO] ---------------< org.fcrepo.camel:fcrepo-service-camel >----------------
[INFO] Building Fedora Repository Connector Service 6.0.0-SNAPSHOT        [3/9]
[INFO] --------------------------------[ jar ]---------------------------------
[INFO] 
[INFO] --- maven-clean-plugin:3.1.0:clean (default-clean) @ fcrepo-service-camel ---
[INFO] Deleting /home/gabsko/breaking-updates/fcrepo-service-camel/target
[INFO] 
[INFO] --- jacoco-maven-plugin:0.8.2:prepare-agent (default-prepare-agent) @ fcrepo-service-camel ---
[INFO] jacoco.agent.unit.arg set to -javaagent:/home/gabsko/.m2/repository/org/jacoco/org.jacoco.agent/0.8.2/org.jacoco.agent-0.8.2-runtime.jar=destfile=/home/gabsko/breaking-updates/fcrepo-service-camel/target/jacoco-ut.exec,append=true
[INFO] 
[INFO] --- maven-resources-plugin:3.1.0:resources (filter) @ fcrepo-service-camel ---
[INFO] Using 'UTF-8' encoding to copy filtered resources.
[INFO] skip non existing resourceDirectory /home/gabsko/breaking-updates/fcrepo-service-camel/src/main/resources
[INFO] 
[INFO] --- maven-resources-plugin:3.1.0:resources (default-resources) @ fcrepo-service-camel ---
[INFO] Using 'UTF-8' encoding to copy filtered resources.
[INFO] skip non existing resourceDirectory /home/gabsko/breaking-updates/fcrepo-service-camel/src/main/resources
[INFO] 
[INFO] --- maven-compiler-plugin:3.8.0:compile (default-compile) @ fcrepo-service-camel ---
[INFO] Changes detected - recompiling the module!
[INFO] Compiling 1 source file to /home/gabsko/breaking-updates/fcrepo-service-camel/target/classes
[INFO] 
[INFO] --- build-helper-maven-plugin:3.0.0:reserve-network-port (reserve-port) @ fcrepo-service-camel ---
[INFO] Reserved port 35155 for fcrepo.dynamic.test.port
[INFO] Reserved port 40085 for fcrepo.dynamic.jms.port
[INFO] Reserved port 46511 for fcrepo.dynamic.stomp.port
[INFO] Reserved port 42557 for fcrepo.dynamic.reindexing.port
[INFO] Reserved port 33145 for jetty.dynamic.stop.port
[INFO] 
[INFO] --- maven-resources-plugin:3.1.0:testResources (default-testResources) @ fcrepo-service-camel ---
[INFO] Using 'UTF-8' encoding to copy filtered resources.
[INFO] Copying 4 resources
[INFO] 
[INFO] --- maven-compiler-plugin:3.8.0:testCompile (default-testCompile) @ fcrepo-service-camel ---
[INFO] Changes detected - recompiling the module!
[INFO] Compiling 1 source file to /home/gabsko/breaking-updates/fcrepo-service-camel/target/test-classes
[INFO] 
[INFO] --- maven-surefire-plugin:2.22.1:test (default-test) @ fcrepo-service-camel ---
[INFO] 
[INFO] ------------< org.fcrepo.camel:fcrepo-indexing-triplestore >------------
[INFO] Building Fedora Indexing Service with a Triplestore backend 6.0.0-SNAPSHOT [4/9]
[INFO] --------------------------------[ jar ]---------------------------------
[INFO] 
[INFO] --- maven-clean-plugin:3.1.0:clean (default-clean) @ fcrepo-indexing-triplestore ---
[INFO] Deleting /home/gabsko/breaking-updates/fcrepo-indexing-triplestore/target
[INFO] 
[INFO] --- jacoco-maven-plugin:0.8.2:prepare-agent (default-prepare-agent) @ fcrepo-indexing-triplestore ---
[INFO] jacoco.agent.unit.arg set to -javaagent:/home/gabsko/.m2/repository/org/jacoco/org.jacoco.agent/0.8.2/org.jacoco.agent-0.8.2-runtime.jar=destfile=/home/gabsko/breaking-updates/fcrepo-indexing-triplestore/target/jacoco-ut.exec,append=true
[INFO] 
[INFO] --- maven-resources-plugin:3.1.0:resources (filter) @ fcrepo-indexing-triplestore ---
[INFO] Using 'UTF-8' encoding to copy filtered resources.
[INFO] skip non existing resourceDirectory /home/gabsko/breaking-updates/fcrepo-indexing-triplestore/src/main/resources
[INFO] 
[INFO] --- maven-resources-plugin:3.1.0:resources (default-resources) @ fcrepo-indexing-triplestore ---
[INFO] Using 'UTF-8' encoding to copy filtered resources.
[INFO] skip non existing resourceDirectory /home/gabsko/breaking-updates/fcrepo-indexing-triplestore/src/main/resources
[INFO] 
[INFO] --- maven-compiler-plugin:3.8.0:compile (default-compile) @ fcrepo-indexing-triplestore ---
[INFO] Changes detected - recompiling the module!
[INFO] Compiling 2 source files to /home/gabsko/breaking-updates/fcrepo-indexing-triplestore/target/classes
[INFO] 
[INFO] --- build-helper-maven-plugin:3.0.0:reserve-network-port (reserve-port) @ fcrepo-indexing-triplestore ---
[INFO] Reserved port 32795 for fuseki.dynamic.test.port
[INFO] Reserved port 33127 for fcrepo.dynamic.test.port
[INFO] Reserved port 34057 for fcrepo.dynamic.jms.port
[INFO] Reserved port 45859 for fcrepo.dynamic.stomp.port
[INFO] Reserved port 46781 for jetty.dynamic.stop.port
[INFO] 
[INFO] --- maven-resources-plugin:3.1.0:testResources (default-testResources) @ fcrepo-indexing-triplestore ---
[INFO] Using 'UTF-8' encoding to copy filtered resources.
[INFO] Copying 9 resources
[INFO] 
[INFO] --- maven-compiler-plugin:3.8.0:testCompile (default-testCompile) @ fcrepo-indexing-triplestore ---
[INFO] Changes detected - recompiling the module!
[INFO] Compiling 4 source files to /home/gabsko/breaking-updates/fcrepo-indexing-triplestore/target/test-classes
[INFO] 
[INFO] --- maven-surefire-plugin:2.22.1:test (default-test) @ fcrepo-indexing-triplestore ---
[INFO] 
[INFO] -------------------------------------------------------
[INFO]  T E S T S
[INFO] -------------------------------------------------------
[INFO] Running org.fcrepo.camel.indexing.triplestore.RouteTest
ERROR 16:34:28.882 (DefaultErrorHandler) Failed delivery for (MessageId: 12D8486CA8AC056-0000000000000000 on ExchangeId: 12D8486CA8AC056-0000000000000000). Exhausted after delivery attempt: 11 caught: org.apache.camel.CamelExecutionException: Exception occurred during execution on the exchange: Exchange[12D8486CA8AC056-0000000000000000]. Processed by failure processor: FatalFallbackErrorHandler[Channel[log13]]

Message History (complete message history is disabled)
---------------------------------------------------------------------------------------------------------------------------------------
RouteId              ProcessorId          Processor                                                                        Elapsed (ms)
[FcrepoTriplestoreU] [FcrepoTriplestoreU] [from[direct://update.triplestore]                                             ] [     10194]

Stacktrace
---------------------------------------------------------------------------------------------------------------------------------------

org.apache.camel.CamelExecutionException: Exception occurred during execution on the exchange: Exchange[12D8486CA8AC056-0000000000000000]
	at org.apache.camel.CamelExecutionException.wrapCamelExecutionException(CamelExecutionException.java:45)
	at org.apache.camel.support.AbstractExchange.setException(AbstractExchange.java:564)
	at org.apache.camel.support.DefaultExchange.setException(DefaultExchange.java:27)
	at org.apache.camel.support.processor.DelegateSyncProcessor.process(DelegateSyncProcessor.java:69)
	at org.apache.camel.processor.errorhandler.RedeliveryErrorHandler$RedeliveryTask.redeliver(RedeliveryErrorHandler.java:846)
	at org.apache.camel.impl.engine.DefaultReactiveExecutor$Worker.schedule(DefaultReactiveExecutor.java:181)
	at org.apache.camel.impl.engine.DefaultReactiveExecutor.scheduleMain(DefaultReactiveExecutor.java:62)
	at org.apache.camel.processor.Pipeline.process(Pipeline.java:167)
	at org.apache.camel.impl.engine.CamelInternalProcessor.process(CamelInternalProcessor.java:388)
	at org.apache.camel.component.direct.DirectProducer.process(DirectProducer.java:96)
	at org.apache.camel.impl.engine.SharedCamelInternalProcessor.process(SharedCamelInternalProcessor.java:217)
	at org.apache.camel.impl.engine.SharedCamelInternalProcessor$1.process(SharedCamelInternalProcessor.java:111)
	at org.apache.camel.impl.engine.DefaultAsyncProcessorAwaitManager.process(DefaultAsyncProcessorAwaitManager.java:83)
	at org.apache.camel.impl.engine.SharedCamelInternalProcessor.process(SharedCamelInternalProcessor.java:108)
	at org.apache.camel.support.cache.DefaultProducerCache.send(DefaultProducerCache.java:190)
	at org.apache.camel.impl.engine.DefaultProducerTemplate.send(DefaultProducerTemplate.java:176)
	at org.apache.camel.impl.engine.DefaultProducerTemplate.send(DefaultProducerTemplate.java:172)
	at org.apache.camel.impl.engine.DefaultProducerTemplate.send(DefaultProducerTemplate.java:153)
	at org.apache.camel.impl.engine.DefaultProducerTemplate.sendBodyAndHeaders(DefaultProducerTemplate.java:311)
	at org.apache.camel.impl.engine.DefaultProducerTemplate.sendBodyAndHeaders(DefaultProducerTemplate.java:305)
	at org.fcrepo.camel.indexing.triplestore.RouteTest.testUpdateRouter(RouteTest.java:352)
	at java.base/jdk.internal.reflect.NativeMethodAccessorImpl.invoke0(Native Method)
	at java.base/jdk.internal.reflect.NativeMethodAccessorImpl.invoke(NativeMethodAccessorImpl.java:62)
	at java.base/jdk.internal.reflect.DelegatingMethodAccessorImpl.invoke(DelegatingMethodAccessorImpl.java:43)
	at java.base/java.lang.reflect.Method.invoke(Method.java:566)
	at org.junit.runners.model.FrameworkMethod$1.runReflectiveCall(FrameworkMethod.java:59)
	at org.junit.internal.runners.model.ReflectiveCallable.run(ReflectiveCallable.java:12)
	at org.junit.runners.model.FrameworkMethod.invokeExplosively(FrameworkMethod.java:56)
	at org.junit.internal.runners.statements.InvokeMethod.evaluate(InvokeMethod.java:17)
	at org.springframework.test.context.junit4.statements.RunBeforeTestExecutionCallbacks.evaluate(RunBeforeTestExecutionCallbacks.java:74)
	at org.springframework.test.context.junit4.statements.RunAfterTestExecutionCallbacks.evaluate(RunAfterTestExecutionCallbacks.java:84)
	at org.springframework.test.context.junit4.statements.RunBeforeTestMethodCallbacks.evaluate(RunBeforeTestMethodCallbacks.java:75)
	at org.springframework.test.context.junit4.statements.RunAfterTestMethodCallbacks.evaluate(RunAfterTestMethodCallbacks.java:86)
	at org.springframework.test.context.junit4.statements.SpringRepeat.evaluate(SpringRepeat.java:84)
	at org.junit.runners.ParentRunner.runLeaf(ParentRunner.java:366)
	at org.springframework.test.context.junit4.SpringJUnit4ClassRunner.runChild(SpringJUnit4ClassRunner.java:251)
	at org.springframework.test.context.junit4.SpringJUnit4ClassRunner.runChild(SpringJUnit4ClassRunner.java:97)
	at org.junit.runners.ParentRunner$4.run(ParentRunner.java:331)
	at org.junit.runners.ParentRunner$1.schedule(ParentRunner.java:79)
	at org.junit.runners.ParentRunner.runChildren(ParentRunner.java:329)
	at org.junit.runners.ParentRunner.access$100(ParentRunner.java:66)
	at org.junit.runners.ParentRunner$2.evaluate(ParentRunner.java:293)
	at org.junit.internal.runners.statements.RunBefores.evaluate(RunBefores.java:26)
	at org.springframework.test.context.junit4.statements.RunBeforeTestClassCallbacks.evaluate(RunBeforeTestClassCallbacks.java:61)
	at org.springframework.test.context.junit4.statements.RunAfterTestClassCallbacks.evaluate(RunAfterTestClassCallbacks.java:70)
	at org.junit.runners.ParentRunner$3.evaluate(ParentRunner.java:306)
	at org.junit.runners.ParentRunner.run(ParentRunner.java:413)
	at org.springframework.test.context.junit4.SpringJUnit4ClassRunner.run(SpringJUnit4ClassRunner.java:190)
	at org.apache.maven.surefire.junit4.JUnit4Provider.execute(JUnit4Provider.java:365)
	at org.apache.maven.surefire.junit4.JUnit4Provider.executeWithRerun(JUnit4Provider.java:273)
	at org.apache.maven.surefire.junit4.JUnit4Provider.executeTestSet(JUnit4Provider.java:238)
	at org.apache.maven.surefire.junit4.JUnit4Provider.invoke(JUnit4Provider.java:159)
	at org.apache.maven.surefire.booter.ForkedBooter.invokeProviderInSameClassLoader(ForkedBooter.java:384)
	at org.apache.maven.surefire.booter.ForkedBooter.runSuitesInProcess(ForkedBooter.java:345)
	at org.apache.maven.surefire.booter.ForkedBooter.execute(ForkedBooter.java:126)
	at org.apache.maven.surefire.booter.ForkedBooter.main(ForkedBooter.java:418)
	Suppressed: org.apache.camel.CamelExecutionException: Exception occurred during execution on the exchange: Exchange[12D8486CA8AC056-0000000000000000]
		... 56 common frames omitted
		Suppressed: org.apache.camel.CamelExecutionException: Exception occurred during execution on the exchange: Exchange[12D8486CA8AC056-0000000000000000]
			... 56 common frames omitted
			Suppressed: org.apache.camel.CamelExecutionException: Exception occurred during execution on the exchange: Exchange[12D8486CA8AC056-0000000000000000]
				... 56 common frames omitted
				Suppressed: org.apache.camel.CamelExecutionException: Exception occurred during execution on the exchange: Exchange[12D8486CA8AC056-0000000000000000]
					... 56 common frames omitted
					Suppressed: org.apache.camel.CamelExecutionException: Exception occurred during execution on the exchange: Exchange[12D8486CA8AC056-0000000000000000]
						... 56 common frames omitted
						Suppressed: org.apache.camel.CamelExecutionException: Exception occurred during execution on the exchange: Exchange[12D8486CA8AC056-0000000000000000]
							... 56 common frames omitted
							Suppressed: org.apache.camel.CamelExecutionException: Exception occurred during execution on the exchange: Exchange[12D8486CA8AC056-0000000000000000]
								... 56 common frames omitted
								Suppressed: org.apache.camel.CamelExecutionException: Exception occurred during execution on the exchange: Exchange[12D8486CA8AC056-0000000000000000]
									... 56 common frames omitted
									Suppressed: org.apache.camel.CamelExecutionException: Exception occurred during execution on the exchange: Exchange[12D8486CA8AC056-0000000000000000]
										... 56 common frames omitted
										Suppressed: org.apache.camel.CamelExecutionException: Exception occurred during execution on the exchange: Exchange[12D8486CA8AC056-0000000000000000]
											at org.apache.camel.CamelExecutionException.wrapCamelExecutionException(CamelExecutionException.java:45)
											at org.apache.camel.support.AbstractExchange.setException(AbstractExchange.java:564)
											at org.apache.camel.support.DefaultExchange.setException(DefaultExchange.java:27)
											at org.apache.camel.support.processor.DelegateSyncProcessor.process(DelegateSyncProcessor.java:69)
											at org.apache.camel.processor.errorhandler.RedeliveryErrorHandler$RedeliveryTask.doRun(RedeliveryErrorHandler.java:780)
											at org.apache.camel.processor.errorhandler.RedeliveryErrorHandler$RedeliveryTask.run(RedeliveryErrorHandler.java:688)
											... 51 common frames omitted
										Caused by: java.lang.IncompatibleClassChangeError: Method 'org.apache.jena.util.FileManager org.apache.jena.util.FileManager.get()' must be InterfaceMethodref constant
											at org.apache.jena.riot.system.IO_JenaReaders.wireIntoJena(IO_JenaReaders.java:40)
											at org.apache.jena.riot.IO_Jena.wireIntoJena(IO_Jena.java:34)
											at org.apache.jena.riot.RIOT.init(RIOT.java:79)
											at org.apache.jena.riot.system.InitRIOT.start(InitRIOT.java:29)
											at org.apache.jena.sys.JenaSystem.lambda$init$2(JenaSystem.java:117)
											at java.base/java.util.ArrayList.forEach(ArrayList.java:1541)
											at org.apache.jena.sys.JenaSystem.forEach(JenaSystem.java:192)
											at org.apache.jena.sys.JenaSystem.forEach(JenaSystem.java:169)
											at org.apache.jena.sys.JenaSystem.init(JenaSystem.java:115)
											at org.apache.jena.rdf.model.ModelFactory.<clinit>(ModelFactory.java:48)
											at org.fcrepo.camel.processor.SparqlUpdateProcessor.process(SparqlUpdateProcessor.java:61)
											at org.apache.camel.support.processor.DelegateSyncProcessor.process(DelegateSyncProcessor.java:66)
											... 53 common frames omitted
									Caused by: java.lang.NoClassDefFoundError: Could not initialize class org.apache.jena.rdf.model.ModelFactory
										at org.fcrepo.camel.processor.SparqlUpdateProcessor.process(SparqlUpdateProcessor.java:61)
										at org.apache.camel.support.processor.DelegateSyncProcessor.process(DelegateSyncProcessor.java:66)
										... 52 common frames omitted
								Caused by: java.lang.NoClassDefFoundError: Could not initialize class org.apache.jena.rdf.model.ModelFactory
									at org.fcrepo.camel.processor.SparqlUpdateProcessor.process(SparqlUpdateProcessor.java:61)
									at org.apache.camel.support.processor.DelegateSyncProcessor.process(DelegateSyncProcessor.java:66)
									... 52 common frames omitted
							Caused by: java.lang.NoClassDefFoundError: Could not initialize class org.apache.jena.rdf.model.ModelFactory
								at org.fcrepo.camel.processor.SparqlUpdateProcessor.process(SparqlUpdateProcessor.java:61)
								at org.apache.camel.support.processor.DelegateSyncProcessor.process(DelegateSyncProcessor.java:66)
								... 52 common frames omitted
						Caused by: java.lang.NoClassDefFoundError: Could not initialize class org.apache.jena.rdf.model.ModelFactory
							at org.fcrepo.camel.processor.SparqlUpdateProcessor.process(SparqlUpdateProcessor.java:61)
							at org.apache.camel.support.processor.DelegateSyncProcessor.process(DelegateSyncProcessor.java:66)
							... 52 common frames omitted
					Caused by: java.lang.NoClassDefFoundError: Could not initialize class org.apache.jena.rdf.model.ModelFactory
						at org.fcrepo.camel.processor.SparqlUpdateProcessor.process(SparqlUpdateProcessor.java:61)
						at org.apache.camel.support.processor.DelegateSyncProcessor.process(DelegateSyncProcessor.java:66)
						... 52 common frames omitted
				Caused by: java.lang.NoClassDefFoundError: Could not initialize class org.apache.jena.rdf.model.ModelFactory
					at org.fcrepo.camel.processor.SparqlUpdateProcessor.process(SparqlUpdateProcessor.java:61)
					at org.apache.camel.support.processor.DelegateSyncProcessor.process(DelegateSyncProcessor.java:66)
					... 52 common frames omitted
			Caused by: java.lang.NoClassDefFoundError: Could not initialize class org.apache.jena.rdf.model.ModelFactory
				at org.fcrepo.camel.processor.SparqlUpdateProcessor.process(SparqlUpdateProcessor.java:61)
				at org.apache.camel.support.processor.DelegateSyncProcessor.process(DelegateSyncProcessor.java:66)
				... 52 common frames omitted
		Caused by: java.lang.NoClassDefFoundError: Could not initialize class org.apache.jena.rdf.model.ModelFactory
			at org.fcrepo.camel.processor.SparqlUpdateProcessor.process(SparqlUpdateProcessor.java:61)
			at org.apache.camel.support.processor.DelegateSyncProcessor.process(DelegateSyncProcessor.java:66)
			... 52 common frames omitted
	Caused by: java.lang.NoClassDefFoundError: Could not initialize class org.apache.jena.rdf.model.ModelFactory
		at org.fcrepo.camel.processor.SparqlUpdateProcessor.process(SparqlUpdateProcessor.java:61)
		at org.apache.camel.support.processor.DelegateSyncProcessor.process(DelegateSyncProcessor.java:66)
		... 52 common frames omitted
Caused by: java.lang.NoClassDefFoundError: Could not initialize class org.apache.jena.rdf.model.ModelFactory
	at org.fcrepo.camel.processor.SparqlUpdateProcessor.process(SparqlUpdateProcessor.java:61)
	at org.apache.camel.support.processor.DelegateSyncProcessor.process(DelegateSyncProcessor.java:66)
	... 52 common frames omitted
INFO 16:34:30.767 (TriplestoreRouter) Deleting Triplestore Object /file1
[ERROR] Tests run: 10, Failures: 0, Errors: 1, Skipped: 0, Time elapsed: 45.942 s <<< FAILURE! - in org.fcrepo.camel.indexing.triplestore.RouteTest
[ERROR] testUpdateRouter(org.fcrepo.camel.indexing.triplestore.RouteTest)  Time elapsed: 12.015 s  <<< ERROR!
org.apache.camel.CamelExecutionException: Exception occurred during execution on the exchange: Exchange[12D8486CA8AC056-0000000000000000]
	at org.fcrepo.camel.indexing.triplestore.RouteTest.testUpdateRouter(RouteTest.java:352)
Caused by: java.lang.NoClassDefFoundError: Could not initialize class org.apache.jena.rdf.model.ModelFactory
	at org.fcrepo.camel.indexing.triplestore.RouteTest.testUpdateRouter(RouteTest.java:352)

[INFO] 
[INFO] Results:
[INFO] 
[ERROR] Errors: 
[ERROR]   RouteTest.testUpdateRouter:352 » CamelExecution Exception occurred during exec...
[INFO] 
[ERROR] Tests run: 10, Failures: 0, Errors: 1, Skipped: 0
[INFO] 
[INFO] ------------------------------------------------------------------------
[INFO] Reactor Summary for Fedora Camel Workflows 6.0.0-SNAPSHOT:
[INFO] 
[INFO] Fedora Camel Workflows ............................. SUCCESS [  0.345 s]
[INFO] fcrepo-camel-common ................................ SUCCESS [  0.663 s]
[INFO] Fedora Repository Connector Service ................ SUCCESS [  0.921 s]
[INFO] Fedora Indexing Service with a Triplestore backend . FAILURE [ 47.759 s]
[INFO] Fedora ActiveMQ Service ............................ SKIPPED
[INFO] Fedora Re-indexing Service ......................... SKIPPED
[INFO] Fedora Indexing Service with a Solr backend ........ SKIPPED
[INFO] Fedora LDPath Service .............................. SKIPPED
[INFO] fcrepo-camel-toolbox-app ........................... SKIPPED
[INFO] ------------------------------------------------------------------------
[INFO] BUILD FAILURE
[INFO] ------------------------------------------------------------------------
[INFO] Total time:  50.216 s
[INFO] Finished at: 2023-01-17T16:34:51Z
[INFO] ------------------------------------------------------------------------
[ERROR] Failed to execute goal org.apache.maven.plugins:maven-surefire-plugin:2.22.1:test (default-test) on project fcrepo-indexing-triplestore: There are test failures.
[ERROR] 
[ERROR] Please refer to /home/gabsko/breaking-updates/fcrepo-indexing-triplestore/target/surefire-reports for the individual test results.
[ERROR] Please refer to dump files (if any exist) [date].dump, [date]-jvmRun[N].dump and [date].dumpstream.
[ERROR] -> [Help 1]
[ERROR] 
[ERROR] To see the full stack trace of the errors, re-run Maven with the -e switch.
[ERROR] Re-run Maven using the -X switch to enable full debug logging.
[ERROR] 
[ERROR] For more information about the errors and possible solutions, please read the following articles:
[ERROR] [Help 1] http://cwiki.apache.org/confluence/display/MAVEN/MojoFailureException
[ERROR] 
[ERROR] After correcting the problems, you can resume the build with the command
[ERROR]   mvn <args> -rf :fcrepo-indexing-triplestore
