[INFO] Scanning for projects...
[INFO] 
[INFO] -----------------------< pl.net.was:trino-faker >-----------------------
[INFO] Building trino-faker 0.7-SNAPSHOT
[INFO] ----------------------------[ trino-plugin ]----------------------------
[INFO] 
[INFO] --- maven-clean-plugin:3.0.0:clean (default-clean) @ trino-faker ---
[INFO] Deleting /home/gabsko/breaking-updates/target
[INFO] 
[INFO] --- trino-maven-plugin:11:check-spi-dependencies (default-check-spi-dependencies) @ trino-faker ---
[INFO] 
[INFO] --- maven-enforcer-plugin:3.0.0:enforce (default) @ trino-faker ---
[INFO] 
[INFO] --- dependency-scope-maven-plugin:0.10:check (default) @ trino-faker ---
[INFO] No test dependency scope issues found
[INFO] 
[INFO] --- license-maven-plugin:3.0:check (default) @ trino-faker ---
[INFO] Checking licenses...
[INFO] 
[INFO] --- maven-checkstyle-plugin:3.1.2:check (checkstyle) @ trino-faker ---
[INFO] You have 0 Checkstyle violations.
[INFO] 
[INFO] --- git-commit-id-plugin:4.0.5:revision (default) @ trino-faker ---
[INFO] 
[INFO] --- jacoco-maven-plugin:0.8.7:prepare-agent (default) @ trino-faker ---
[INFO] Skipping JaCoCo execution because property jacoco.skip is set.
[INFO] argLine set to empty
[INFO] 
[INFO] --- maven-resources-plugin:3.2.0:resources (default-resources) @ trino-faker ---
[INFO] Using 'UTF-8' encoding to copy filtered resources.
[INFO] Using 'UTF-8' encoding to copy filtered properties files.
[INFO] skip non existing resourceDirectory /home/gabsko/breaking-updates/src/main/resources
[INFO] 
[INFO] --- maven-compiler-plugin:3.9.0:compile (default-compile) @ trino-faker ---
[INFO] Changes detected - recompiling the module!
[INFO] Compiling 18 source files to /home/gabsko/breaking-updates/target/classes
[WARNING] Unable to autodetect 'javac' path, using 'javac' from the environment.
[INFO] 
[INFO] --- trino-maven-plugin:11:generate-service-descriptor (default-generate-service-descriptor) @ trino-faker ---
[INFO] Wrote pl.net.was.FakerPlugin to /home/gabsko/breaking-updates/target/trino-faker-0.7-SNAPSHOT-services.jar
[INFO] 
[INFO] --- maven-resources-plugin:3.2.0:testResources (default-testResources) @ trino-faker ---
[INFO] Using 'UTF-8' encoding to copy filtered resources.
[INFO] Using 'UTF-8' encoding to copy filtered properties files.
[INFO] skip non existing resourceDirectory /home/gabsko/breaking-updates/src/test/resources
[INFO] 
[INFO] --- maven-compiler-plugin:3.9.0:testCompile (default-testCompile) @ trino-faker ---
[INFO] Changes detected - recompiling the module!
[INFO] Compiling 2 source files to /home/gabsko/breaking-updates/target/test-classes
[WARNING] Unable to autodetect 'javac' path, using 'javac' from the environment.
[INFO] 
[INFO] --- maven-dependency-plugin:3.1.2:analyze-only (default) @ trino-faker ---
[INFO] No dependency problems found
[INFO] 
[INFO] --- maven-dependency-plugin:3.1.2:analyze-duplicate (default) @ trino-faker ---
[INFO] No duplicate dependencies found in <dependencies/> or in <dependencyManagement/>
[INFO] 
[INFO] --- duplicate-finder-maven-plugin:1.5.0:check (default) @ trino-faker ---
[INFO] Checking compile classpath
[INFO] Checking runtime classpath
[INFO] Checking test classpath
[INFO] 
[INFO] --- modernizer-maven-plugin:2.3.0:modernizer (modernizer) @ trino-faker ---
[INFO] Skipping modernizer execution!
[INFO] 
[INFO] --- maven-surefire-plugin:3.0.0-M5:test (default-test) @ trino-faker ---
[INFO] 
[INFO] -------------------------------------------------------
[INFO]  T E S T S
[INFO] -------------------------------------------------------
[INFO] Running pl.net.was.TestFakerQueries
2023-02-11T22:57:09.117+0000 INFO LogTestDurationListener enabled: false
2023-02-11T22:57:09.135+0000 INFO ProgressLoggingListener is disabled!
# WARNING: Unable to get Instrumentation. Dynamic Attach failed. You may add this JAR as -javaagent manually, or supply -Djdk.attach.allowAttachSelf
# WARNING: Unable to attach Serviceability Agent. You can try again with escalated privileges. Two options: a) use -Djol.tryWithSudo=true to try with sudo; b) echo 0 | sudo tee /proc/sys/kernel/yama/ptrace_scope
[ERROR] Tests run: 8, Failures: 1, Errors: 0, Skipped: 7, Time elapsed: 2.259 s <<< FAILURE! - in pl.net.was.TestFakerQueries
[ERROR] pl.net.was.TestFakerQueries.init  Time elapsed: 2.144 s  <<< FAILURE!
java.lang.NoSuchMethodError: 'int org.openjdk.jol.info.ClassLayout.instanceSize()'
	at io.airlift.stats.TDigest.<clinit>(TDigest.java:49)
	at io.airlift.stats.DecayTDigest.<init>(DecayTDigest.java:43)
	at io.airlift.stats.TimeDistribution.<init>(TimeDistribution.java:50)
	at io.airlift.stats.TimeStat.<init>(TimeStat.java:57)
	at io.airlift.stats.TimeStat.<init>(TimeStat.java:41)
	at io.airlift.http.client.RequestStats.<init>(RequestStats.java:41)
	at io.airlift.http.client.jetty.JettyHttpClient.<init>(JettyHttpClient.java:120)
	at io.airlift.http.client.HttpClientModule$HttpClientProvider.get(HttpClientModule.java:129)
	at io.airlift.http.client.HttpClientModule$HttpClientProvider.get(HttpClientModule.java:91)
	at com.google.inject.internal.ProviderInternalFactory.provision(ProviderInternalFactory.java:86)
	at com.google.inject.internal.InternalFactoryToInitializableAdapter.provision(InternalFactoryToInitializableAdapter.java:57)
	at com.google.inject.internal.ProviderInternalFactory$1.call(ProviderInternalFactory.java:67)
	at com.google.inject.internal.ProvisionListenerStackCallback$Provision.provision(ProvisionListenerStackCallback.java:109)
	at io.airlift.bootstrap.LifeCycleModule.provision(LifeCycleModule.java:54)
	at com.google.inject.internal.ProvisionListenerStackCallback$Provision.provision(ProvisionListenerStackCallback.java:117)
	at com.google.inject.internal.ProvisionListenerStackCallback.provision(ProvisionListenerStackCallback.java:66)
	at com.google.inject.internal.ProviderInternalFactory.circularGet(ProviderInternalFactory.java:62)
	at com.google.inject.internal.InternalFactoryToInitializableAdapter.get(InternalFactoryToInitializableAdapter.java:47)
	at com.google.inject.internal.ProviderToInternalFactoryAdapter.get(ProviderToInternalFactoryAdapter.java:40)
	at com.google.inject.internal.SingletonScope$1.get(SingletonScope.java:169)
	at com.google.inject.internal.InternalFactoryToProviderAdapter.get(InternalFactoryToProviderAdapter.java:45)
	at com.google.inject.internal.SingleParameterInjector.inject(SingleParameterInjector.java:40)
	at com.google.inject.internal.SingleParameterInjector.getAll(SingleParameterInjector.java:60)
	at com.google.inject.internal.ConstructorInjector.provision(ConstructorInjector.java:113)
	at com.google.inject.internal.ConstructorInjector.access$000(ConstructorInjector.java:33)
	at com.google.inject.internal.ConstructorInjector$1.call(ConstructorInjector.java:98)
	at com.google.inject.internal.ProvisionListenerStackCallback$Provision.provision(ProvisionListenerStackCallback.java:109)
	at io.airlift.bootstrap.LifeCycleModule.provision(LifeCycleModule.java:54)
	at com.google.inject.internal.ProvisionListenerStackCallback$Provision.provision(ProvisionListenerStackCallback.java:117)
	at com.google.inject.internal.ProvisionListenerStackCallback.provision(ProvisionListenerStackCallback.java:66)
	at com.google.inject.internal.ConstructorInjector.construct(ConstructorInjector.java:93)
	at com.google.inject.internal.ConstructorBindingImpl$Factory.get(ConstructorBindingImpl.java:300)
	at com.google.inject.internal.ProviderToInternalFactoryAdapter.get(ProviderToInternalFactoryAdapter.java:40)
	at com.google.inject.internal.SingletonScope$1.get(SingletonScope.java:169)
	at com.google.inject.internal.InternalFactoryToProviderAdapter.get(InternalFactoryToProviderAdapter.java:45)
	at com.google.inject.internal.SingleParameterInjector.inject(SingleParameterInjector.java:40)
	at com.google.inject.internal.SingleParameterInjector.getAll(SingleParameterInjector.java:60)
	at com.google.inject.internal.ConstructorInjector.provision(ConstructorInjector.java:113)
	at com.google.inject.internal.ConstructorInjector.access$000(ConstructorInjector.java:33)
	at com.google.inject.internal.ConstructorInjector$1.call(ConstructorInjector.java:98)
	at com.google.inject.internal.ProvisionListenerStackCallback$Provision.provision(ProvisionListenerStackCallback.java:109)
	at io.airlift.bootstrap.LifeCycleModule.provision(LifeCycleModule.java:54)
	at com.google.inject.internal.ProvisionListenerStackCallback$Provision.provision(ProvisionListenerStackCallback.java:117)
	at com.google.inject.internal.ProvisionListenerStackCallback.provision(ProvisionListenerStackCallback.java:66)
	at com.google.inject.internal.ConstructorInjector.construct(ConstructorInjector.java:93)
	at com.google.inject.internal.ConstructorBindingImpl$Factory.get(ConstructorBindingImpl.java:300)
	at com.google.inject.internal.FactoryProxy.get(FactoryProxy.java:60)
	at com.google.inject.internal.SingleParameterInjector.inject(SingleParameterInjector.java:40)
	at com.google.inject.internal.SingleParameterInjector.getAll(SingleParameterInjector.java:60)
	at com.google.inject.internal.SingleMethodInjector.inject(SingleMethodInjector.java:84)
	at com.google.inject.internal.MembersInjectorImpl.injectMembers(MembersInjectorImpl.java:146)
	at com.google.inject.internal.MembersInjectorImpl.injectAndNotify(MembersInjectorImpl.java:101)
	at com.google.inject.internal.Initializer$InjectableReference.get(Initializer.java:245)
	at com.google.inject.internal.Initializer.injectAll(Initializer.java:140)
	at com.google.inject.internal.InternalInjectorCreator.injectDynamically(InternalInjectorCreator.java:180)
	at com.google.inject.internal.InternalInjectorCreator.build(InternalInjectorCreator.java:113)
	at com.google.inject.Guice.createInjector(Guice.java:87)
	at io.airlift.bootstrap.Bootstrap.initialize(Bootstrap.java:268)
	at io.airlift.discovery.server.testing.TestingDiscoveryServer.<init>(TestingDiscoveryServer.java:54)
	at io.trino.testing.DistributedQueryRunner.<init>(DistributedQueryRunner.java:124)
	at io.trino.testing.DistributedQueryRunner$Builder.build(DistributedQueryRunner.java:768)
	at pl.net.was.FakerQueryRunner.createQueryRunner(FakerQueryRunner.java:45)
	at pl.net.was.TestFakerQueries.createQueryRunner(TestFakerQueries.java:29)
	at io.trino.testing.AbstractTestQueryFramework.init(AbstractTestQueryFramework.java:94)
	at java.base/jdk.internal.reflect.NativeMethodAccessorImpl.invoke0(Native Method)
	at java.base/jdk.internal.reflect.NativeMethodAccessorImpl.invoke(NativeMethodAccessorImpl.java:62)
	at java.base/jdk.internal.reflect.DelegatingMethodAccessorImpl.invoke(DelegatingMethodAccessorImpl.java:43)
	at java.base/java.lang.reflect.Method.invoke(Method.java:566)
	at org.testng.internal.invokers.MethodInvocationHelper.invokeMethod(MethodInvocationHelper.java:135)
	at org.testng.internal.invokers.MethodInvocationHelper.invokeMethodConsideringTimeout(MethodInvocationHelper.java:65)
	at org.testng.internal.invokers.ConfigInvoker.invokeConfigurationMethod(ConfigInvoker.java:381)
	at org.testng.internal.invokers.ConfigInvoker.invokeConfigurations(ConfigInvoker.java:319)
	at org.testng.internal.invokers.TestMethodWorker.invokeBeforeClassMethods(TestMethodWorker.java:178)
	at org.testng.internal.invokers.TestMethodWorker.run(TestMethodWorker.java:122)
	at java.base/java.util.ArrayList.forEach(ArrayList.java:1541)
	at org.testng.TestRunner.privateRun(TestRunner.java:808)
	at org.testng.TestRunner.run(TestRunner.java:603)
	at org.testng.SuiteRunner.runTest(SuiteRunner.java:429)
	at org.testng.SuiteRunner.runSequentially(SuiteRunner.java:423)
	at org.testng.SuiteRunner.privateRun(SuiteRunner.java:383)
	at org.testng.SuiteRunner.run(SuiteRunner.java:326)
	at org.testng.SuiteRunnerWorker.runSuite(SuiteRunnerWorker.java:52)
	at org.testng.SuiteRunnerWorker.run(SuiteRunnerWorker.java:95)
	at org.testng.TestNG.runSuitesSequentially(TestNG.java:1249)
	at org.testng.TestNG.runSuitesLocally(TestNG.java:1169)
	at org.testng.TestNG.runSuites(TestNG.java:1092)
	at org.testng.TestNG.run(TestNG.java:1060)
	at org.apache.maven.surefire.testng.TestNGExecutor.run(TestNGExecutor.java:136)
	at org.apache.maven.surefire.testng.TestNGDirectoryTestSuite.executeSingleClass(TestNGDirectoryTestSuite.java:112)
	at org.apache.maven.surefire.testng.TestNGDirectoryTestSuite.execute(TestNGDirectoryTestSuite.java:99)
	at org.apache.maven.surefire.testng.TestNGProvider.invoke(TestNGProvider.java:145)
	at org.apache.maven.surefire.booter.ForkedBooter.runSuitesInProcess(ForkedBooter.java:428)
	at org.apache.maven.surefire.booter.ForkedBooter.execute(ForkedBooter.java:162)
	at org.apache.maven.surefire.booter.ForkedBooter.run(ForkedBooter.java:562)
	at org.apache.maven.surefire.booter.ForkedBooter.main(ForkedBooter.java:548)

[INFO] 
[INFO] Results:
[INFO] 
[ERROR] Failures: 
[ERROR]   TestFakerQueries>AbstractTestQueryFramework.init:94->createQueryRunner:29 » NoSuchMethod
[INFO] 
[ERROR] Tests run: 8, Failures: 1, Errors: 0, Skipped: 7
[INFO] 
[INFO] ------------------------------------------------------------------------
[INFO] BUILD FAILURE
[INFO] ------------------------------------------------------------------------
[INFO] Total time:  12.879 s
[INFO] Finished at: 2023-02-11T22:57:11Z
[INFO] ------------------------------------------------------------------------
[ERROR] Failed to execute goal org.apache.maven.plugins:maven-surefire-plugin:3.0.0-M5:test (default-test) on project trino-faker: There are test failures.
[ERROR] 
[ERROR] Please refer to /home/gabsko/breaking-updates/target/surefire-reports for the individual test results.
[ERROR] Please refer to dump files (if any exist) [date].dump, [date]-jvmRun[N].dump and [date].dumpstream.
[ERROR] -> [Help 1]
[ERROR] 
[ERROR] To see the full stack trace of the errors, re-run Maven with the -e switch.
[ERROR] Re-run Maven using the -X switch to enable full debug logging.
[ERROR] 
[ERROR] For more information about the errors and possible solutions, please read the following articles:
[ERROR] [Help 1] http://cwiki.apache.org/confluence/display/MAVEN/MojoFailureException
